name;main_category;sub_category;image;link;ratings;no_of_ratings;discount_price;actual_price;brand
Pravyta Sports Fitness Gym Motivational Modern Water Jug Kawaii Water Bottle with Straw and Shoulder Strap and Stickers fo...;home & kitchen;Kitchen Storage & Containers;https://m.media-amazon.com/images/I/71mr+c-HxrL._AC_UL320_.jpg;https://www.amazon.in/Pravyta-Water-Jug-Shoulder-Strap/dp/B0B17H8N5L/ref=sr_1_4558?qid=1679212818&s=kitchen&sr=1-4558;3.9;8.0;699.0;1299.0;Pravyta
Ikea TORKAD Kitchen roll Holder, Silver-Colour with TSS Cotton Balls (5 Pieces);home & kitchen;Kitchen Storage & Containers;https://m.media-amazon.com/images/I/31sgWcf4UUL._AC_UL320_.jpg;https://www.amazon.in/Ikea-TORKAD-Kitchen-Holder-Silver-Colour/dp/B07SGQ2D1Q/ref=sr_1_4559_mod_primary_new?qid=1679212818&s=kitchen&sbo=RZvfv%2F%2FHxDF%2BO5021pAnSA%3D%3D&sr=1-4559;4.1;222.0;;380.0;Ikea
DeLegarde ® Plastic Round Containers Boxes for Small Parts Storage (Small, Semi Transparent, 10ml )-Pack of 12;home & kitchen;Kitchen Storage & Containers;https://m.media-amazon.com/images/I/51JTsdQ65pL._AC_UL320_.jpg;https://www.amazon.in/DeLegarde%C2%AE-Plastic-Transparent-Containers-Storage/dp/B08YZ3JQHP/ref=sr_1_4560?qid=1679212818&s=kitchen&sr=1-4560;4.1;23.0;109.0;199.0;DeLegarde
ZOKIXTO New Stainless Steel Vacuum Insulated Travel Tea and Coffee Mug -Insulated Cup for Hot & Cold Drinks, Travel Thermo...;home & kitchen;Kitchen Storage & Containers;https://m.media-amazon.com/images/I/61Hz8pIWgQL._AC_UL320_.jpg;https://www.amazon.in/ZOKIXTO-Stainless-Insulated-Insulated-Black/dp/B0B8YYP1RS/ref=sr_1_4777?qid=1679212824&s=kitchen&sr=1-4777;3.8;56.0;759.0;1299.0;ZOKIXTO
CEUTA Jute Wine Bottle Gift Bag/Bottle Carry Bag/Water Bottle Cover-Water Bottle Beg for Men & Women (Pack of 1_Multi Color);home & kitchen;Kitchen Storage & Containers;https://m.media-amazon.com/images/I/61npU9eMc0L._AC_UL320_.jpg;https://www.amazon.in/CEUTA-Bottle-Carry-Cover-Water-1_Multi/dp/B09MBF3GTB/ref=sr_1_4778?qid=1679212824&s=kitchen&sr=1-4778;4.2;24.0;166.0;1299.0;CEUTA
Netravya Sink Stainer, Kitchen Sink Organizer, Utensil Basket for Kitchen, Sink Drainer, Sink Basket, Plastic Storage Corn...;home & kitchen;Kitchen Storage & Containers;https://m.media-amazon.com/images/I/61og9dHrzPL._AC_UL320_.jpg;https://www.amazon.in/Netravya-Sink-Organizer-Drainer-Multi-Color/dp/B0BL7KX78Z/ref=sr_1_4779?qid=1679212824&s=kitchen&sr=1-4779;3.0;3.0;169.0;499.0;Netravya
YHK Glass 270 ML Square Fancy Food Storage Containers Set , Airtight Food Jars with Bamboo Wooden Lids -Kitchen Canisters ...;home & kitchen;Kitchen Storage & Containers;https://m.media-amazon.com/images/I/51HJPkPwNkL._AC_UL320_.jpg;https://www.amazon.in/YHK-Containers-Airtight-Kitchen-Canisters/dp/B0BM52LSJC/ref=sr_1_4780?qid=1679212824&s=kitchen&sr=1-4780;4.7;6.0;499.0;790.0;YHK
Ikea Two Type Lid Spice Jar, Glass/Black 15 cl - 4 Pack;home & kitchen;Kitchen Storage & Containers;https://m.media-amazon.com/images/I/51JkNJ-YU1L._AC_UL320_.jpg;https://www.amazon.in/IKEA-Type-Spice-Glass-Black/dp/B09PR8KLNL/ref=sr_1_4781?qid=1679212824&s=kitchen&sr=1-4781;4.6;8.0;545.0;799.0;Ikea
Oxi Fresh Cling Film 100 Meters;home & kitchen;Kitchen Storage & Containers;https://m.media-amazon.com/images/I/31cRvQccyeL._AC_UL320_.jpg;https://www.amazon.in/Oxi-Fresh-Cling-Film-Meters/dp/B09ST6CXQK/ref=sr_1_4782?qid=1679212824&s=kitchen&sr=1-4782;3.6;16.0;279.0;299.0;Oxi
3 Layer Storage Organizer Slim Rack Shelf with Wheels for Easy Movement | Durable Plastic, white;home & kitchen;Kitchen Storage & Containers;https://m.media-amazon.com/images/I/61sfLvpzYeL._AC_UL320_.jpg;https://www.amazon.in/Storage-Organizer-Movement-Durable-Plastic/dp/B0BC3PW6BN/ref=sr_1_4783?qid=1679212824&s=kitchen&sr=1-4783;4.4;6.0;499.0;3399.0;3
Mivana 350ml Stainless Steel Canister Glass Jar with Lid,Premium Pantry Organizers Containers and Perfect kitchen Storage ...;home & kitchen;Kitchen Storage & Containers;https://m.media-amazon.com/images/I/81VNgDbKRZS._AC_UL320_.jpg;https://www.amazon.in/Mivana-Stainless-Canister-Organizers-Containers/dp/B0937FQ31K/ref=sr_1_4784?qid=1679212824&s=kitchen&sr=1-4784;4.6;28.0;1395.0;1599.0;Mivana
ANJALIMIX NutriMiracle Bullet Jar Set of 2 (530 ML & 350 ML);home & kitchen;Kitchen Storage & Containers;https://m.media-amazon.com/images/I/71V7BrwwOHL._AC_UL320_.jpg;https://www.amazon.in/Anjalimix-NutriMiracle-Bullet-Jar-Set/dp/B07NCX8MN3/ref=sr_1_4785?qid=1679212824&s=kitchen&sr=1-4785;3.6;779.0;962.0;1400.0;ANJALIMIX
MINISO Large Capacity Plastic Cool Water Bottle with Pop-up Lip and Shoulder Strap,We Bare Bears Collection 4.0,with Diy S...;home & kitchen;Kitchen Storage & Containers;https://m.media-amazon.com/images/I/51u4CSDB3rL._AC_UL320_.jpg;https://www.amazon.in/MINISO-Capacity-Shoulder-Collection-Stickers-1300mL/dp/B0BFFC7K1T/ref=sr_1_4786?qid=1679212824&s=kitchen&sr=1-4786;5.0;3.0;585.0;650.0;MINISO
MARKET 99 Tea Kitchen Jar, Food Storage Canister, Container Yellow - 900 Ml;home & kitchen;Kitchen Storage & Containers;https://m.media-amazon.com/images/I/6133oxXWy+L._AC_UL320_.jpg;https://www.amazon.in/99-Kitchen-Storage-Canister-Container/dp/B09QC5NNR2/ref=sr_1_4787?qid=1679212824&s=kitchen&sr=1-4787;4.4;8.0;389.0;1049.0;MARKET
Borosil Crysto Borosilicate Glass Water Bottles, Set of 3 (750 ml each) with Wide Mouth & Stainless Steel Lid, Clear;home & kitchen;Kitchen Storage & Containers;https://m.media-amazon.com/images/I/51JJoR5HuzL._AC_UL320_.jpg;https://www.amazon.in/Borosil-Crysto-Borosilicate-Bottle-Stainless/dp/B08KGFGH2V/ref=sr_1_4788?qid=1679212824&s=kitchen&sr=1-4788;4.0;24.0;1125.0;1575.0;Borosil
miRim Multi-Ply Masala Box - 1000 Ml, Multicolour;home & kitchen;Kitchen Storage & Containers;https://m.media-amazon.com/images/I/613kpwVkwlL._AC_UL320_.jpg;https://www.amazon.in/MIR-Woven-Gemini-Masala-Rangoli/dp/B07M7KPNJB/ref=sr_1_4789?qid=1679212824&s=kitchen&sr=1-4789;4.2;560.0;299.0;499.0;miRim
SHIOK DECOR® 2-Tier Standing Rack- Kitchen|Bathroom Countertop Storage Shelf Organizer- Black (Make in Bharat);home & kitchen;Kitchen Storage & Containers;https://m.media-amazon.com/images/I/51B9MCswHCS._AC_UL320_.jpg;https://www.amazon.in/2-Tier-Standing-Bathroom-Countertop-Organizer/dp/B097R86VT7/ref=sr_1_4790?qid=1679212824&s=kitchen&sr=1-4790;4.1;17.0;739.0;1499.0;SHIOK
Worthy Shoppee Microwave Stand, Kitchen Platform Oven Stand Rack, Toaster Organizer with Storage Shelf Wood and Metal Brow...;home & kitchen;Kitchen Storage & Containers;https://m.media-amazon.com/images/I/61Vyzj4+n5L._AC_UL320_.jpg;https://www.amazon.in/Worthy-Shoppee-Microwave-Platform-Organizer/dp/B0BLVKN8JD/ref=sr_1_4791?qid=1679212824&s=kitchen&sr=1-4791;3.6;15.0;1699.0;4999.0;Worthy
Earthy Fab Japanese Bento Bag, Vegetable Storage Fridge Bags, Grocery Storage Bags, 100% Cotton Eco-Product, Reusable. Set...;home & kitchen;Kitchen Storage & Containers;https://m.media-amazon.com/images/I/71IQxUxjvPL._AC_UL320_.jpg;https://www.amazon.in/Earthy-Fab-Vegetable-Eco-Friendly-Reusable/dp/B08625MPQ3/ref=sr_1_4792?qid=1679212824&s=kitchen&sr=1-4792;4.8;16.0;549.0;1500.0;Earthy
Tupperware Eco 750 ml flip top bottle set of 2pc - Silver;home & kitchen;Kitchen Storage & Containers;https://m.media-amazon.com/images/I/41lX+PNYKjL._AC_UL320_.jpg;https://www.amazon.in/Tupperware-Eco-750-flip-bottle/dp/B09JN2TJ8J/ref=sr_1_4793?qid=1679212824&s=kitchen&sr=1-4793;4.4;67.0;1299.0;1499.0;Tupperware
Geo Fashion 2 Tier 24 in Pan Rack for Kitchen Wall Mounted Pot Organizer with 12 S-Hooks Heavy-Duty Matte Black, (Metal);home & kitchen;Kitchen Storage & Containers;https://m.media-amazon.com/images/I/61eUzPT2OpL._AC_UL320_.jpg;https://www.amazon.in/Geo-Fashion-Kitchen-Organizer-Heavy-Duty/dp/B0BL2TCSVF/ref=sr_1_4794?qid=1679212824&s=kitchen&sr=1-4794;3.5;4.0;999.0;2999.0;Geo
Tupperware Plastic Utility Freezer Container 2.5 L (Multicolor);home & kitchen;Kitchen Storage & Containers;https://m.media-amazon.com/images/I/21XAVf-8+NL._AC_UL320_.jpg;https://www.amazon.in/Tupperware-Plastic-Utility-Container-Multicolor/dp/B09SV7QS3H/ref=sr_1_4795?qid=1679212824&s=kitchen&sr=1-4795;4.8;7.0;745.0;850.0;Tupperware
CITY ENTERPRISES Sheesham Wooden Table Top Masala Dabba Containers Jars for Kitchen Wooden Spice Box with Spoon (9 Small P...;home & kitchen;Kitchen Storage & Containers;https://m.media-amazon.com/images/I/81JUPtQlDqL._AC_UL320_.jpg;https://www.amazon.in/CITY-ENTERPRISES-Containers-Partitions-Detachable/dp/B0BTPKL5NW/ref=sr_1_4796?qid=1679212824&s=kitchen&sr=1-4796;5.0;4.0;698.0;1299.0;CITY
HAZEL Airtight Container Tiffin Box for Kids | Rectangle Lunch Boxes, 400 ML | Stainless Steel Storage Organizer | Steel F...;home & kitchen;Kitchen Storage & Containers;https://m.media-amazon.com/images/I/51R7w3Za8JL._AC_UL320_.jpg;https://www.amazon.in/Stainless-Airtight-Container-Leakproof-Storage/dp/B08RS6HJ34/ref=sr_1_4797?qid=1679212824&s=kitchen&sr=1-4797;4.1;270.0;529.0;599.0;HAZEL
TREO by Milton Glass Jar- 2350 ml, Transparent;home & kitchen;Kitchen Storage & Containers;https://m.media-amazon.com/images/I/81Ct9pHRmfL._AC_UL320_.jpg;https://www.amazon.in/TREO-Square-Glass-Storage-2350/dp/B07VHCNNZX/ref=sr_1_4798?qid=1679212824&s=kitchen&sr=1-4798;4.1;88.0;364.0;480.0;TREO
Sparrow Bags Insulated Travel Lunch Tiffin Storage Nylon Bag Leakproof Hot Cold forMen Women Unisex Kids, Office, College,...;home & kitchen;Kitchen Storage & Containers;https://m.media-amazon.com/images/I/81BWXsyA8VL._AC_UL320_.jpg;https://www.amazon.in/Sparrow-Insulated-Storage-Leakproof-College/dp/B0BTW421H4/ref=sr_1_4799?qid=1679212824&s=kitchen&sr=1-4799;;;299.0;899.0;Sparrow
BAJARIYA ENTERPRISES 900ML Sport Motivation Water Bottle with Time Marker & Straw, Drinking Bottle for School Fitness;home & kitchen;Kitchen Storage & Containers;https://m.media-amazon.com/images/I/71lQOObEICL._AC_UL320_.jpg;https://www.amazon.in/BAJARIYA-ENTERPRISES-Motivation-Drinking-Fitness/dp/B0BSBVMBKN/ref=sr_1_4800?qid=1679212824&s=kitchen&sr=1-4800;;;310.0;999.0;BAJARIYA
WOOD CAFE Sheesham Wood Handcrafted Dry Fruit Tray with 3 Glass Container Set with Glass Lid , Serving Dry Fruit Glass Con...;home & kitchen;Kitchen Storage & Containers;https://m.media-amazon.com/images/W/IMAGERENDERING_521856-T2/images/I/713VNN33ZtL._AC_UL320_.jpg;https://www.amazon.in/WOOD-CAFE-Handcrafted-Container-Decoration/dp/B0B156JWYJ/ref=sr_1_4873?qid=1679212827&s=kitchen&sr=1-4873;3.9;25.0;970.0;1599.0;WOOD
Decorlay Iron 2-Tier Multi storage/Multipurpose kitchen accessories items rack Kitchen Organizer Spice Rack Bartan Stand K...;home & kitchen;Kitchen Storage & Containers;https://m.media-amazon.com/images/W/IMAGERENDERING_521856-T2/images/I/61zT1scx9sL._AC_UL320_.jpg;https://www.amazon.in/Decorlay-Storage-Organizer-Kitchen-33x13x28/dp/B08PKWK29H/ref=sr_1_4874?qid=1679212827&s=kitchen&sr=1-4874;4.2;349.0;597.0;1899.0;Decorlay
Onicron 360° Rotating Kitchen Organizer Tray Lazy Susan Rack Multi-Purpose Kitchen Storage Revolving Tray Cosmetic Organiz...;home & kitchen;Kitchen Storage & Containers;https://m.media-amazon.com/images/W/IMAGERENDERING_521856-T2/images/I/61bsp6lsf8L._AC_UL320_.jpg;https://www.amazon.in/Onicron-Rotating-Organizer-Multi-Purpose-Revolving/dp/B09SZG2V17/ref=sr_1_4875_mod_primary_new?qid=1679212827&s=kitchen&sbo=RZvfv%2F%2FHxDF%2BO5021pAnSA%3D%3D&sr=1-4875;4.3;218.0;199.0;499.0;Onicron
Upyogh Bio-Cling Film Wrap Food Packaging Storing Wrap - 300 Meter Roll (1);home & kitchen;Kitchen Storage & Containers;https://m.media-amazon.com/images/W/IMAGERENDERING_521856-T2/images/I/71x4J03DxtL._AC_UL320_.jpg;https://www.amazon.in/Upyogh-Bio-Cling-Film-Packaging-Storing/dp/B0BSQZHLD6/ref=sr_1_4876?qid=1679212827&s=kitchen&sr=1-4876;3.0;2.0;599.0;1599.0;Upyogh
Polylab Polyethylene Wash Bottles Size - (500 ml, White) - Pack of 6;home & kitchen;Kitchen Storage & Containers;https://m.media-amazon.com/images/W/IMAGERENDERING_521856-T2/images/I/511bl0x19cL._AC_UL320_.jpg;https://www.amazon.in/Polylab-Wash-Bottles-Size-White/dp/B07CYPMGKF/ref=sr_1_4877?qid=1679212827&s=kitchen&sr=1-4877;4.5;37.0;314.0;698.0;Polylab
SAJANI Double Decker Lunch Boxes with FILP Lid // Lunch Box with Spoon and Chopstick // Tiffin Box for Kids, School, Offic...;home & kitchen;Kitchen Storage & Containers;https://m.media-amazon.com/images/W/IMAGERENDERING_521856-T2/images/I/41csm2hRvlL._AC_UL320_.jpg;https://www.amazon.in/SAJANI-Double-Chopstick-Outdoor-Multicolor/dp/B0BY5869WM/ref=sr_1_4878?qid=1679212827&s=kitchen&sr=1-4878;;;299.0;599.0;SAJANI
Signoraware Chapati Steel Container 2liter with Steam release knob, Set of 1, 2000ml, Purple (Stainless Steel);home & kitchen;Kitchen Storage & Containers;https://m.media-amazon.com/images/W/IMAGERENDERING_521856-T2/images/I/519aGAFEwgL._AC_UL320_.jpg;https://www.amazon.in/Signoraware-Steel-Lunch-850ml-Yellow/dp/B07TQN9SYT/ref=sr_1_4879?qid=1679212827&s=kitchen&sr=1-4879;4.3;110.0;463.0;545.0;Signoraware
SKYFUN (LABEL) Food Grade Plastic Refrigerator Freezer Pantry Kitchen Office Stationary Storage Basket Organizer Jar with ...;home & kitchen;Kitchen Storage & Containers;https://m.media-amazon.com/images/W/IMAGERENDERING_521856-T2/images/I/61MiidZpJrL._AC_UL320_.jpg;https://www.amazon.in/Skyfun-Plastic-Refrigerator-Freezer-Organizer/dp/B07FYCHGSZ/ref=sr_1_4880?qid=1679212827&s=kitchen&sr=1-4880;4.1;474.0;398.0;699.0;SKYFUN
UR LITTLE SHOP Fridge Vegetable Storage Net Bag_Fruits Storage Bag_Net Fridge_ Reusable Net Bag Pack of 12 Multi Color wit...;home & kitchen;Kitchen Storage & Containers;https://m.media-amazon.com/images/W/IMAGERENDERING_521856-T2/images/I/81QFj+d12iL._AC_UL320_.jpg;https://www.amazon.in/UR-LITTLE-SHOP-Bag_Fruits-Knife_Peeler/dp/B08LJRLGMT/ref=sr_1_4881?qid=1679212827&s=kitchen&sr=1-4881;3.8;126.0;179.0;399.0;UR
Cello Cop-Pura Neer Copper Water Bottle, 1000 milliliters,Pack of 1, Copper;home & kitchen;Kitchen Storage & Containers;https://m.media-amazon.com/images/W/IMAGERENDERING_521856-T2/images/I/61Wu0F2-V+L._AC_UL320_.jpg;https://www.amazon.in/Cello-Cop-Pura-Copper-Bottle-CLO_NEER_CPPRBTTLE_1l/dp/B08MPYW7B8/ref=sr_1_4882?qid=1679212827&s=kitchen&sr=1-4882;3.7;751.0;929.0;1099.0;Cello
BagsRUs Polyester 6.7 L Royal Blue Portable Cooler Bag with Ice Pack;home & kitchen;Kitchen Storage & Containers;https://m.media-amazon.com/images/W/IMAGERENDERING_521856-T2/images/I/81pOG8ZJhAL._AC_UL320_.jpg;https://www.amazon.in/BagsRUs-Polyester-Royal-Portable-Cooler/dp/B00VWZV1TQ/ref=sr_1_4883?qid=1679212827&s=kitchen&sr=1-4883;4.4;91.0;828.0;2150.0;BagsRUs
Amazon Brand - Solimo Microwave Safe Two Compartment Lunch Box Set for Office with Bag | Borosilicate Glass | Safety Lock ...;home & kitchen;Kitchen Storage & Containers;https://m.media-amazon.com/images/W/IMAGERENDERING_521856-T2/images/I/71baCI5M9hL._AC_UL320_.jpg;https://www.amazon.in/Amazon-Brand-Solimo-Borosilicate-Glass/dp/B0B9HY8NHN/ref=sr_1_4884?qid=1679212827&s=kitchen&sr=1-4884;;;659.0;1199.0;Amazon
SmartSlide 3 Tier Adjustable Metal Rack, Kitchen Storage Shelves, Microwave Oven Stand, Folding Kitchen Rack, Boltless Sto...;home & kitchen;Kitchen Storage & Containers;https://m.media-amazon.com/images/W/IMAGERENDERING_521856-T2/images/I/61-DmfvkavS._AC_UL320_.jpg;https://www.amazon.in/SmartSlide-Adjustable-Shelves-Microwave-Organizer/dp/B094QJYDQQ/ref=sr_1_4885?qid=1679212827&s=kitchen&sr=1-4885;3.8;55.0;2099.0;6199.0;SmartSlide
Veigo Lock N Steel 100% Air Tight 2 Pcs Jumbo and Small Containers (Dark Blue);home & kitchen;Kitchen Storage & Containers;https://m.media-amazon.com/images/W/IMAGERENDERING_521856-T2/images/I/61EirK4TJbL._AC_UL320_.jpg;https://www.amazon.in/Veigo-Steel-Tight-Jumbo-Containers/dp/B07RG5M8DD/ref=sr_1_4886?qid=1679212827&s=kitchen&sr=1-4886;4.0;830.0;456.0;821.0;Veigo
Wolpin plastic Fridge Storage Containers (Set of 3 Pcs) Food Refrigerator Organizer Container with Handle & Lid for Fruit...;home & kitchen;Kitchen Storage & Containers;https://m.media-amazon.com/images/W/IMAGERENDERING_521856-T2/images/I/61scaGAogdL._AC_UL320_.jpg;https://www.amazon.in/Containers-Refrigerator-Organizer-Container-Vegetables/dp/B0B2DMCFYJ/ref=sr_1_4887?qid=1679212827&s=kitchen&sr=1-4887;3.8;12.0;439.0;799.0;Wolpin
WRAP ON Pack Of 75pcs. Aluminum Disposable Jars/Containers | 660ML | Lid Cover Included | For Packing, Storing, Takeaway |...;home & kitchen;Kitchen Storage & Containers;https://m.media-amazon.com/images/W/IMAGERENDERING_521856-T2/images/I/714DkMVfDrL._AC_UL320_.jpg;https://www.amazon.in/Wrap-Aluminium-Silver-Storage-Containers/dp/B08BWJXV83/ref=sr_1_4888?qid=1679212827&s=kitchen&sr=1-4888;3.7;48.0;439.0;999.0;WRAP
MILTON Thermosteel Legend 3 Container Stainless Steel Tiffin Lunch Box 3 Containers Lunch Box (600 ml, Thermoware);home & kitchen;Kitchen Storage & Containers;https://m.media-amazon.com/images/W/IMAGERENDERING_521856-T2/images/I/31xvrtvCEOL._AC_UL320_.jpg;https://www.amazon.in/MILTON-Thermosteel-Container-Containers-Thermoware/dp/B0BP2MDTSD/ref=sr_1_4889?qid=1679212827&s=kitchen&sr=1-4889;1.0;1.0;884.0;1049.0;MILTON
Contigo Ashland Autospout Water Bottle with Flip Straw, Large BPA Free Drinking Bottle, Sports Flask, Leakproof Gym Bottl...;home & kitchen;Kitchen Storage & Containers;https://m.media-amazon.com/images/W/IMAGERENDERING_521856-T2/images/I/618Pyme4O3L._AC_UL320_.jpg;https://www.amazon.in/Contigo-Ashland-Autospout-Drinking-Leakproof/dp/B07TN8T4D5/ref=sr_1_4890?qid=1679212827&s=kitchen&sr=1-4890;4.6;2079.0;1249.0;1499.0;Contigo
MosQuick® 4 Layer Slim Space Saving Trolley with Drawer;home & kitchen;Kitchen Storage & Containers;https://m.media-amazon.com/images/W/IMAGERENDERING_521856-T2/images/I/61gXYL2tsKL._AC_UL320_.jpg;https://www.amazon.in/MosQuick%C2%AE-Layer-Saving-Trolley-Drawer/dp/B09KL4P91G/ref=sr_1_4891?qid=1679212827&s=kitchen&sr=1-4891;3.9;3.0;4399.0;7000.0;MosQuick®
Raavi colors Insulated Lunch Bag for Office Men, Women and Kids, Anti-lint Tiffin Bags for School, Picnic, Work, Carry Bag...;home & kitchen;Kitchen Storage & Containers;https://m.media-amazon.com/images/W/IMAGERENDERING_521856-T2/images/I/71zHpc7kbeL._AC_UL320_.jpg;https://www.amazon.in/Raavi-colors-Insulated-Office-Anti-lint/dp/B09XHRYMTY/ref=sr_1_4892?qid=1679212827&s=kitchen&sr=1-4892;4.4;31.0;649.0;1500.0;Raavi
Nayasa Superplast Plastic Fontana PET Bottle 1.5 Litre, Set of 6, Blue and Pink;home & kitchen;Kitchen Storage & Containers;https://m.media-amazon.com/images/W/IMAGERENDERING_521856-T2/images/I/410K3zp8JlL._AC_UL320_.jpg;https://www.amazon.in/Nayasa-Superplast-Plastic-Fontana-Bottle/dp/B07BQ5CCJL/ref=sr_1_4893_mod_primary_new?qid=1679212827&s=kitchen&sbo=RZvfv%2F%2FHxDF%2BO5021pAnSA%3D%3D&sr=1-4893;4.4;235.0;580.0;900.0;Nayasa
Heart Home Lunch Bag|Reusable Jute Fabric Tote Bag|Lunch Date Print Tiffin Carry Hand bag with Handle For office,School,Gi...;home & kitchen;Kitchen Storage & Containers;https://m.media-amazon.com/images/W/IMAGERENDERING_521856-T2/images/I/81EHZxHM3NL._AC_UL320_.jpg;https://www.amazon.in/Heart-Home-Reusable-Fabric-Tiffin/dp/B0BHW32BVW/ref=sr_1_4894?qid=1679212827&s=kitchen&sr=1-4894;;;189.0;499.0;Heart
Philocaly Enterprise 3 Layer Kitchen Rack Stand Fruits Vegetable Rack Storage Household Office Rack Storage Stand (Random ...;home & kitchen;Kitchen Storage & Containers;https://m.media-amazon.com/images/W/IMAGERENDERING_521856-T2/images/I/61E+rgNMsyL._AC_UL320_.jpg;https://www.amazon.in/Philocaly-Enterprise-Kitchen-Vegetable-Household/dp/B0BJ7NL9XM/ref=sr_1_4895?qid=1679212827&s=kitchen&sr=1-4895;3.2;32.0;329.0;999.0;Philocaly
ExclusiveLane Sheesham Wooden Table Top Masala Dabba Containers Jars for Kitchen Wooden Spice Box with Spoon (9 Small Part...;home & kitchen;Kitchen Storage & Containers;https://m.media-amazon.com/images/W/IMAGERENDERING_521856-T2/images/I/71gX0zGlgRL._AC_UL320_.jpg;https://www.amazon.in/ExclusiveLane-Spice-Container-Spoon-Sheesham/dp/B01JGLYKPY/ref=sr_1_4896?qid=1679212827&s=kitchen&sr=1-4896;3.8;149.0;1204.0;1599.0;ExclusiveLane
Wrap On Cling Wrap for Food Wrapping, Breathable Oxywrap Cling Film 600 meter | Biodegradable Cling Film Roll | Super Save...;home & kitchen;Kitchen Storage & Containers;https://m.media-amazon.com/images/I/61hrhCGTgpL._AC_UL320_.jpg;https://www.amazon.in/Wrap-Bio-Multipurpose-Breathable-Cling-Restaurants/dp/B09Y9121LQ/ref=sr_1_5281?qid=1679212833&s=kitchen&sr=1-5281;4.5;8.0;829.0;1599.0;Wrap
AB99 COLLECTION Big Stainless Steel 2 Layer Kitchen Spice Rack, Modular Kitchen Storage Rack, Kitchen Organizer Multipurpo...;home & kitchen;Kitchen Storage & Containers;https://m.media-amazon.com/images/I/51FsOMxVRpL._AC_UL320_.jpg;https://www.amazon.in/AB99-COLLECTION-Stainless-Organizer-Multipurpose/dp/B0BNHQSY87/ref=sr_1_5282?qid=1679212833&s=kitchen&sr=1-5282;3.0;3.0;389.0;999.0;AB99
Milton Cube 4 Lunch Box, 300 ml, Set of 4, Red;home & kitchen;Kitchen Storage & Containers;https://m.media-amazon.com/images/I/81dTbiJp9SL._AC_UL320_.jpg;https://www.amazon.in/Milton-Cube-Lunch-Box-300/dp/B07SYVK9R5/ref=sr_1_5283?qid=1679212833&s=kitchen&sr=1-5283;4.0;94.0;761.0;1015.0;Milton
MARKET 99 VON Casa Mild Steel Airtight, Countertop Storage Jar , Red;home & kitchen;Kitchen Storage & Containers;https://m.media-amazon.com/images/I/5106qLEFMoL._AC_UL320_.jpg;https://www.amazon.in/Market99-Kitchen-Airtight-Countertop-Storage/dp/B08W1WZF5X/ref=sr_1_5284?qid=1679212833&s=kitchen&sr=1-5284;3.9;14.0;498.0;899.0;MARKET
Bee Organik 6pcs Small Glass jar 40 gms | 50 ml for storing or making candles & Lip Balms | Golden Lid;home & kitchen;Kitchen Storage & Containers;https://m.media-amazon.com/images/I/515MBOxWNDS._AC_UL320_.jpg;https://www.amazon.in/Bee-Organik-storing-making-candles/dp/B08FF68J62/ref=sr_1_5285?qid=1679212833&s=kitchen&sr=1-5285;4.0;55.0;232.0;600.0;Bee
Home Centre Spinel Solid Storage Containers - Set of 5, Blue;home & kitchen;Kitchen Storage & Containers;https://m.media-amazon.com/images/I/61gb+hcxlXL._AC_UL320_.jpg;https://www.amazon.in/Home-Centre-Spinel-Storage-Containers/dp/B089BKCQDS/ref=sr_1_5286?qid=1679212833&s=kitchen&sr=1-5286;4.3;73.0;;399.0;Home
VEWIKZY | Fridge Storage Boxes Fridge Organizer with Removable Drain Plate and Lid | Stackable Fridge Storage Containers f...;home & kitchen;Kitchen Storage & Containers;https://m.media-amazon.com/images/I/71lOQaAs37L._AC_UL320_.jpg;https://www.amazon.in/VEWIKZY-Organizer-Removable-Containers-Vegetables/dp/B09VZFR5CS/ref=sr_1_5287?qid=1679212833&s=kitchen&sr=1-5287;4.2;23.0;269.0;999.0;VEWIKZY
FATMUG Canvas Lunch Bag for Office Women Men School Kids Eco Friendly- Charcoal Black;home & kitchen;Kitchen Storage & Containers;https://m.media-amazon.com/images/I/71XowisbmZL._AC_UL320_.jpg;https://www.amazon.in/FATMUG-Office-School-Friendly-Charcoal/dp/B07NQJWRZX/ref=sr_1_5288?qid=1679212833&s=kitchen&sr=1-5288;4.3;921.0;499.0;799.0;FATMUG
Treo by Milton Borosilicate Round Storage Jar, 1000 ml, Transparent;home & kitchen;Kitchen Storage & Containers;https://m.media-amazon.com/images/I/71x9fiSTYvS._AC_UL320_.jpg;https://www.amazon.in/Milton-Borosilicate-Round-Storage-Transparent/dp/B07TWGXT7C/ref=sr_1_5289?qid=1679212833&s=kitchen&sr=1-5289;4.2;99.0;314.93;475.0;Treo
VPSK Heavy Stainless Steel Heat Resistant Stand Hot Pan/Pot Stand Mat Pack of 4 (Medium);home & kitchen;Kitchen Storage & Containers;https://m.media-amazon.com/images/I/61ZICKwzwqL._AC_UL320_.jpg;https://www.amazon.in/heavy-Stainless-Steel-Resistant-medium/dp/B07D7S62Z5/ref=sr_1_5290?qid=1679212833&s=kitchen&sr=1-5290;4.3;127.0;549.0;649.0;VPSK
Ikea Dish Drainer, Beige / Galvanised (52 x 35 cm)(Galvanized steel, Polyester powder coating);home & kitchen;Kitchen Storage & Containers;https://m.media-amazon.com/images/I/61o-o8Uam+S._AC_UL320_.jpg;https://www.amazon.in/Ikea-Dish-Drainer-Beige-Galvanised/dp/B098F7BVW2/ref=sr_1_5291?qid=1679212833&s=kitchen&sr=1-5291;4.8;7.0;1085.0;1999.0;Ikea
PARTEET Stainless Steel Vacuum Unicorn Print Water Bottle (500ml, White);home & kitchen;Kitchen Storage & Containers;https://m.media-amazon.com/images/I/71WkZjV2ugL._AC_UL320_.jpg;https://www.amazon.in/Parteet-Stainless-Vacuum-Unicorn-Bottle/dp/B07PZW7FSL/ref=sr_1_5292?qid=1679212833&s=kitchen&sr=1-5292;4.0;20.0;335.0;800.0;PARTEET
victorex Oxo-Biodegradable Packing Material, 6 Inch (150 mm), 100 Meters Length Per Unit, Pack of 1;home & kitchen;Kitchen Storage & Containers;https://m.media-amazon.com/images/I/41WvEeppZRL._AC_UL320_.jpg;https://www.amazon.in/Victorex-Oxo-Biodegradable-Packing-Material-Meters/dp/B09VSVR3HD/ref=sr_1_5293?qid=1679212833&s=kitchen&sr=1-5293;4.0;9.0;465.0;850.0;victorex
Plantex Stainless Steel Towel Rod/Towel Rack for Bathroom/Towel Bar/Hanger/Stand/Bathroom Accessories (24 Inch - Black);home & kitchen;Kitchen Storage & Containers;https://m.media-amazon.com/images/I/81ABCmBgG+L._AC_UL320_.jpg;https://www.amazon.in/Plantex-Stainless-Bathroom-Hanger-Accessories/dp/B08K3K59CC/ref=sr_1_5294?qid=1679212833&s=kitchen&sr=1-5294;4.2;86.0;854.0;2049.0;Plantex
GLOXY ENTERPRISE Stainless Steel Towel Rod for Bathroom, Towel Racks, Towel Bar Rail, Bathroom Hanger, Towel Stand, Bathro...;home & kitchen;Kitchen Storage & Containers;https://m.media-amazon.com/images/I/41ddaFFtyRL._AC_UL320_.jpg;https://www.amazon.in/GLOXY-Stainless-Straight-Bathroom-Kitchen/dp/B08D6SV463/ref=sr_1_5295?qid=1679212833&s=kitchen&sr=1-5295;3.8;41.0;379.05;999.0;GLOXY
C (DEVICE) Stainless Steel spoon holder spoons stand chammach stand spoon holder for kitchen cutlery holder spoon stand sp...;home & kitchen;Kitchen Storage & Containers;https://m.media-amazon.com/images/I/71FREKo7Y9L._AC_UL320_.jpg;https://www.amazon.in/DEVICE-Stainless-Steel-Cutlery-Holder/dp/B09813C5WZ/ref=sr_1_5296?qid=1679212833&s=kitchen&sr=1-5296;4.1;347.0;349.0;425.0;C
Across Yoga 1000 Single Wall Stainless Steel Water Bottle, 1000 ml, Set of 4, Silver;home & kitchen;Kitchen Storage & Containers;https://m.media-amazon.com/images/I/61lr5ijdhNL._AC_UL320_.jpg;https://www.amazon.in/Across-Yoga-1000-Set-Silver/dp/B0BTYXKBLR/ref=sr_1_5297?qid=1679212833&s=kitchen&sr=1-5297;4.3;3.0;999.0;1596.0;Across
