name;main_category;sub_category;image;link;ratings;no_of_ratings;discount_price;actual_price;brand
GOCART WITH G LOGO 18 Inches Super Strong Folding Step Stool for Adults and Kids, Kitchen Stepping Stools, Garden Step Sto...;home & kitchen;Furniture;https://m.media-amazon.com/images/I/71xfPFMBWsS._AC_UL320_.jpg;https://www.amazon.in/GOCART-LOGO-Folding-Stool-Adults/dp/B07HKNDKLR/ref=sr_1_7311?qid=1679213024&s=kitchen&sr=1-7311;4.3;52.0;699.0;1049.0;GOCART
IKEA Nisse Stainless Steel Multipurpose Epoxy Powder Coating Folding Chair for Office Use, Kids, Home (Black);home & kitchen;Furniture;https://m.media-amazon.com/images/I/21lpk8O-QXL._AC_UL320_.jpg;https://www.amazon.in/Stainless-Multipurpose-Powder-Coating-Folding/dp/B017P6MULI/ref=sr_1_7312?qid=1679213024&s=kitchen&sr=1-7312;4.3;8.0;1599.0;3534.0;IKEA
LAD Workspaces The X Table Engineered Wood Study Table, Laptop, Computer Table Desk for Home & Office;home & kitchen;Furniture;https://m.media-amazon.com/images/I/81Ba9E4g9VL._AC_UL320_.jpg;https://www.amazon.in/LAD-Workspaces-Engineered-Laptop-Computer/dp/B08QWQ8FDB/ref=sr_1_7313?qid=1679213024&s=kitchen&sr=1-7313;4.6;210.0;;;LAD
Dream Arts Engineered Wood Shoppee Set Top Box and WiFi Modem Display Rack for Living with Side Craving Cutting Design (Bl...;home & kitchen;Furniture;https://m.media-amazon.com/images/I/51UUFlBRu4L._AC_UL320_.jpg;https://www.amazon.in/Dream-Arts-Shoppee-Display-Craving/dp/B08L5BXWMP/ref=sr_1_7314?qid=1679213024&s=kitchen&sr=1-7314;4.1;32.0;429.0;899.0;Dream
Amazon Brand – Umi Wooden Wall Shelf/Wall Rack/Home Decoration Shelves/Wall Display Rack for Living Room, Office Wall Déco...;home & kitchen;Furniture;https://m.media-amazon.com/images/I/61H7sr-PKSS._AC_UL320_.jpg;https://www.amazon.in/Amazon-Brand-Decoration-Material-KR-02-Brown/dp/B0BTPWYB4S/ref=sr_1_7315?qid=1679213024&s=kitchen&sr=1-7315;;;449.0;2999.0;Amazon
TV Entertainment Unit Set Top Box Stand Wall Mounted Shelf Racks Wooden tv cabinets for Home Living Room Floating Shelves ...;home & kitchen;Furniture;https://m.media-amazon.com/images/I/61SlSejzNdL._AC_UL320_.jpg;https://www.amazon.in/Entertainment-Mounted-cabinets-Floating-Bahubali/dp/B09V1M7M6Z/ref=sr_1_7316?qid=1679213024&s=kitchen&sr=1-7316;1.0;1.0;649.0;2000.0;TV
Loveinfinity Crochet Mirror Frames Rings Assorted Colors & Mirror Combo for Craft, Decoration and Embroidery 1.5CM Total 1...;home & kitchen;Furniture;https://m.media-amazon.com/images/I/51OKih1BsML._AC_UL320_.jpg;https://www.amazon.in/Loveinfinity-Crochet-Assorted-Decoration-Embroidery/dp/B09DX9FD2L/ref=sr_1_7317?qid=1679213024&s=kitchen&sr=1-7317;3.6;17.0;249.0;349.0;Loveinfinity
Equal Aluminium Adjustable Laptop Stand/Folding Laptop Stand/Laptop Holder for Desk/Ventilated Cooling Computer Support St...;home & kitchen;Furniture;https://m.media-amazon.com/images/I/71UWdrpU3DL._AC_UL320_.jpg;https://www.amazon.in/EQUAL-Aluminum-Computer-Ergonomic-Compatible/dp/B097PTC2JL/ref=sr_1_7318?qid=1679213024&s=kitchen&sr=1-7318;3.9;39.0;699.0;1999.0;Equal
LookNSnap Premium Shoe Rack/Multipurpose Storage Rack with Dustproof Cover (4 Shelves, Maroon);home & kitchen;Furniture;https://m.media-amazon.com/images/I/71t3PU6Xd3S._AC_UL320_.jpg;https://www.amazon.in/LookNSnap-Premium-Multipurpose-Storage-Dustproof/dp/B08JM6ZCBV/ref=sr_1_7319?qid=1679213024&s=kitchen&sr=1-7319;3.8;896.0;590.0;2500.0;LookNSnap
Carry Bird Big Boss Wicker Rattan Wrought Iron Single Seater Swing Chair With Stand For Adults | Garden & Outdoor Hammock ...;home & kitchen;Furniture;https://m.media-amazon.com/images/I/61P5YpPcqoL._AC_UL320_.jpg;https://www.amazon.in/Carry-Bird-Backyard-Comfortable-Relaxing/dp/B07XCPMDLL/ref=sr_1_7320?qid=1679213024&s=kitchen&sr=1-7320;4.3;53.0;12599.0;25199.0;Carry
Unicorn Lifestyle Lexus Fabric 3 + 1 + 1 Dark Grey Sofa Set (Delivery Condition - DIY(Do-It-Yourself);home & kitchen;Furniture;https://m.media-amazon.com/images/W/IMAGERENDERING_521856-T2/images/I/51ifq6iLEzL._AC_UL320_.jpg;https://www.amazon.in/Lifestyle-Grey-Delivery-Condition-Yourself/dp/B09TRKSZW8/ref=sr_1_7345?qid=1679213026&s=kitchen&sr=1-7345;;;;;Unicorn
Oaky Over The Door Hook Hanger Organizer Sturdy Design Heavy-Duty 100% Stainless Steel 8-Inch Long Removable Door Hanger H...;home & kitchen;Furniture;https://m.media-amazon.com/images/W/IMAGERENDERING_521856-T2/images/I/61oRAosDLtL._AC_UL320_.jpg;https://www.amazon.in/Hanging-kitchenware-Clothes-Utensils-Traveling/dp/B09GRQWQYR/ref=sr_1_7346?qid=1679213026&s=kitchen&sr=1-7346;4.0;1.0;499.0;1220.0;Oaky
MEJPOSH Alligator Anti-Skid Rubber Coir Door Mat (60CM X 120CM, Brown White);home & kitchen;Furniture;https://m.media-amazon.com/images/W/IMAGERENDERING_521856-T2/images/I/71pxndJ8F-L._AC_UL320_.jpg;https://www.amazon.in/MEJPOSH-Alligator-Anti-Skid-Rubber-120CM/dp/B0BWYKFG3P/ref=sr_1_7347?qid=1679213026&s=kitchen&sr=1-7347;;;798.0;1998.0;MEJPOSH
Wooden Twist Azure Premium Sheesham Wood Rocking Chair with Foot Rest & Pillow (Walnut);home & kitchen;Furniture;https://m.media-amazon.com/images/W/IMAGERENDERING_521856-T2/images/I/91LZn-Za5PS._AC_UL320_.jpg;https://www.amazon.in/Wooden-Twist-Premium-Sheesham-Rocking/dp/B093W9TQPS/ref=sr_1_7348?qid=1679213026&s=kitchen&sr=1-7348;;;;;Wooden
Dravizon 2 Step Stool for Kids || Sturdy Double Step Stool for Toddlers || Anti-Slip Stool for Children || Toddler's Stool...;home & kitchen;Furniture;https://m.media-amazon.com/images/W/IMAGERENDERING_521856-T2/images/I/61JzOkD72AS._AC_UL320_.jpg;https://www.amazon.in/Dravizon-Toddlers-Anti-Slip-Children-Training/dp/B09J8TZX4T/ref=sr_1_7349?qid=1679213026&s=kitchen&sr=1-7349;4.3;3.0;795.0;1599.0;Dravizon
NEON CRAFTS Velvet Round Ottoman with Metal Frame, Round Footrest Stool Footrest Ottoman Stool Modern Furniture for Living...;home & kitchen;Furniture;https://m.media-amazon.com/images/W/IMAGERENDERING_521856-T2/images/I/61tVc2-pgsL._AC_UL320_.jpg;https://www.amazon.in/NEON-CRAFTS-Ottoman-Footrest-Furniture/dp/B0BG2TFRMV/ref=sr_1_7350?qid=1679213026&s=kitchen&sr=1-7350;5.0;1.0;2249.0;4499.0;NEON
Adjustable Laptop Desk, ARUZEN Laptop Stand for Bed Portable Lap Desk Foldable Table Workstation Notebook Riser with Mouse...;home & kitchen;Furniture;https://m.media-amazon.com/images/W/IMAGERENDERING_521856-T2/images/I/61krwyOhyEL._AC_UL320_.jpg;https://www.amazon.in/Adjustable-ARUZEN-Portable-Workstation-Ergonomic/dp/B09RFDF32G/ref=sr_1_7351?qid=1679213026&s=kitchen&sr=1-7351;3.2;2.0;1799.0;1999.0;Adjustable
KAUNOPILIS® Rolling Utility Cart, 3 Tier Mobile Storage Trolley Cart Organizer with Handle and Wheels for Home Bathroom Ki...;home & kitchen;Furniture;https://m.media-amazon.com/images/W/IMAGERENDERING_521856-T2/images/I/51FP6jSTYhL._AC_UL320_.jpg;https://www.amazon.in/KAUNOPILIS%C2%AE-Rolling-Utility-Organizer-Bathroom/dp/B096KXJCFZ/ref=sr_1_7352?qid=1679213026&s=kitchen&sr=1-7352;4.2;31.0;2599.0;5999.0;KAUNOPILIS®
Jyoti Furniture Wooden Foot Rest Stool for Living Room | Kitchen Stool with Cushion | Sheesham Wood, Mahogany Finish;home & kitchen;Furniture;https://m.media-amazon.com/images/W/IMAGERENDERING_521856-T2/images/I/81MavzenDuL._AC_UL320_.jpg;https://www.amazon.in/Jyoti-Furniture-Kitchen-Sheesham-Mahogany/dp/B08THNFDFZ/ref=sr_1_7353?qid=1679213026&s=kitchen&sr=1-7353;5.0;1.0;1799.0;3999.0;Jyoti
WUDENSEE Velvet Round Storage Stool with Handle Ottoman, Button Tufted Footrest Stool Bench Coffee Table for Living Room (...;home & kitchen;Furniture;https://m.media-amazon.com/images/W/IMAGERENDERING_521856-T2/images/I/41JyIHTj5uL._AC_UL320_.jpg;https://www.amazon.in/WUDENSEE-Velvet-Storage-Ottoman-Footrest/dp/B0BSRFM747/ref=sr_1_7354?qid=1679213026&s=kitchen&sr=1-7354;;;3299.0;4899.0;WUDENSEE
deeplax Stainless steels Square bathrooms Towel Holder/Rod/Stand/Hanger/Rail/bar/Robe/Rack/Bathroom Accessories/Chrome Fin...;home & kitchen;Furniture;https://m.media-amazon.com/images/W/IMAGERENDERING_521856-T2/images/I/516-QMiwYHL._AC_UL320_.jpg;https://www.amazon.in/Deeplax-Stainless-Square-Bathroom-Accessories/dp/B07WVZW571/ref=sr_1_7355?qid=1679213026&s=kitchen&sr=1-7355;3.9;25.0;349.0;399.0;deeplax
Nilkamal CHR2180 Plastic Mid Back with Arm Chair | Chairs for Home| Dining Room| Bedroom| Kitchen| Living Room| Office - O...;home & kitchen;Furniture;https://m.media-amazon.com/images/W/IMAGERENDERING_521856-T2/images/I/51vBYDg4LyL._AC_UL320_.jpg;https://www.amazon.in/Nilkamal-Premium-Chair-Brown-Set/dp/B0748GYKN5/ref=sr_1_7356?qid=1679213026&s=kitchen&sr=1-7356;4.1;223.0;;2880.0;Nilkamal
PORCHEX Self-Adhesive Metal Bathroom Rack Storage Shelves - Bathroom Storage Rack Corner, Bathroom Corner Shelf Organizer ...;home & kitchen;Furniture;https://m.media-amazon.com/images/W/IMAGERENDERING_521856-T2/images/I/71puzQU2fkL._AC_UL320_.jpg;https://www.amazon.in/PORCHEX-Self-Adhesive-Metal-Bathroom-Storage/dp/B0B3R9N747/ref=sr_1_7357?qid=1679213026&s=kitchen&sr=1-7357;2.9;163.0;699.0;2599.0;PORCHEX
ZAP Hexa Series Premium Acrylic Bathroom Corner Shelf Super Clear, Corner Shelves for Home Decor - One Set (3 Pieces);home & kitchen;Furniture;https://m.media-amazon.com/images/W/IMAGERENDERING_521856-T2/images/I/51XdK8q9WJL._AC_UL320_.jpg;https://www.amazon.in/ZAP-Premium-Acrylic-Bathroom-Shelves/dp/B08NTSH755/ref=sr_1_7358?qid=1679213026&s=kitchen&sr=1-7358;2.9;24.0;319.0;699.0;ZAP
MOM'S GADGETS ASIAN Metal & Plastic Extra Strong shoe rack Multipurpose Shelves Shoes, Clothes, Books & Utility Rack Plast...;home & kitchen;Furniture;https://m.media-amazon.com/images/W/IMAGERENDERING_521856-T2/images/I/61dVv2gKGnL._AC_UL320_.jpg;https://www.amazon.in/Plastic-Multipurpose-Shelves-Clothes-Utility/dp/B09K48N82M/ref=sr_1_7359?qid=1679213026&s=kitchen&sr=1-7359;3.7;125.0;599.0;998.0;MOM'S
Furniselan Solid Wood Multipurpose |Table for Students|Reading Table| Writing | Students Office Desk Computer Table | Wood...;home & kitchen;Furniture;https://m.media-amazon.com/images/W/IMAGERENDERING_521856-T2/images/I/41Mo9l1eEbL._AC_UL320_.jpg;https://www.amazon.in/Furniselan-Multipurpose-Console-Wooden-Computer/dp/B08B3D6FDR/ref=sr_1_7360?qid=1679213026&s=kitchen&sr=1-7360;4.3;235.0;7599.0;11999.0;Furniselan
TCSS Ergonomic High Back Urban Series Leather Office Chair/Director Chair/Manager Chair/Bonded Foam Leatherette Executive ...;home & kitchen;Furniture;https://m.media-amazon.com/images/W/IMAGERENDERING_521856-T2/images/I/71DzNTTSJ3L._AC_UL320_.jpg;https://www.amazon.in/TCSS-Ergonomic-Leatherette-Executive-Revolving/dp/B0BMXW7TTS/ref=sr_1_7361?qid=1679213026&s=kitchen&sr=1-7361;;;7499.0;12999.0;TCSS
DEVKI INTERIORS 4 Drawer ZigZag Sheesham Wooden Sideboard & Crockery Cabinet for Storage | ZigZag Cabinet for Living Room...;home & kitchen;Furniture;https://m.media-amazon.com/images/W/IMAGERENDERING_521856-T2/images/I/61ltbuKvUKL._AC_UL320_.jpg;https://www.amazon.in/DEVKI-INTERIORS-Sheesham-Sideboard-Crockery/dp/B0BG8J427Z/ref=sr_1_7362?qid=1679213026&s=kitchen&sr=1-7362;;;10670.0;39000.0;DEVKI
GODREJ INTERIO Sally Mid Back Office Chair in Knitted Fabric, Royal Blue Color;home & kitchen;Furniture;https://m.media-amazon.com/images/W/IMAGERENDERING_521856-T2/images/I/51YlrxLNNxL._AC_UL320_.jpg;https://www.amazon.in/GODREJ-INTERIO-Sally-Office-Knitted/dp/B0BN3S9NQG/ref=sr_1_7363?qid=1679213026&s=kitchen&sr=1-7363;;;5275.0;7434.0;GODREJ
Fabrique Visionary 3+2+1 Leatherette 6 Seater Maroon Sofa Set;home & kitchen;Furniture;https://m.media-amazon.com/images/W/IMAGERENDERING_521856-T2/images/I/61xnQSQbZwL._AC_UL320_.jpg;https://www.amazon.in/Fabrique-Visionary-Leatherette-Seater-Maroon/dp/B09H4PW285/ref=sr_1_7364?qid=1679213026&s=kitchen&sr=1-7364;4.2;9.0;60500.0;87000.0;Fabrique
Hiden™ Wooden Ladder Bookshelf Finish Pine Wood Shelf Home Decorative for Showpiece Plant Stand - 3 FT;home & kitchen;Furniture;https://m.media-amazon.com/images/W/IMAGERENDERING_521856-T2/images/I/416yllfmyML._AC_UL320_.jpg;https://www.amazon.in/HIDENTM-Wooden-Bookshelf-Decorative-Showpiece/dp/B08KYN3WYJ/ref=sr_1_7365?qid=1679213026&s=kitchen&sr=1-7365;3.6;24.0;1245.0;2400.0;Hiden™
RS Enterprises Modern Swivel Chair (Fabric , Black);home & kitchen;Furniture;https://m.media-amazon.com/images/W/IMAGERENDERING_521856-T2/images/I/81Q7tN4Kb0L._AC_UL320_.jpg;https://www.amazon.in/Alfa-Chairs-Vizolt-Adjustable-Mechanism/dp/B07N2TXWZX/ref=sr_1_7366?qid=1679213026&s=kitchen&sr=1-7366;2.8;51.0;6299.0;17999.01;RS
MACCA Brand - XXXXL Faux Leather Filled Bean Bag with Stool Ready to Use Filled with Beans (Beige) (Jumbo Size);home & kitchen;Furniture;https://m.media-amazon.com/images/W/IMAGERENDERING_521856-T2/images/I/71tX+fbd++L._AC_UL320_.jpg;https://www.amazon.in/MACCA-Brand-XXXXL-Leather-Filled/dp/B0BSSG9KLC/ref=sr_1_7367?qid=1679213026&s=kitchen&sr=1-7367;3.5;8.0;1994.0;4999.0;MACCA
Mini Solid Wood Stool;home & kitchen;Furniture;https://m.media-amazon.com/images/W/IMAGERENDERING_521856-T2/images/I/51NR98TbE1L._AC_UL320_.jpg;https://www.amazon.in/Generic-Mini-Solid-Wood-Stool/dp/B0BHDCQXDW/ref=sr_1_7368?qid=1679213026&s=kitchen&sr=1-7368;4.0;2.0;749.0;1599.0;Mini
Chair Garage Office Chair for Computer Table with Back Support, Adjustable Home Desk Study Chair AM44 (Polyurethane & Faux...;home & kitchen;Furniture;https://m.media-amazon.com/images/I/417kuIMYIwL._AC_UL320_.jpg;https://www.amazon.in/Chair-Garage-Computer-Adjustable-AM44/dp/B08PVRMKF9/ref=sr_1_7513?qid=1679213029&s=kitchen&sr=1-7513;2.9;11.0;6790.0;12000.0;Chair
KUNTOM 5 Shelves Best Premium Metal Stackable and Durable, Easy to Assemble, Space Saving Rack (5XL, BLACK);home & kitchen;Furniture;https://m.media-amazon.com/images/I/51tw2EeIsOL._AC_UL320_.jpg;https://www.amazon.in/KUNTOM-Shelves-Premium-Stackable-Assemble/dp/B0BV2SSZ6K/ref=sr_1_7514?qid=1679213029&s=kitchen&sr=1-7514;4.3;27.0;999.0;4999.0;KUNTOM
StarAndDaisy Adjustable Height, Multi-Functional Kids Study Table with Book Holder, Drawer, Extra Large Desktop with Book ...;home & kitchen;Furniture;https://m.media-amazon.com/images/I/41+a1QDOQUL._AC_UL320_.jpg;https://www.amazon.in/Adjustable-Multi-Functional-tiltable-Desktop-AU80/dp/B097SLJL2D/ref=sr_1_7515?qid=1679213029&s=kitchen&sr=1-7515;4.0;116.0;;;StarAndDaisy
Mollismoons Fur Bean Bag Sofa Couch for Living Room Ivory Color Cream Color Best Bean Bag for Living Room Luxury Bean Bag ...;home & kitchen;Furniture;https://m.media-amazon.com/images/I/718z5YZimYL._AC_UL320_.jpg;https://www.amazon.in/Mollismoons-Living-Luxury-Lounge-Latest/dp/B08WZXG1K7/ref=sr_1_7516?qid=1679213029&s=kitchen&sr=1-7516;4.1;57.0;2999.0;3650.0;Mollismoons
Centuary Mattress Bubble Budget Double Coir Mattress (Double 72x48x4);home & kitchen;Furniture;https://m.media-amazon.com/images/I/61OT0DNjIAL._AC_UL320_.jpg;https://www.amazon.in/Centuary-Mattress-Bubble-Budget-72x48x4/dp/B07Y86PW96/ref=sr_1_7517?qid=1679213029&s=kitchen&sr=1-7517;2.9;5.0;6471.0;7614.0;Centuary
ANVE Plastic Folding Shoe Rack Organizer with Wall Mounted;home & kitchen;Furniture;https://m.media-amazon.com/images/I/31-xUyZbjcL._AC_UL320_.jpg;https://www.amazon.in/ANVE-Plastic-Folding-Organizer-Mounted/dp/B0BX33HX7W/ref=sr_1_7518?qid=1679213029&s=kitchen&sr=1-7518;;;199.0;404.0;ANVE
Dratal Adjustable Under Desk Footrest - Ergonomic Foot Rest with Massage Texture and Roller, Foot Stool with 6 Adjustable ...;home & kitchen;Furniture;https://m.media-amazon.com/images/I/51dYU0WIWkL._AC_UL320_.jpg;https://www.amazon.in/Dratal-Adjustable-Under-Desk-Footrest/dp/B0BT1LVFZF/ref=sr_1_7519?qid=1679213029&s=kitchen&sr=1-7519;;;1499.0;2999.0;Dratal
@home By Nilkamal Gem 4 Seater Solid Wood Dining Set With Chairs in Cappucino Finish For Kitchen & Dining Room - Brown;home & kitchen;Furniture;https://m.media-amazon.com/images/I/718u0CmpisL._AC_UL320_.jpg;https://www.amazon.in/home-Nilkamal-Seater-Dining-Cappucino/dp/B082MKLJ1Q/ref=sr_1_7520?qid=1679213029&s=kitchen&sr=1-7520;3.7;597.0;15380.0;22492.0;@home
Mats Avenue Natural Heavy Duty Pure Coir Door Mat Brown Color 35 x 60 CM for All Entrances Set of 1;home & kitchen;Furniture;https://m.media-amazon.com/images/I/8100eR0V8aS._AC_UL320_.jpg;https://www.amazon.in/Mats-Avenue-Natural-Heavy-Entrances/dp/B09BG171B6/ref=sr_1_7521_mod_primary_new?qid=1679213029&s=kitchen&sbo=RZvfv%2F%2FHxDF%2BO5021pAnSA%3D%3D&sr=1-7521;4.6;3.0;349.0;999.0;Mats
GHST Stainless Steel swing chain 5 feet;home & kitchen;Furniture;https://m.media-amazon.com/images/I/41RdrWlabiS._AC_UL320_.jpg;https://www.amazon.in/HST-Swing-Chain-oonjal-Chair/dp/B08CT6ZS11/ref=sr_1_7522?qid=1679213029&s=kitchen&sr=1-7522;4.5;184.0;889.0;1799.0;GHST
NatFit60 Polypropylene Anti Slip Rubber Door Mats for Home Entrance Large 60x40 cm - Floor Mats for Bathroom | Bathmat | K...;home & kitchen;Furniture;https://m.media-amazon.com/images/I/71ob7VRkqTL._AC_UL320_.jpg;https://www.amazon.in/NatFit60-Polypropylene-Rubber-Entrance-Large/dp/B0B4S3RRLN/ref=sr_1_7523?qid=1679213029&s=kitchen&sr=1-7523;5.0;2.0;499.0;1099.0;NatFit60
TINITALO Frameless Decorative Mirror Glass for Wall Mirror Bathrooms Home Mirror Decor Size : 12 x 12 Inch QG 130 (Unframe...;home & kitchen;Furniture;https://m.media-amazon.com/images/I/41YubdmLeQL._AC_UL320_.jpg;https://www.amazon.in/Tinitalo-Frameless-Decorative-Mirror-Bathrooms/dp/B096XFX2Y3/ref=sr_1_7524?qid=1679213029&s=kitchen&sr=1-7524;3.5;83.0;599.0;1000.0;TINITALO
Bathoyum Stainless Steel Towel Ring for Bathroom/Wash Basin/Napkin-Towel Hanger/Bathroom Accessories (Chrome-Round) - Pack...;home & kitchen;Furniture;https://m.media-amazon.com/images/I/41a7zNvlLkL._AC_UL320_.jpg;https://www.amazon.in/Bathoyum-Stainless-Napkin-Towel-Accessories-Chrome-Round/dp/B0BVZXN341/ref=sr_1_7525?qid=1679213029&s=kitchen&sr=1-7525;;;180.0;599.0;Bathoyum
Groupon Multi-Purpose Round Plastic Legs, Foot Stand for Almirah, Wardrobe, Refrigerator, Sleeping Bed, Dinning Table and ...;home & kitchen;Furniture;https://m.media-amazon.com/images/I/51J0g1kQUpL._AC_UL320_.jpg;https://www.amazon.in/Groupon-Multi-Purpose-Wardrobe-Refrigerator-Sleeping/dp/B0BQMMT8SK/ref=sr_1_7526?qid=1679213029&s=kitchen&sr=1-7526;2.9;3.0;175.0;499.0;Groupon
CLASSIC WOOD CARVER Wooden Freestanding Umbrella stand, Vertical File Storage Box, Magazine Storage Box,Folder Holder, Boo...;home & kitchen;Furniture;https://m.media-amazon.com/images/I/71lPT3h4fnL._AC_UL320_.jpg;https://www.amazon.in/CLASSIC-WOOD-CARVER-Freestanding-Organizer/dp/B0BF9FK2XC/ref=sr_1_7527?qid=1679213029&s=kitchen&sr=1-7527;3.4;3.0;1250.0;2000.0;CLASSIC
Techzere Tabletop Aluminium Vertical Laptop Stand Holder with Adjustable Dock Dual Slots, Silver;home & kitchen;Furniture;https://m.media-amazon.com/images/I/61SjI2nyRVL._AC_UL320_.jpg;https://www.amazon.in/Techzere-Aluminium-Vertical-Laptop-Adjustable/dp/B08KLLZMMB/ref=sr_1_7528?qid=1679213029&s=kitchen&sr=1-7528;4.5;48.0;2299.0;2999.0;Techzere
FABULO MDF Nesting Square Wall Mounted Shelf Rack for Living Room Office Kitchen Decorative Floating Shelves for Bedroom D...;home & kitchen;Furniture;https://m.media-amazon.com/images/I/619vjZLXplL._AC_UL320_.jpg;https://www.amazon.in/Fabulo-Shelf-Nesting-Square-Shelves/dp/B07P1PG2FV/ref=sr_1_7529?qid=1679213029&s=kitchen&sr=1-7529;4.1;2.0;899.0;1799.0;FABULO
Jaanemaz Prayer Rug Jainemaz for Nemaz Pray Mat 34;home & kitchen;Furniture;https://m.media-amazon.com/images/I/71sRHyn6ROL._AC_UL320_.jpg;https://www.amazon.in/Jaanemaz-Prayer-Jainemaz-Nemaz-Pray/dp/B09HHFNHBF/ref=sr_1_7530?qid=1679213029&s=kitchen&sr=1-7530;5.0;1.0;771.0;1288.0;Jaanemaz
Barlley Hogar India 2 Set of Stainless Steel Wall Mounted Upside Down Wine Glass Holder/Rack -Golden;home & kitchen;Furniture;https://m.media-amazon.com/images/I/61Q4mCbV1tL._AC_UL320_.jpg;https://www.amazon.in/Glass-Holder-Hanging-Organizer-Kitchen/dp/B08X4BF8ZD/ref=sr_1_7531?qid=1679213029&s=kitchen&sr=1-7531;3.9;43.0;1049.0;2999.0;Barlley
KSM Anupam Enterprises Eco-Friendly Handicraft Cane Bar Bamboo Chair/Stool/Muddha/Mudda for Outdoor/Indoor/Furnishing/Colo...;home & kitchen;Furniture;https://m.media-amazon.com/images/I/71OQLmhNpeL._AC_UL320_.jpg;https://www.amazon.in/KSM-Eco-Friendly-Handicraft-Outdoor-Furnishing/dp/B07R413H6D/ref=sr_1_7532?qid=1679213029&s=kitchen&sr=1-7532;3.9;6.0;549.0;999.0;KSM
Lifewit Multipurpose 5 Shelves Shoe Rack with Zip Door Cover & Side Pockets, Multiuse Storage Rack for Footwear, Toys, Clo...;home & kitchen;Furniture;https://m.media-amazon.com/images/I/61pJtn1cO-L._AC_UL320_.jpg;https://www.amazon.in/Lifewit-Multipurpose-Shoe-Rack-Multiuse/dp/B0BY4Y7V4R/ref=sr_1_7533?qid=1679213029&s=kitchen&sr=1-7533;4.6;7274.0;2199.0;9999.0;Lifewit
ATALINO | Step Stool |Supreme Stepper Stool for Home & Office Use with Weight Bearing Capacity- 150kgs (Set of 1);home & kitchen;Furniture;https://m.media-amazon.com/images/I/71Xs4WvcEkL._AC_UL320_.jpg;https://www.amazon.in/ATALINO-Supreme-Stepper-Bearing-Capacity/dp/B0BR3J8KBZ/ref=sr_1_7534?qid=1679213029&s=kitchen&sr=1-7534;;;1059.0;1599.0;ATALINO
Seventh Heaven 4 Seater Wooden Sofa Cum Bed, Chenille Molfino Fabric 72x44x16: 3 Year Warranty Double Solid Wood Sofa Bed...;home & kitchen;Furniture;https://m.media-amazon.com/images/I/71qWGTmQ81L._AC_UL320_.jpg;https://www.amazon.in/Seventh-Heaven-Chenille-72x44x16-Yourself/dp/B0B3MJ76F1/ref=sr_1_7535?qid=1679213029&s=kitchen&sr=1-7535;4.2;39.0;15289.0;22000.0;Seventh
Creative Arts n Frames Long Polystyrene Fiber Wood Rectangular Wall Hanging Wall Mount Bathroom Mirror (Silver White), Framed;home & kitchen;Furniture;https://m.media-amazon.com/images/I/81-Ah15DHAL._AC_UL320_.jpg;https://www.amazon.in/Creative-Arts-Frames-Wood-Rectangular-Wall-Hanging-Wall-Mount-Silver-White/dp/B09ZKT1RLW/ref=sr_1_7536?qid=1679213029&s=kitchen&sr=1-7536;3.3;107.0;2299.0;4999.0;Creative
Enyra Anti Slip Gel Back Artificial Grass Mat for Bedroom, Living Room, Indoor Outdoor Home Decoration (2x10 Feet);home & kitchen;Furniture;https://m.media-amazon.com/images/I/81EOmL8eh5L._AC_UL320_.jpg;https://www.amazon.in/Artificial-Bedroom-Living-Outdoor-Decoration/dp/B09TKP3QQP/ref=sr_1_7609?qid=1679213031&s=kitchen&sr=1-7609;2.8;13.0;969.0;2499.0;Enyra
HOKIPO Outdoor Rubber Coir Grill Doormat, Semi-Circle, 45x75 cm (IN-498);home & kitchen;Furniture;https://m.media-amazon.com/images/I/81043S+--oL._AC_UL320_.jpg;https://www.amazon.in/HOKIPO-Outdoor-Rubber-Doormat-Semi-Circle/dp/B09LYH23MB/ref=sr_1_7610?qid=1679213031&s=kitchen&sr=1-7610;4.5;36.0;799.0;1299.0;HOKIPO
INDISWAN™ Stainless Steel Towel Bar | Bathroom Towel Rod Holder | Wall Mounted Hand Towel Rail for Kitchen and Washroom (2...;home & kitchen;Furniture;https://m.media-amazon.com/images/I/31ABKsvHI2L._AC_UL320_.jpg;https://www.amazon.in/INDISWANTM-Stainless-Bathroom-Mounted-Washroom/dp/B0855SWF2X/ref=sr_1_7611?qid=1679213031&s=kitchen&sr=1-7611;3.8;36.0;699.0;1699.0;INDISWAN™
Craftman Pockets Wall Mounted Multipurpose Organizer Shelf Remote Holder Mobile Docking Stand;home & kitchen;Furniture;https://m.media-amazon.com/images/I/61PPcMSV6BL._AC_UL320_.jpg;https://www.amazon.in/Craftman-Pockets-Mounted-Multipurpose-Organizer/dp/B07QQDZ7YQ/ref=sr_1_7612?qid=1679213031&s=kitchen&sr=1-7612;3.2;6.0;978.0;1578.0;Craftman
JOYO Premium Plastic Stool - Strong Support Stool for Bathroom/Multipurpose (Grey) Stool Grey;home & kitchen;Furniture;https://m.media-amazon.com/images/I/41vnO-bDc8L._AC_UL320_.jpg;https://www.amazon.in/Joyo-Premium-Plastic-Stool-Multipurpose/dp/B09KB7PB5H/ref=sr_1_7613?qid=1679213031&s=kitchen&sr=1-7613;3.4;3.0;1330.0;2599.0;JOYO
Kushuvi Cushion Filled Cover ( Trix );home & kitchen;Furniture;https://m.media-amazon.com/images/I/416RPb7Hu6L._AC_UL320_.jpg;https://www.amazon.in/Kushuvi-Cushion-Filled-Cover-Trix/dp/B09TFNBZM2/ref=sr_1_7614?qid=1679213031&s=kitchen&sr=1-7614;4.0;276.0;99.0;299.0;Kushuvi
ANTICO WOODENIA® Extra Large Wooden Dual Squares Wall Mount Shelf | Wall Rack |Floating Shelves For Home Decor, Living Roo...;home & kitchen;Furniture;https://m.media-amazon.com/images/I/61VB6U579IL._AC_UL320_.jpg;https://www.amazon.in/ANTICO-WOODENIATM-Interlock-Intersecting-Bedrooms/dp/B08PZF9TPT/ref=sr_1_7615?qid=1679213031&s=kitchen&sr=1-7615;3.9;292.0;1199.0;4999.0;ANTICO
Sharan Almirah Multi Purpose New Look Steel Locker Wardrobe & Almirah Storage Cabinet for Home Double Door;home & kitchen;Furniture;https://m.media-amazon.com/images/I/41eDLAYh2KL._AC_UL320_.jpg;https://www.amazon.in/ALMIRAH-Purpose-Wardrobe-Almirah-Storage/dp/B0B4228HWK/ref=sr_1_7616?qid=1679213031&s=kitchen&sr=1-7616;4.0;8.0;16320.0;22599.0;Sharan
BANCROFT Multipurpose Stool for Sitting Bathroom/Office/Kitchen,Plastic Stool for Living Room/Bathing Stool/Stool Chair fo...;home & kitchen;Furniture;https://m.media-amazon.com/images/I/41YGRR7cjYL._AC_UL320_.jpg;https://www.amazon.in/BANCROFT-Multipurpose-Sitting-Bathroom-Kitchen/dp/B0B21CYNFL/ref=sr_1_7617?qid=1679213031&s=kitchen&sr=1-7617;5.0;3.0;499.0;999.0;BANCROFT
ULX Multipurpose Cosmetic Organizer Shampoo Bottle Holder Plastic Wall Holder Storage Box Shelf with Self-Adhesive Sticker...;home & kitchen;Furniture;https://m.media-amazon.com/images/I/41ZfSbChpaL._AC_UL320_.jpg;https://www.amazon.in/ULX-Multipurpose-Cosmetic-Organizer-Self-Adhesive/dp/B09T6Y78WS/ref=sr_1_7618?qid=1679213031&s=kitchen&sr=1-7618;3.3;12.0;119.0;399.0;ULX
INDIAN DECOR 22900 Wine Rack Free Standing Wine Shelf/Bar/Kitchen Wine Bottle, Glass Display Holder Wine Glass Rack, Champ...;home & kitchen;Furniture;https://m.media-amazon.com/images/I/41THiPmzYOL._AC_UL320_.jpg;https://www.amazon.in/INDIAN-Standing-Kitchen-Display-Champagne/dp/B0844SK2KW/ref=sr_1_7619?qid=1679213031&s=kitchen&sr=1-7619;3.0;1.0;1299.0;2999.0;INDIAN
"BLUEWUD Charley Engineered Wood Tv Entertainment Unit Cabinet with Storage, Wenge, for Upto 50""";home & kitchen;Furniture;https://m.media-amazon.com/images/I/71aEDE3FDPL._AC_UL320_.jpg;https://www.amazon.in/Bluewud-Charley-Entertainment-Table-Stand/dp/B07N3WCZFH/ref=sr_1_7620?qid=1679213031&s=kitchen&sr=1-7620;4.0;267.0;5509.0;8599.0;BLUEWUD
