name;main_category;sub_category;image;link;ratings;no_of_ratings;discount_price;actual_price;brand
SGA SHERAVALI|Plastic Chair Pack of 1|for Home and Garden uses Activities Beige Color;home & kitchen;Furniture;https://m.media-amazon.com/images/I/51oeZE3sQrL._AC_UL320_.jpg;https://www.amazon.in/SHERAVALI-Plastic-Chair-Garden-Activities/dp/B09TFG2ZLR/ref=sr_1_2021?qid=1679212938&s=kitchen&sr=1-2021;4.0;28.0;1100.0;1600.0;SGA
House of Quirk 5 Tier Adjustable Bookshelf,Natural Bamboo Bookcase Shelf Storage Organizer, Utility Shelf Rack for Living ...;home & kitchen;Furniture;https://m.media-amazon.com/images/I/71t1G3yVVcL._AC_UL320_.jpg;https://www.amazon.in/House-Quirk-Adjustable-Bookshelf-70x24x120cm/dp/B09RZRGVYL/ref=sr_1_2022?qid=1679212938&s=kitchen&sr=1-2022;3.6;344.0;1999.0;2999.0;House
Wakefit Coffee Table | 1 Year Warranty | Center Table for Living Room, Tea Table, Coffee Table for Living Room, Centre Tab...;home & kitchen;Furniture;https://m.media-amazon.com/images/I/6154blDuBEL._AC_UL320_.jpg;https://www.amazon.in/Wakefit-Coffee-Compartments-Engineered-Walnut/dp/B08WS5YZV5/ref=sr_1_2023?qid=1679212938&s=kitchen&sr=1-2023;4.6;596.0;4245.0;6848.0;Wakefit
HOKIPO® Magic Sticker Series Hair Dryer Stand with Extra Provision to Keep Toiletries (Model - AR2598);home & kitchen;Furniture;https://m.media-amazon.com/images/I/71Qi0kLiZdL._AC_UL320_.jpg;https://www.amazon.in/HOKIPO%C2%AE-Magic-Sticker-Provision-Toiletries/dp/B07X265T8R/ref=sr_1_2024?qid=1679212938&s=kitchen&sr=1-2024;4.2;112.0;999.0;1499.0;HOKIPO®
HEERA MOTI CORPORATION Flexible Engineered Wood Bookshelf Display Shelf -Free Style Display True Natural Stand Shelf Rack ...;home & kitchen;Furniture;https://m.media-amazon.com/images/I/619Ory+lfKL._AC_UL320_.jpg;https://www.amazon.in/HEERA-MOTI-CORPORATION-Bookshelf-Laminated/dp/B08JK7SB1N/ref=sr_1_2025?qid=1679212938&s=kitchen&sr=1-2025;3.3;104.0;1127.0;2500.0;HEERA
Homescape Kids Sofa Cum Bed and Chair for Comfort (Foam,Cotton) (Pink , 0-2 Years);home & kitchen;Furniture;https://m.media-amazon.com/images/I/41bAytAEDPL._AC_UL320_.jpg;https://www.amazon.in/Homescape-Chair-Comfort-Support-Years/dp/B084C15K67/ref=sr_1_2026?qid=1679212938&s=kitchen&sr=1-2026;3.7;192.0;849.0;1999.0;Homescape
Kuber Industries PVC Fridge Mat with Fridge Door Tray mat 6 Pcs, White;home & kitchen;Furniture;https://m.media-amazon.com/images/I/71g-ixdKoPL._AC_UL320_.jpg;https://www.amazon.in/Kuber-Industries-Fridge-Door-White/dp/B07MBB2XYQ/ref=sr_1_2027?qid=1679212938&s=kitchen&sr=1-2027;3.9;208.0;219.0;229.0;Kuber
Kohler Complementary Towel Hanger for Bathroom - Silver with Chrome Finish - Corrosion and Tarnishing Resistant Towel Bar...;home & kitchen;Furniture;https://m.media-amazon.com/images/I/31H1RGC1zVL._AC_UL320_.jpg;https://www.amazon.in/Kohler-5630IN-CP-Towel-Bar-Silver/dp/B010LZ8QW2/ref=sr_1_2028?qid=1679212938&s=kitchen&sr=1-2028;4.4;223.0;1499.0;1820.0;Kohler
Travelling Foldable Stool Telescopic for Travel Portable Folding Camping Round Gym Seat Multipurpose Sitting Outdoor Plast...;home & kitchen;Furniture;https://m.media-amazon.com/images/I/61t58bbO2gL._AC_UL320_.jpg;https://www.amazon.in/Travelling-Foldable-Telescopic-Portable-Multipurpose/dp/B0B37TG7JQ/ref=sr_1_2029?qid=1679212938&s=kitchen&sr=1-2029;3.3;30.0;749.0;1299.0;Travelling
Streetup India® 18 Inch Folding Metal Stool Chair for Home/Study Chair and Restaurant/Cafe Chair Black - Without Foot Rest;home & kitchen;Furniture;https://m.media-amazon.com/images/I/71+fmhLekgL._AC_UL320_.jpg;https://www.amazon.in/Streetup-India-Folding-Restaurant-Without/dp/B0923G9XW8/ref=sr_1_2030?qid=1679212938&s=kitchen&sr=1-2030;4.1;67.0;1949.0;3499.0;Streetup
IMPEX Mini Sixer Trolley Wheel Caster - Heavy Duty 150Kg Load Capacity Fix 6 Castor Wheel for Shopping Trolley, Furniture ...;home & kitchen;Furniture;https://m.media-amazon.com/images/I/61uG6vyhThL._AC_UL320_.jpg;https://www.amazon.in/IMPEX-Sixer-Trolley-Wheel-Caster/dp/B096KPPXLN/ref=sr_1_2031?qid=1679212938&s=kitchen&sr=1-2031;3.9;50.0;349.0;599.0;IMPEX
The Sleep Company SmartGRID Orthopedic Pro |AIHA Certified Mattress |Scientifically Proven 5 Zone Orthopedic Support |8 In...;home & kitchen;Furniture;https://m.media-amazon.com/images/I/711yb6J0X5L._AC_UL320_.jpg;https://www.amazon.in/Sleep-Company-SmartGRID-Orthopedic-Pro/dp/B0BD9DY9LQ/ref=sr_1_2032?qid=1679212938&s=kitchen&sr=1-2032;4.6;151.0;27990.0;52900.0;The
Green Soul Blaze Multipurpose Manual Height Adjustable Study Laptop Computer Desk Table, Ergonomic Sit Stand Solution, Ide...;home & kitchen;Furniture;https://m.media-amazon.com/images/I/51b-X3oEy4L._AC_UL320_.jpg;https://www.amazon.in/Green-Soul-Blaze-Multi-Purpose-Table/dp/B096VD1WTD/ref=sr_1_2033?qid=1679212938&s=kitchen&sr=1-2033;4.5;23.0;15590.0;32709.0;Green
HOKIPO® Magic Sticker Series Multifunctional Painted Self Adhesive Bathroom Shelves Storage Tray - Soap Dish with Towel Ro...;home & kitchen;Furniture;https://m.media-amazon.com/images/I/61se7CGL51L._AC_UL320_.jpg;https://www.amazon.in/HOKIPO-Sticker-Adhesive-Bathroom-22-5x13cm/dp/B07BRP4P3W/ref=sr_1_2034?qid=1679212938&s=kitchen&sr=1-2034;4.1;303.0;399.0;899.0;HOKIPO®
"IMPODA Nylon and Powder Coating Steel 4 x Small 1"" Single Wheel Puff Castor for Centre Table Furniture/80 kg Load Capacity...";home & kitchen;Furniture;https://m.media-amazon.com/images/I/7108b6hhBsL._AC_UL320_.jpg;https://www.amazon.in/IMPODA-Powder-Coating-Furniture-Capacity/dp/B07Z5Z83FR/ref=sr_1_2035?qid=1679212938&s=kitchen&sr=1-2035;3.8;229.0;249.0;699.0;IMPODA
Livpure Smart Lumbar HR Foam Mattress| 3D Sleep Zones | Manufactured with Dow ComfortScience | Premium Certified Fabric |E...;home & kitchen;Furniture;https://m.media-amazon.com/images/I/51yKm0h-BKL._AC_UL320_.jpg;https://www.amazon.in/Livpure-Smart-Lumbar-Manufactured-ComfortScience/dp/B0B526HF19/ref=sr_1_2036?qid=1679212938&s=kitchen&sr=1-2036;4.1;101.0;6478.0;10699.0;Livpure
DeckUp Turrano Engineered Wood Study Table and Office Desk (Walnut, Matte Finish);home & kitchen;Furniture;https://m.media-amazon.com/images/I/91X64+HdchL._AC_UL320_.jpg;https://www.amazon.in/Deckup-Turrano-Engineered-Office-Walnut/dp/B09YWHRP62/ref=sr_1_2037?qid=1679212938&s=kitchen&sr=1-2037;3.9;997.0;5999.0;12000.0;DeckUp
CAPITAL® Stainless Steel 4-Arm Bathroom Swing Hanger Towel Bar/Wall Mounted Swivel Towel Bar Holder for Bathroom/Towel Sta...;home & kitchen;Furniture;https://m.media-amazon.com/images/I/61szM-v7TVL._AC_UL320_.jpg;https://www.amazon.in/CAPITAL%C2%AE-Stainless-Bathroom-Mounted-Accessories/dp/B08TQBWWHS/ref=sr_1_2038?qid=1679212938&s=kitchen&sr=1-2038;3.5;23.0;540.0;1099.0;CAPITAL®
RAINBOW HOMES Handmade Woven Macrame Wall Hanging Shelf Wood Floating Hanging Shelf Storage Shelf Bohomian Wall Décor ,Kit...;home & kitchen;Furniture;https://m.media-amazon.com/images/I/51VkHGKQN1L._AC_UL320_.jpg;https://www.amazon.in/RAINBOW-HOMES-Handmade-Floating-Multicolour/dp/B0BCJDG4J6/ref=sr_1_2039?qid=1679212938&s=kitchen&sr=1-2039;3.8;53.0;349.0;499.0;RAINBOW
ORUM Study Table/Bed Table/Foldable and Portable Wooden/Writing Desk for Office/Home/School (Black Flower) (Wood);home & kitchen;Furniture;https://m.media-amazon.com/images/I/81MuoK8a-cL._AC_UL320_.jpg;https://www.amazon.in/ORUM-Foldable-Portable-Wooden-Writing/dp/B0BXJHQN83/ref=sr_1_2040?qid=1679212938&s=kitchen&sr=1-2040;;;199.0;999.0;ORUM
LEVON Book Shelf Wall Mounted Heavy Duty Metal Invisible Book Black 3Piece Per Pack (Made in India) with Screws;home & kitchen;Furniture;https://m.media-amazon.com/images/I/41j6aLMwDWL._AC_UL320_.jpg;https://www.amazon.in/Mounted-Invisible-Shelves-3Piece-Screws/dp/B07WRPFGJB/ref=sr_1_2257?qid=1679212941&s=kitchen&sr=1-2257;4.0;185.0;599.0;799.0;LEVON
ASPENX Self Adhesivecute Floating Shelves Wall Mounted Shelves Wall Shelf for Kitchen Bathroom Entryway | 33 x 13.5 x 14.5...;home & kitchen;Furniture;https://m.media-amazon.com/images/I/510VGHp8snL._AC_UL320_.jpg;https://www.amazon.in/ASPENX-Adhesivecute-Floating-Bathroom-Entryway/dp/B0BRG8HL6Q/ref=sr_1_2258?qid=1679212941&s=kitchen&sr=1-2258;5.0;6.0;299.0;999.0;ASPENX
KUMBHANI SALES CribKing Foldable Telescopic Stool Retractable Portable | Folding Stool | Plastic Folding Stool | Camping S...;home & kitchen;Furniture;https://m.media-amazon.com/images/I/519sBaE8nNL._AC_UL320_.jpg;https://www.amazon.in/KUMBHANI-SALES-Stool-Retractable-Folding/dp/B0BQGRTZ4K/ref=sr_1_2259?qid=1679212941&s=kitchen&sr=1-2259;4.0;14.0;749.0;1499.0;KUMBHANI
Waafy Wall Hanging Bathroom Storage Human Hook Rack Floating Wall Ledge Shelf Simple Wall Mounted Bookshelf Home Office Sh...;home & kitchen;Furniture;https://m.media-amazon.com/images/I/51MX-fvvQ+L._AC_UL320_.jpg;https://www.amazon.in/Waafy-Hanging-Bathroom-Floating-Bookshelf/dp/B0BSFPT2K6/ref=sr_1_2260?qid=1679212941&s=kitchen&sr=1-2260;5.0;4.0;349.0;599.0;Waafy
ROUSN Kitchen Floor mat Doormat (Color Grey White);home & kitchen;Furniture;https://m.media-amazon.com/images/I/91ijFPXAdoL._AC_UL320_.jpg;https://www.amazon.in/ROUSN-Kitchen-Floor-mat-Doormat/dp/B0BNWHKS9L/ref=sr_1_2261?qid=1679212941&s=kitchen&sr=1-2261;1.0;1.0;269.0;699.0;ROUSN
Essential World® Stainless Steel Hydra Modular Dining Table with Foldable Cross Metal Stand 4 Seater (With Out Glass) Fini...;home & kitchen;Furniture;https://m.media-amazon.com/images/I/51bmwVKwx7L._AC_UL320_.jpg;https://www.amazon.in/Essential-World-Stainless-Modular-Dining/dp/B0B9YHVFH1/ref=sr_1_2262?qid=1679212941&s=kitchen&sr=1-2262;4.1;9.0;1899.0;2999.0;Essential
ZONVER ® Swing Indoor Metal Jhula Kada for Home, Garden and Terrace Use (Silver);home & kitchen;Furniture;https://m.media-amazon.com/images/I/21l8NWb6z+S._AC_UL320_.jpg;https://www.amazon.in/ZONVER%C2%AE-Swing-Indoor-Garden-Terese/dp/B093XRTJM1/ref=sr_1_2263?qid=1679212941&s=kitchen&sr=1-2263;4.3;77.0;419.0;999.0;ZONVER
H B MSALA (DEVICE) Soft Single Bed Cotton Filled Mattress Gadda Soft & Reversible (4 X 6 Ft Or 72 X 48 Inch);home & kitchen;Furniture;https://m.media-amazon.com/images/I/41GxHa2YI-L._AC_UL320_.jpg;https://www.amazon.in/Single-Cotton-Filled-Mattress-Reversible/dp/B09VC5247T/ref=sr_1_2264?qid=1679212941&s=kitchen&sr=1-2264;3.6;38.0;599.0;1499.0;H
Indigo interiors Jorden Wooden Wall Hanging Design Bar | Bar Cabinets for Home | Mini Bar for Home | Solid Wood Make Wine ...;home & kitchen;Furniture;https://m.media-amazon.com/images/I/71G--N6Dk7S._AC_UL320_.jpg;https://www.amazon.in/Indigo-interiors-Hanging-Cabinets-Space-Teak/dp/B07XRC5473/ref=sr_1_2265?qid=1679212941&s=kitchen&sr=1-2265;4.5;144.0;1804.0;4599.0;Indigo
Casa Copenhagen Premium 3 Kg Beans for Bean Bag Filling - Param (3 kg Beans - 2100 Grams net Weight as per Indian Standards);home & kitchen;Furniture;https://m.media-amazon.com/images/I/61i0MaoN6zL._AC_UL320_.jpg;https://www.amazon.in/Casa-Copenhagen-Premium-Beans-Filling/dp/B09NMBLP19/ref=sr_1_2266?qid=1679212941&s=kitchen&sr=1-2266;3.6;83.0;999.0;2499.0;Casa
XENOTY Stainless Steel Iron Coating Self-Adhesive Metal Bathroom Rack Storage Shelves - Black, Set of 1 (Bathroom Corner S...;home & kitchen;Furniture;https://m.media-amazon.com/images/I/61Zxshua4tL._AC_UL320_.jpg;https://www.amazon.in/Xenoty-Self-Adhesive-Bathroom-Stainless-Organizer/dp/B07SK6C16M/ref=sr_1_2267?qid=1679212941&s=kitchen&sr=1-2267;4.1;1811.0;439.0;999.0;XENOTY
Nilkamal Freedom FMDR2BE Plastic Storage Cabinet with 2 Drawer Clothes Organizer | Shelves| Wardrobe | Living Room | Adult...;home & kitchen;Furniture;https://m.media-amazon.com/images/I/81ttC1ZEaNL._AC_UL320_.jpg;https://www.amazon.in/Nilkamal-Freedom-FMDR2BE-Plastic-Weathered/dp/B0B5H87CGZ/ref=sr_1_2268?qid=1679212941&s=kitchen&sr=1-2268;4.0;727.0;5730.0;6900.0;Nilkamal
Amazon Brand - Solimo Premium Acrylic Glass Wall-Mount Oval Shelf with Heavy Rod, for Storing Bathroom and Home Accessorie...;home & kitchen;Furniture;https://m.media-amazon.com/images/I/71QNSqX1IAL._AC_UL320_.jpg;https://www.amazon.in/Amazon-Brand-Wall-Mount-Bathroom-Accessories/dp/B09X1DRKLB/ref=sr_1_2269?qid=1679212941&s=kitchen&sr=1-2269;4.7;4.0;249.28;937.0;Amazon
Story@Home Handicraft Style Eco Series 2 Piece Cotton Blend Door Mat (16 inch x 24 inch, Brown and Grey);home & kitchen;Furniture;https://m.media-amazon.com/images/I/81v6xVv+RaL._AC_UL320_.jpg;https://www.amazon.in/Story-Home-Handicraft-Style-Cotton/dp/B01MQYMTUF/ref=sr_1_2270?qid=1679212941&s=kitchen&sr=1-2270;3.6;1133.0;279.0;299.0;Story@Home
FASNO Multipurpose Portable Folding Shoe Rack 5 Shelves Organizer with Cover, Plastic Frame Plastic Connectors, Home Furni...;home & kitchen;Furniture;https://m.media-amazon.com/images/I/41ocLnxITlL._AC_UL320_.jpg;https://www.amazon.in/FASNO-Multipurpose-Organizer-Connectors-Furniture/dp/B0BCWRWNXZ/ref=sr_1_2271?qid=1679212941&s=kitchen&sr=1-2271;;;590.0;799.0;FASNO
wow craft Heavy Duty Durable Plastic Sitting Stool for Home, Office, Bedroom, Bathroom, Kitchen and Garden (Blue Top)(Pack...;home & kitchen;Furniture;https://m.media-amazon.com/images/I/51F5AR1sf1L._AC_UL320_.jpg;https://www.amazon.in/craft-Heavy-Plastic-Office-Garden/dp/B09S6WN78M/ref=sr_1_2272?qid=1679212941&s=kitchen&sr=1-2272;4.0;34.0;1099.0;2198.0;wow
BLUEWUD Maxelle Engineered Wood Floor Standing Book Shelf, Display Rack, Large (Wenge & White);home & kitchen;Furniture;https://m.media-amazon.com/images/I/61AIN2CsUvL._AC_UL320_.jpg;https://www.amazon.in/Bluewud-Maxelle-Engineered-Mounted-Bookshelf/dp/B08YWLTJYN/ref=sr_1_2273?qid=1679212941&s=kitchen&sr=1-2273;4.6;89.0;4535.0;5999.0;BLUEWUD
YASHODHARA Foldable Storage Bins Box Ottoman Bench Container Organizer with Cushion Seat Lid, Cube, Space Saving Storage B...;home & kitchen;Furniture;https://m.media-amazon.com/images/I/81YH0M6LvlS._AC_UL320_.jpg;https://www.amazon.in/YASHODHARA-Foldable-Storage-Container-Organizer/dp/B097TCKTX4/ref=sr_1_2274?qid=1679212941&s=kitchen&sr=1-2274;3.7;56.0;648.0;1299.0;YASHODHARA
ASTRIDE® Amica High Bar Chair/Kitchen Stool in Brown;home & kitchen;Furniture;https://m.media-amazon.com/images/I/71rqbZjQqGL._AC_UL320_.jpg;https://www.amazon.in/ASTRIDE%C2%AE-Amica-Chair-Kitchen-Brown/dp/B0BX95Q56P/ref=sr_1_2275?qid=1679212941&s=kitchen&sr=1-2275;;;2990.0;6499.0;ASTRIDE®
Esquire Plastic Brown Coffee/Center/Living Room Table;home & kitchen;Furniture;https://m.media-amazon.com/images/I/71ZW2SSHlkL._AC_UL320_.jpg;https://www.amazon.in/Esquire-Plastic-Coffee-Center-Living/dp/B0BFL6PL6G/ref=sr_1_2276?qid=1679212941&s=kitchen&sr=1-2276;3.2;16.0;1099.0;1299.0;Esquire
SPINEHEAL MATTRESS Orthofit 4 Inch Dual Comfort Single Bed Size Mattress, High Density Foam - Medium & Firm (72 X 30 X 4 I...;home & kitchen;Furniture;https://m.media-amazon.com/images/I/81IabtFP3OL._AC_UL320_.jpg;https://www.amazon.in/Spineheal-Orthofit-Comfort-Mattress-Density/dp/B0B4P9QBLC/ref=sr_1_2277?qid=1679212941&s=kitchen&sr=1-2277;3.2;73.0;2375.0;4259.0;SPINEHEAL
M-TEXITO Cotton Door Mat Reversible Striped Multicolor Cotton Blend Heavy Door Mat Bath Mat Combo for Home Decor Oval Shap...;home & kitchen;Furniture;https://m.media-amazon.com/images/I/71rGrvzijJL._AC_UL320_.jpg;https://www.amazon.in/M-TEXITO-Reversible-Striped-Multicolor-Set/dp/B0B94711BW/ref=sr_1_2278?qid=1679212941&s=kitchen&sr=1-2278;5.0;1.0;398.0;899.0;M-TEXITO
Sajawat Home Decor Anti Skid & Multipurpose Rubber Mat/Bathroom Mat/ Shower Mat/ Carpet/ Rugs/ Rainmat/ Swimming Pool Mat;home & kitchen;Furniture;https://m.media-amazon.com/images/I/61hRZOpSpML._AC_UL320_.jpg;https://www.amazon.in/Sajawat-Home-Decor-Multipurpose-Bathroom/dp/B0BG345MNQ/ref=sr_1_2279?qid=1679212941&s=kitchen&sr=1-2279;4.3;22.0;444.0;1999.0;Sajawat
Dr Luxur Weavemonster Ergonomic Gaming Chair for Office Work at Home with Breathable Honeycombed Fabric, Magnetic Neck & L...;home & kitchen;Furniture;https://m.media-amazon.com/images/I/71yxE8MhBkL._AC_UL320_.jpg;https://www.amazon.in/Dr-Luxur-Weavemonster-Breathable-Honeycombed/dp/B0B718Q14J/ref=sr_1_2280?qid=1679212941&s=kitchen&sr=1-2280;4.4;53.0;18705.0;34999.0;Dr
Brown Art SHOPPEE Coffee Table, Living Room Sofa Side Table Simple Design Coffee Table Round Coffee Table,Modern Coffee Ta...;home & kitchen;Furniture;https://m.media-amazon.com/images/I/71w-Wj6BqVL._AC_UL320_.jpg;https://www.amazon.in/SHOPPEE-Coffee-Living-Round-Minimalist/dp/B0BP7PRMKY/ref=sr_1_2401?qid=1679212944&s=kitchen&sr=1-2401;3.2;16.0;3349.0;6999.0;Brown
ANTIQUE® Multi-Purpose Laptop Desk for Study and Reading with Foldable Non-Slip Legs Reading Table Tray, Laptop Table, Lap...;home & kitchen;Furniture;https://m.media-amazon.com/images/I/71YLhu+6dSS._AC_UL320_.jpg;https://www.amazon.in/ANTIQUE%C2%AE-Multi-Purpose-Reading-Foldable-Non-Slip/dp/B09FF73ND6/ref=sr_1_2402?qid=1679212944&s=kitchen&sr=1-2402;3.5;306.0;777.0;1200.0;ANTIQUE®
"BLUEWUD Primax Grande Engineered Wood Tv Wall Unit, Set Top Box Stand, Wenge & White, Standard, for Upto 42""";home & kitchen;Furniture;https://m.media-amazon.com/images/I/71tfnp07jDL._AC_UL320_.jpg;https://www.amazon.in/Bluewud-Primax-Grande-Engineered-Standard/dp/B09PBSNBQB/ref=sr_1_2403?qid=1679212944&s=kitchen&sr=1-2403;4.0;220.0;4099.0;5749.0;BLUEWUD
Enigmatic Woodworks Small Book Shelves Rack Heavy Duty Book Rack Stand for Table and Wall Shelves to Hold Books, Magazine...;home & kitchen;Furniture;https://m.media-amazon.com/images/I/71eZrFZkFYL._AC_UL320_.jpg;https://www.amazon.in/Enigmatic-Woodworks-Magazines-Cookbooks-Christmas/dp/B08QF7PT8K/ref=sr_1_2404?qid=1679212944&s=kitchen&sr=1-2404;4.0;31.0;499.0;750.0;Enigmatic
MADE OF EARTH Office Table Study Table Computer Desk (ST-01-B) Modern Sturdy Office Desk PC Laptop Study Writing Table for...;home & kitchen;Furniture;https://m.media-amazon.com/images/I/61DQfl8UN0L._AC_UL320_.jpg;https://www.amazon.in/MADE-EARTH-Computer-ST-01-B-Writing/dp/B0BGLNBZPW/ref=sr_1_2405?qid=1679212944&s=kitchen&sr=1-2405;4.4;4.0;2699.0;5999.0;MADE
NC Acrylic Shoe Stand (Pack of 24), Shoe Display Stand, L-Showroom Display Shoe Stands (24);home & kitchen;Furniture;https://m.media-amazon.com/images/I/51zhdGXOC9L._AC_UL320_.jpg;https://www.amazon.in/Acrylic-Stand-Display-L-Showroom-Stands/dp/B0B1QY78D5/ref=sr_1_2406?qid=1679212944&s=kitchen&sr=1-2406;3.5;9.0;759.0;1399.0;NC
SANAMSTORE Multi Utility 9 Layer Metal Pipe with Non-Woven 100GSM Fabric Cover Shoe/Cloth/Toy/Books Rack-Grey;home & kitchen;Furniture;https://m.media-amazon.com/images/I/81Z7GQT9+YL._AC_UL320_.jpg;https://www.amazon.in/SANAMSTORE-Utility-Non-Woven-100GSM-Rack-Grey/dp/B0B19TL5YD/ref=sr_1_2407?qid=1679212944&s=kitchen&sr=1-2407;3.5;25.0;1149.0;1799.0;SANAMSTORE
Joyo Plastic Multipurpose Strong 5 Legs Tuff Square Stool (Big) - Grey;home & kitchen;Furniture;https://m.media-amazon.com/images/I/61-texyLqxL._AC_UL320_.jpg;https://www.amazon.in/Multipurpose-Home-Bathroom-Patla-Big/dp/B09G9D4NNF/ref=sr_1_2408?qid=1679212944&s=kitchen&sr=1-2408;4.0;17.0;1400.0;1499.0;Joyo
Art Street Decorative Wall Mirror Set of 4 Grey Brown Triangular Shape for Home Decoration & Wall Decoration- Size-10x10 Inch;home & kitchen;Furniture;https://m.media-amazon.com/images/I/51ky9uDC+qL._AC_UL320_.jpg;https://www.amazon.in/Art-Street-Decorative-Triangular-Decoration/dp/B08Z43S8CP/ref=sr_1_2409?qid=1679212944&s=kitchen&sr=1-2409;4.3;97.0;949.0;1500.0;Art
Fresh Zone Cotton Door Mat (Multicolour, 40x60 cm, Standard) - Set of 4 Pieces;home & kitchen;Furniture;https://m.media-amazon.com/images/I/71qWoHNWQWL._AC_UL320_.jpg;https://www.amazon.in/Fresh-Zone-Cotton-mat-Office/dp/B08VGRBCDZ/ref=sr_1_2410?qid=1679212944&s=kitchen&sr=1-2410;3.2;133.0;;;Fresh
Amazon Brand - Solimo Denim XXXL Bean Bag Cover Without Beans (Dark Blue);home & kitchen;Furniture;https://m.media-amazon.com/images/I/61-R7lHinxL._AC_UL320_.jpg;https://www.amazon.in/Amazon-Brand-Solimo-Denim-Without/dp/B08DDWXW8S/ref=sr_1_2411?qid=1679212944&s=kitchen&sr=1-2411;3.8;78.0;999.0;1319.0;Amazon
Heera Moti Boxx Coffee Table/Sofa Table/ Center Table For Living (Engineered Wood) (Finish :-White Pre-Laminated Matt);home & kitchen;Furniture;https://m.media-amazon.com/images/I/414qSz4lKUL._AC_UL320_.jpg;https://www.amazon.in/Corporation-Coffee-Center-Living-Finish/dp/B0896VKKDM/ref=sr_1_2412?qid=1679212944&s=kitchen&sr=1-2412;3.1;547.0;2349.0;5000.0;Heera
AYSIS Multipurpose Sneaker Containers Bins, Shoe Storage Box, Clear Plastic Stackable Organizer for Closet, Space Saving F...;home & kitchen;Furniture;https://m.media-amazon.com/images/I/71sZgSvb3AL._AC_UL320_.jpg;https://www.amazon.in/AYSIS-Multipurpose-Containers-Stackable-Organizer/dp/B09PRHNY73/ref=sr_1_2413?qid=1679212944&s=kitchen&sr=1-2413;4.2;355.0;6774.0;8486.0;AYSIS
Sattva Classic XXXL Bean Bag Filled with Beans - Black;home & kitchen;Furniture;https://m.media-amazon.com/images/I/61VjJvVcD5S._AC_UL320_.jpg;https://www.amazon.in/Sattva-Classic-XXXL-Filled-Beans/dp/B01ENG78I8/ref=sr_1_2414?qid=1679212944&s=kitchen&sr=1-2414;3.9;1087.0;1849.0;2196.0;Sattva
Kuber Industries Rug (Red, Velvet, Standard, Pack of 1);home & kitchen;Furniture;https://m.media-amazon.com/images/I/81bp+cXXiKL._AC_UL320_.jpg;https://www.amazon.in/Kuber-Industries-Meditation-Multipurpose-CTKTC33910/dp/B0839C2WZN/ref=sr_1_2415?qid=1679212944&s=kitchen&sr=1-2415;4.1;1961.0;440.0;899.0;Kuber
Tungstun Decor Wooden Wall Mounted Racks Shelf/Wall Shelves for Kitchen Storage Boxes/Kitchen Organizer Items/Decorative W...;home & kitchen;Furniture;https://m.media-amazon.com/images/I/51t+Tv5Ru4L._AC_UL320_.jpg;https://www.amazon.in/Tungstun-Mounted-Shelves-Organizer-Decorative/dp/B0BJVBJ376/ref=sr_1_2416?qid=1679212944&s=kitchen&sr=1-2416;4.5;4.0;998.0;1999.0;Tungstun
The Top Knott Macram© Wall Hanging Shelf Indoor Boho Wall Decor for Bedroom,Wood Hanging Shelf Organizer,Handmade Woven Co...;home & kitchen;Furniture;https://m.media-amazon.com/images/I/51ErGa3h7ZL._AC_UL320_.jpg;https://www.amazon.in/Top-Knott-Organizer-Handmade-Multicolour/dp/B0BG55X6F6/ref=sr_1_2417?qid=1679212944&s=kitchen&sr=1-2417;3.7;16.0;269.0;599.0;The
Green Soul Glance Multi-Functional Ergonomic Gaming Chair, Premium Leatherette Chair with Best in Class Comfort, Adjustabl...;home & kitchen;Furniture;https://m.media-amazon.com/images/I/71JARteyRFL._AC_UL320_.jpg;https://www.amazon.in/Green-Soul-Glance-Multi-Functional-GS-350/dp/B097K1SXP7/ref=sr_1_2418?qid=1679212944&s=kitchen&sr=1-2418;4.6;316.0;14390.0;30750.0;Green
Namra Arts Metal & Wood End Table with Storage Shelf for Home & Living Room Side & Corner Table Sofa End Table (Gold & White);home & kitchen;Furniture;https://m.media-amazon.com/images/I/51Z0xV0l4OL._AC_UL320_.jpg;https://www.amazon.in/Storage-Living-Corner-Gold-White/dp/B0BKWG48VX/ref=sr_1_2419?qid=1679212944&s=kitchen&sr=1-2419;3.6;4.0;2299.0;3499.0;Namra
P P CHAIR Office Visitor revolving Boom Chair Spare Parts Accessories Net Back with nut Bolts and Key fit to Every Chair(P...;home & kitchen;Furniture;https://m.media-amazon.com/images/I/81g8+0pEACL._AC_UL320_.jpg;https://www.amazon.in/Chair-Office-Visitor-revolving-Accessories/dp/B09F3L8BD7/ref=sr_1_2420?qid=1679212944&s=kitchen&sr=1-2420;3.9;46.0;999.0;1399.0;P
nufurn Transparent Acrylic Mid Century Modern Chairs for Living Room Dining Study Cafe Bedroom Designer Accent 1 Chair;home & kitchen;Furniture;https://m.media-amazon.com/images/I/61uQ35CdvML._AC_UL320_.jpg;https://www.amazon.in/nufurn-Transparent-Acrylic-Century-Designer/dp/B0BTQ28K9L/ref=sr_1_2421?qid=1679212944&s=kitchen&sr=1-2421;5.0;1.0;3899.0;10999.0;nufurn
DUA DECOR SHOPPEE Wooden Kitchen Shelf Racks Wall Shelf Rack for Kitchen Storage Boxes Spice Jars Rack Wall Mounted Shelf ...;home & kitchen;Furniture;https://m.media-amazon.com/images/I/615ARCEkSCL._AC_UL320_.jpg;https://www.amazon.in/SHOPPEE-Kitchen-Storage-Decoration-Containers/dp/B0BPMDPTMC/ref=sr_1_2422?qid=1679212944&s=kitchen&sr=1-2422;;;699.0;3999.0;DUA
DERO 'Foldable Bed Study Table Portable Multi Function Laptop-Table Lapdesk for Children Bed Foldable Table Work Office Ho...;home & kitchen;Furniture;https://m.media-amazon.com/images/I/813Y8tzbcAL._AC_UL320_.jpg;https://www.amazon.in/DERO-Foldable-Portable-Function-Laptop-Table/dp/B09X5KSSK8/ref=sr_1_2423?qid=1679212944&s=kitchen&sr=1-2423;3.8;27.0;209.0;699.0;DERO
Casa Decor Golden Sylvan Stencil Wall Bracket for Wall Shleves Home Décor Set (2 pieces) - Gold;home & kitchen;Furniture;https://m.media-amazon.com/images/I/51DJx1clkEL._AC_UL320_.jpg;https://www.amazon.in/Casa-Stencil-Bracket-Shleves-D%C3%A9cor/dp/B07B24ZWW4/ref=sr_1_2424?qid=1679212944&s=kitchen&sr=1-2424;4.0;246.0;299.0;499.0;Casa
Torche {16 x 40 Inches } Wooden Wall Mounted Table | Wall Study | Desk Table for Home and Office | Foldable Table. [White];home & kitchen;Furniture;https://m.media-amazon.com/images/I/61Ry7zkt03L._AC_UL320_.jpg;https://www.amazon.in/Torche-Inches-Mounted-Foldable-White/dp/B0BSL6KBWP/ref=sr_1_2545?qid=1679212947&s=kitchen&sr=1-2545;4.7;10.0;2299.0;6000.0;Torche
"MAYUMI Folding Wooden Writing White Board Study Table | Laptop Table | Work Table Large (21"")";home & kitchen;Furniture;https://m.media-amazon.com/images/I/61+Xtyj3VYL._AC_UL320_.jpg;https://www.amazon.in/Folding-Writing-White-Board-Table/dp/B0BW9SZ4VR/ref=sr_1_2546?qid=1679212947&s=kitchen&sr=1-2546;2.0;2.0;695.0;1495.0;MAYUMI
Acco & Deco 2 Tier Wooden Multipurpose Turn-n-Tube Engineered Wood End Table Beside Sofa Side Table Corner Night Stand for...;home & kitchen;Furniture;https://m.media-amazon.com/images/I/911uQooswYL._AC_UL320_.jpg;https://www.amazon.in/Acco-Deco-Multipurpose-Turn-n-Tube-Engineered/dp/B0B4K2X5HT/ref=sr_1_2547?qid=1679212947&s=kitchen&sr=1-2547;3.6;173.0;711.0;3000.0;Acco
ROYAL TREND Door Mat Rugs for Home & Kitchen| Half Sunflower Shape| Bath mat| Pink Color ( 16 X 34 Inches );home & kitchen;Furniture;https://m.media-amazon.com/images/I/61IETZ-FVbL._AC_UL320_.jpg;https://www.amazon.in/ROYAL-TREND-Kitchen-Sunflower-Inches/dp/B09P2LX31C/ref=sr_1_2548?qid=1679212947&s=kitchen&sr=1-2548;3.1;33.0;369.0;999.0;ROYAL
