name;main_category;sub_category;image;link;ratings;no_of_ratings;discount_price;actual_price;brand
PRISTU ENTERPRISE Zip Lock Pouches, Zip Lock Bag For Storage, zer Re-Usable Zipper Bags, Ziplock Bags For Fridge Storage, ...;home & kitchen;Kitchen Storage & Containers;https://m.media-amazon.com/images/I/51nYflKmzVL._AC_UL320_.jpg;https://www.amazon.in/PRISTU-ENTERPRISE-Pouches-Storage-RE-USABLE/dp/B09BVBQ951/ref=sr_1_5842?qid=1679212845&s=kitchen&sr=1-5842;3.8;139.0;189.0;349.0;PRISTU
ZESTILO Stainless Steel Ghee Pot || Ghee Dani Butter Container Copper bottom Finish || Ghee Container for Kitchen | Multip...;home & kitchen;Kitchen Storage & Containers;https://m.media-amazon.com/images/I/81isDcCbbgL._AC_UL320_.jpg;https://www.amazon.in/ZESTILO-Stainless-Butter-Container-Copper/dp/B0972J4X15/ref=sr_1_5843?qid=1679212845&s=kitchen&sr=1-5843;4.3;109.0;365.0;550.0;ZESTILO
2 Layer Storage Organizer Slim Rack Shelf with Wheels for Easy Movement with Slide | Unbreakable Plastic, white;home & kitchen;Kitchen Storage & Containers;https://m.media-amazon.com/images/I/51rvbVYE4yL._AC_UL320_.jpg;https://www.amazon.in/Storage-Organizer-Movement-Unbreakable-Plastic/dp/B0BGBS3XZC/ref=sr_1_5844?qid=1679212845&s=kitchen&sr=1-5844;3.0;5.0;479.0;999.0;2
SignoraWare Easy Jumbo Compartment Lunch Box Set of 2, Bpa Free Plastic, Microwave Safe Food Grade Tiffin Boxes Office Sch...;home & kitchen;Kitchen Storage & Containers;https://m.media-amazon.com/images/I/71KyIocvbIL._AC_UL320_.jpg;https://www.amazon.in/Signoraware-Easy-Lunch-Container-2-Pieces/dp/B00JJHBXDS/ref=sr_1_5845?qid=1679212845&s=kitchen&sr=1-5845;4.2;895.0;;230.0;SignoraWare
RenHomz Ceramic Pickle Jar- Set of 2 with Tray and ceramic spoons |Moroccan Dining Table Storage Container |Best use for P...;home & kitchen;Kitchen Storage & Containers;https://m.media-amazon.com/images/I/81POP7Zj70L._AC_UL320_.jpg;https://www.amazon.in/RenHomz-Ceramic-ceramic-Moroccan-Container/dp/B08VDXCMJ9/ref=sr_1_5846?qid=1679212845&s=kitchen&sr=1-5846;4.0;108.0;599.0;999.0;RenHomz
Milton Thermosteel Flip Lid Flask, 1000 Milliliters, Silver & Milton Thermosteel Glassy Drinking Cup Lid, 1 Litre, Pink;home & kitchen;Kitchen Storage & Containers;https://m.media-amazon.com/images/I/51wMcReBDML._AC_UL320_.jpg;https://www.amazon.in/Milton-Thermosteel-Milliliters-Silver-Drinking/dp/B08K9T3JRF/ref=sr_1_5847?qid=1679212845&s=kitchen&sr=1-5847;4.4;11.0;1666.0;2245.0;Milton
Cello Fridge Door Canister, Safe Plastic, Set of 6, 750ML, White;home & kitchen;Kitchen Storage & Containers;https://m.media-amazon.com/images/I/81b-H3knLfL._AC_UL320_.jpg;https://www.amazon.in/Cello-Fridge-Canister-Plastic-750ML/dp/B08GLVLX9R/ref=sr_1_5848?qid=1679212845&s=kitchen&sr=1-5848;4.6;159.0;730.0;820.0;Cello
ZINBELL L Corner Shape Stand Stainless Steel Polished Chrome Multipurpose Storage Rack for Kitchen Shelf - Dish Kitchen & ...;home & kitchen;Kitchen Storage & Containers;https://m.media-amazon.com/images/I/81U++2Ilm7S._AC_UL320_.jpg;https://www.amazon.in/ZINBELL-Corner-Stainless-Multipurpose-Storage/dp/B08WZJDD7R/ref=sr_1_5849?qid=1679212845&s=kitchen&sr=1-5849;4.3;105.0;999.0;2999.0;ZINBELL
Tupperware Plastic Storage Jar- 200 ml, 6 Pieces, Multicolour;home & kitchen;Kitchen Storage & Containers;https://m.media-amazon.com/images/I/61m7PrGeXmL._AC_UL320_.jpg;https://www.amazon.in/Tupperware-Plastic-Storage-Pieces-Multicolour/dp/B08NZKWQRX/ref=sr_1_5850?qid=1679212845&s=kitchen&sr=1-5850;3.9;41.0;1200.0;1600.0;Tupperware
YHK Miniature Jam Jar Milton Mini Storage Glass Jar, Set of 2, 100 ml 2 -Mini Cube Lovely Small Wish Bottle Tiny Clear Emp...;home & kitchen;Kitchen Storage & Containers;https://m.media-amazon.com/images/I/41G7Od2VFyL._AC_UL320_.jpg;https://www.amazon.in/YHK-Miniature-Storage-Wishing-Containers/dp/B08FFYGWF6/ref=sr_1_5851?qid=1679212845&s=kitchen&sr=1-5851;4.2;24.0;199.0;399.0;YHK
Aristo Lock & Fresh 334 Plastic Storage Container - 6070 ML, Transparent Clear, large (LOCK&FRESH334);home & kitchen;Kitchen Storage & Containers;https://m.media-amazon.com/images/I/51-3QWt1d2L._AC_UL320_.jpg;https://www.amazon.in/ARISTO-Fresh-Plastic-Storage-Container/dp/B0972YPVNV/ref=sr_1_5852?qid=1679212845&s=kitchen&sr=1-5852;4.4;6.0;286.0;354.0;Aristo
SPRINGWAY - Brand of Happiness | Eco Neer Rainbow Stainless Steel Water Bottle 1000ml Set of 1 (Brown);home & kitchen;Kitchen Storage & Containers;https://m.media-amazon.com/images/I/41VmhDbfQsL._AC_UL320_.jpg;https://www.amazon.in/SPRINGWAY-Happiness-Rainbow-Stainless-Bottle/dp/B0BTVRGVDY/ref=sr_1_5853?qid=1679212845&s=kitchen&sr=1-5853;;;279.0;599.0;SPRINGWAY
The Better Home Stainless Steel Water Bottle 1 Litre | Non-Toxic & BPA Free Water Bottles 1+ Litre | Steel Bottle For Hom...;home & kitchen;Kitchen Storage & Containers;https://m.media-amazon.com/images/I/41NG0OtqtDL._AC_UL320_.jpg;https://www.amazon.in/Better-Home-Stainless-Non-Toxic-Bottles/dp/B0BQHXJ3GC/ref=sr_1_5854?qid=1679212845&s=kitchen&sr=1-5854;3.2;4.0;345.0;1099.0;The
Homeotrade Plastic Homeopathic Empty Plastic Bottle 2 Dram Bottle, Pack Of 144;home & kitchen;Kitchen Storage & Containers;https://m.media-amazon.com/images/I/41TBTG7yAWL._AC_UL320_.jpg;https://www.amazon.in/HOMEOTRADE-Homeopathic-Empty-Bottle-Dram-PIECES/dp/B07Y21XSDK/ref=sr_1_5855?qid=1679212845&s=kitchen&sr=1-5855;4.4;321.0;179.0;1375.0;Homeotrade
Himoksh Stainless Steel Tea Infuser Bottle Thermos Vacuum Water Bottle/ Travel Mug with Smart LCD Touch Screen (Black);home & kitchen;Kitchen Storage & Containers;https://m.media-amazon.com/images/I/61uKS8yWY1L._AC_UL320_.jpg;https://www.amazon.in/Himoksh-Infuser-Thermos-Portable-CUSTOMIZED/dp/B08XBS2B11/ref=sr_1_5856?qid=1679212845&s=kitchen&sr=1-5856;3.9;123.0;799.0;2299.0;Himoksh
Prestige Stainless Steel Thermopro Water Bottle (Silver, 1 L);home & kitchen;Kitchen Storage & Containers;https://m.media-amazon.com/images/I/416AbxMG9DL._AC_UL320_.jpg;https://www.amazon.in/Prestige-Stainless-Thermopro-Bottle-Silver/dp/B07H6P9B59/ref=sr_1_6241?qid=1679212851&s=kitchen&sr=1-6241;4.3;147.0;1030.0;1375.0;Prestige
Breeze Ranzer 3 Steel Lunch Box Set of 3 containers;home & kitchen;Kitchen Storage & Containers;https://m.media-amazon.com/images/I/71E-xoHezuL._AC_UL320_.jpg;https://www.amazon.in/Breeze-Ocean-Stainelss-Plastic-Bottom/dp/B07FFRNCQJ/ref=sr_1_6242?qid=1679212851&s=kitchen&sr=1-6242;3.9;65.0;551.0;652.0;Breeze
Cello Travel Star Pastic Insulated Water Jug | Inner Stainless Steel Jug | Hot & Cold | Easy to Carry | 16 litres, Brown;home & kitchen;Kitchen Storage & Containers;https://m.media-amazon.com/images/I/81s-2zBsndL._AC_UL320_.jpg;https://www.amazon.in/Cello-Travel-Plastic-Insulated-litres/dp/B071V8926Y/ref=sr_1_6243?qid=1679212851&s=kitchen&sr=1-6243;3.9;1104.0;826.45;1564.0;Cello
Srxes 304 Stainless Steel Lunch Boxes, Lunch Boxes, Lunch Box for School, Lunch Box for Office Men Steel, Ideal for 12+ Ye...;home & kitchen;Kitchen Storage & Containers;https://m.media-amazon.com/images/I/610q-oQmg9L._AC_UL320_.jpg;https://www.amazon.in/Srxes-Stainless-School-Teenagers-Compartment/dp/B0B56WGCQV/ref=sr_1_6244?qid=1679212851&s=kitchen&sr=1-6244;4.6;26.0;1139.0;1999.0;Srxes
Aristo Glory Plastic Storage Container 3 Pcs Set, Color May Vary;home & kitchen;Kitchen Storage & Containers;https://m.media-amazon.com/images/I/51zd5-uYDtL._AC_UL320_.jpg;https://www.amazon.in/Aristo-Glory-Plastic-Storage-Container/dp/B09XKH3LWD/ref=sr_1_6245?qid=1679212851&s=kitchen&sr=1-6245;5.0;4.0;93.65;130.0;Aristo
BOWLMAN Stainless Steel Microwave Safe Euro Bowl Set with Lid for Food Serving and Storage Containers for Your Modern Kitc...;home & kitchen;Kitchen Storage & Containers;https://m.media-amazon.com/images/I/71NF9F9bgzL._AC_UL320_.jpg;https://www.amazon.in/BOWLMAN-Stainless-Microwave-Serving-Containers/dp/B09N3RF45S/ref=sr_1_6246?qid=1679212851&s=kitchen&sr=1-6246;3.9;21.0;429.0;799.0;BOWLMAN
SOLOMON ™ XLLENT Premium Series New Unbreakable Sturdy Transparent Plastic Airtight Container Jar 500 ML (Pack of 6, Blue);home & kitchen;Kitchen Storage & Containers;https://m.media-amazon.com/images/I/719JvVYkgWL._AC_UL320_.jpg;https://www.amazon.in/SOLOMON-Unbreakable-Transparent-Airtight-Container/dp/B095PNW8T5/ref=sr_1_6247?qid=1679212851&s=kitchen&sr=1-6247;4.5;169.0;464.0;1299.0;SOLOMON
Ceramic Blue Floral Art 500 ML Oil Dispenser for Kitchen, Oil Bottle, Oil Sprayer, Vinegar Bottle for Kitchen Storage/ 10...;home & kitchen;Kitchen Storage & Containers;https://m.media-amazon.com/images/I/71P+XcOEEOL._AC_UL320_.jpg;https://www.amazon.in/Ceramic-Dispenser-Kitchen-Microwave-Piece-Blue/dp/B09Z6W824Q/ref=sr_1_6248?qid=1679212851&s=kitchen&sr=1-6248;;;499.0;1245.0;Ceramic
UNPAX Dispenser - Glass Cold Water Mason Jar Beer Dispenser, Clear, Beverage Drink Dispenser, Glass Pitcher with tap/Spigo...;home & kitchen;Kitchen Storage & Containers;https://m.media-amazon.com/images/I/41r673ym-sL._AC_UL320_.jpg;https://www.amazon.in/UNPAX-Dispenser-Beverage-Pitcher-Spigot/dp/B09RVT6KFR/ref=sr_1_6249?qid=1679212851&s=kitchen&sr=1-6249;3.4;19.0;999.0;3999.0;UNPAX
hindustani saudagar Ceramic Jar Set with Iron Stand, 2 Spoon & Matching Lid for Storage Pickle (Red);home & kitchen;Kitchen Storage & Containers;https://m.media-amazon.com/images/I/71cP2hxfMwL._AC_UL320_.jpg;https://www.amazon.in/Hindustani-Saudagar-Ceramic-Matching-Storage/dp/B078MJ4JYW/ref=sr_1_6250?qid=1679212851&s=kitchen&sr=1-6250;4.1;45.0;849.0;1999.0;hindustani
Kashvi Enterprises Plastic Polythene Clear Bags Small Size Pouches Transparent Self Adhesive BOPP Bags For Jewellery Packi...;home & kitchen;Kitchen Storage & Containers;https://m.media-amazon.com/images/I/21rNRPs58WL._AC_UL320_.jpg;https://www.amazon.in/Kashvi-Enterprises-Polythene-Transparent-Jewellery/dp/B0B3RHSWHV/ref=sr_1_6251?qid=1679212851&s=kitchen&sr=1-6251;3.5;12.0;;199.0;Kashvi
DCloud Hub Matka Style Glass Jars and Container for Storge Spices and Pickle 500 Ml Pieces:-6;home & kitchen;Kitchen Storage & Containers;https://m.media-amazon.com/images/I/711TrO78drL._AC_UL320_.jpg;https://www.amazon.in/Dcloud-Hub-Container-Storge-Spices/dp/B09D3QF62F/ref=sr_1_6252?qid=1679212851&s=kitchen&sr=1-6252;3.2;6.0;299.0;499.0;DCloud
GIFT IMPEX Copper Bedroom Jar | Bedroom Surayi | Copper Water Bedroom Pot | Sugar Pot |750 ml |;home & kitchen;Kitchen Storage & Containers;https://m.media-amazon.com/images/I/71HQhhxrWaL._AC_UL320_.jpg;https://www.amazon.in/IMPEX-Copper-Bedroom-Surayi-Water/dp/B0B1QMZSXM/ref=sr_1_6253?qid=1679212851&s=kitchen&sr=1-6253;5.0;6.0;999.0;3499.0;GIFT
Reinvention Factory Wooden Cutlery & Tissue Holder in Fairy Garden Design;home & kitchen;Kitchen Storage & Containers;https://m.media-amazon.com/images/I/71QSo8937KL._AC_UL320_.jpg;https://www.amazon.in/Reinvention-Factory-Wooden-Cutlery-Tissue/dp/B0BDKVGJQT/ref=sr_1_6254?qid=1679212851&s=kitchen&sr=1-6254;5.0;1.0;749.0;1499.0;Reinvention
YBN Premium Kids Unicorn Vacuum Flask/Water Bottle/Mason Jar/Sipper Glass Tumbler/Sipper (Pink);home & kitchen;Kitchen Storage & Containers;https://m.media-amazon.com/images/I/51GyDEXEg-L._AC_UL320_.jpg;https://www.amazon.in/YBN-Premium-Unicorn-Vacuum-Tumbler/dp/B0BN6JMBJV/ref=sr_1_6255?qid=1679212851&s=kitchen&sr=1-6255;3.2;8.0;279.0;499.0;YBN
HARI ENTERPRISE 1000 ml Glass Jar with Air Tight Gold Lid for Kitchen Dried Masla Storage Jar,Honey Jar,Jar and Container,...;home & kitchen;Kitchen Storage & Containers;https://m.media-amazon.com/images/I/51UOokkeY0S._AC_UL320_.jpg;https://www.amazon.in/ENTERPRISE-Kitchen-Storage-Container-Visible/dp/B08XJXYD9R/ref=sr_1_6256?qid=1679212851&s=kitchen&sr=1-6256;3.6;17.0;549.0;999.0;HARI
FREK SELAK 3 Compartment Lunch Box Stainless Steel Tiffin Box for Boys, Girls, School & Office Men. (Pack of 1)(Multicolo...;home & kitchen;Kitchen Storage & Containers;https://m.media-amazon.com/images/I/61u-yenNXcL._AC_UL320_.jpg;https://www.amazon.in/FREK-SELAK-Compartment-Stainless-Multicolor/dp/B0BBMJCKGQ/ref=sr_1_6257?qid=1679212851&s=kitchen&sr=1-6257;3.4;9.0;749.0;1899.0;FREK
GT Copper Matka Stand,Matka Stand, Water Dispenser Stand,Kitchen Stand,Water Dispencer Stand, Water Pot Stand, Matka Pot S...;home & kitchen;Kitchen Storage & Containers;https://m.media-amazon.com/images/I/61yVJGCX9IL._AC_UL320_.jpg;https://www.amazon.in/Copper-Stand-Dispenser-Kitchen-Dispencer/dp/B09Q214W6R/ref=sr_1_6258?qid=1679212851&s=kitchen&sr=1-6258;3.1;10.0;369.0;899.0;GT
ShubhKraft Birthday Return Gift Item In Bulk | Oliya Print Water Bottle For Kids Boys & Girls ( Pack Of 12, Multicolor );home & kitchen;Kitchen Storage & Containers;https://m.media-amazon.com/images/I/71R1ClypxIL._AC_UL320_.jpg;https://www.amazon.in/ShubhKraft-Oliya-Water-Bottle-Multicolor/dp/B0BS3DJQ4X/ref=sr_1_6259?qid=1679212851&s=kitchen&sr=1-6259;5.0;1.0;764.0;1375.0;ShubhKraft
Amazon Brand - Solimo Water Bottle, Spill-Proof, Ergonomic, Safe for Refrigerator, Freezer and Dishwasher (Stainless Stee...;home & kitchen;Kitchen Storage & Containers;https://m.media-amazon.com/images/I/81xOf1F3wAL._AC_UL320_.jpg;https://www.amazon.in/Amazon-Brand-Spill-Proof-Refrigerator-Dishwasher/dp/B0BMQNX1JQ/ref=sr_1_6260?qid=1679212851&s=kitchen&sr=1-6260;4.5;43.0;;799.0;Amazon
Cutting EDGE Mini Size Set of 12-225ML Twister Airtight Plastic Jar - Clear, Diamond Checkers Container - for Spice, Condi...;home & kitchen;Kitchen Storage & Containers;https://m.media-amazon.com/images/I/71u9QV1j3gL._AC_UL320_.jpg;https://www.amazon.in/Cutting-EDGE-Small-Size-Condiments/dp/B084WQ78H1/ref=sr_1_6261?qid=1679212851&s=kitchen&sr=1-6261;4.2;140.0;582.0;600.0;Cutting
MILTON ROYAL4, 4 Containers Stainless Steel Lunch Box (Silver, 2000 ml);home & kitchen;Kitchen Storage & Containers;https://m.media-amazon.com/images/I/51gOFkLiVRL._AC_UL320_.jpg;https://www.amazon.in/Milton-ROYAL4-Containers-Lunch-2000/dp/B089ST3W3G/ref=sr_1_6262?qid=1679212851&s=kitchen&sr=1-6262;4.1;75.0;;1750.0;MILTON
Ecoline Power Lunch Q2, Electric Lunch Box,Capacity 800ml,(2 Containers 400ml) Maroon;home & kitchen;Kitchen Storage & Containers;https://m.media-amazon.com/images/I/81AvuDFEmYL._AC_UL320_.jpg;https://www.amazon.in/Ecoline-Lunch-Fabric-Electric-Power/dp/B01G8AWWP6/ref=sr_1_6263?qid=1679212851&s=kitchen&sr=1-6263;4.2;116.0;994.0;1205.0;Ecoline
Creation India Craft Wooden Trianguler Jars Set With Serving Trays & Spoons Mukhwas Freshener Jar Set, 60 Ml, Multicoloured;home & kitchen;Kitchen Storage & Containers;https://m.media-amazon.com/images/I/81rQ4Lz3fhL._AC_UL320_.jpg;https://www.amazon.in/Creation-India-Craft-Trianguler-Multicoloured/dp/B08GM9XXYX/ref=sr_1_6264?qid=1679212851&s=kitchen&sr=1-6264;3.5;18.0;854.0;1250.0;Creation
ROLLYWARE Stainless Steel Toast Holder, Durable, 6 Space Bread Carrying Rack Holder., (chrome steel);home & kitchen;Kitchen Storage & Containers;https://m.media-amazon.com/images/I/61WpcvkGMzL._AC_UL320_.jpg;https://www.amazon.in/ROLLYWARE-Stainless-Durable-Carrying-Holder/dp/B09X77Q59G/ref=sr_1_6337?qid=1679212853&s=kitchen&sr=1-6337;5.0;3.0;399.0;999.0;ROLLYWARE
ONS KIDS Stainless Steel Water Bottle for Kids, Flip-up Straw Bottles, Easy Grip / Leak Proof steel bottles for children, ...;home & kitchen;Kitchen Storage & Containers;https://m.media-amazon.com/images/I/71T80m-X+JL._AC_UL320_.jpg;https://www.amazon.in/ONS-KIDS-Stainless-Flip-up-children/dp/B0BC463LWV/ref=sr_1_6338?qid=1679212853&s=kitchen&sr=1-6338;4.1;10.0;999.0;1099.0;ONS
FOMQUAZLI Stainless Steel Double Wall Tumbler Vacuum Flask Sipper Bottle Thermo Tea Mug Travel Thermos Mug with Flip Lid M...;home & kitchen;Kitchen Storage & Containers;https://m.media-amazon.com/images/I/41KHm2+YZzL._AC_UL320_.jpg;https://www.amazon.in/FOMQUAZLI-Stainless-Double-Tumbler-Thermos/dp/B0BSTDKT1H/ref=sr_1_6339?qid=1679212853&s=kitchen&sr=1-6339;5.0;1.0;349.0;999.0;FOMQUAZLI
SUPERCOM Zip Lock Pouch Bags Covers | Transparent Reusable/Resealable Zip Seal Zip Lock Bags For Airtight Seal For Travel ...;home & kitchen;Kitchen Storage & Containers;https://m.media-amazon.com/images/I/41h6OqG+ePL._AC_UL320_.jpg;https://www.amazon.in/Supercom-Transparent-Resealable-Refrigerator-Accessories/dp/B09NBM9R4M/ref=sr_1_6340?qid=1679212853&s=kitchen&sr=1-6340;3.7;484.0;445.0;519.0;SUPERCOM
SKi Homeware Stylish Printed Aqua Slim-450 Stainless Steel Single Wall Water Bottle for Kids (450 ml, Spiderman);home & kitchen;Kitchen Storage & Containers;https://m.media-amazon.com/images/I/61VTQzPtiBS._AC_UL320_.jpg;https://www.amazon.in/Homeware-Stylish-Slim-450-Stainless-Spiderman/dp/B0943NTPFB/ref=sr_1_6341?qid=1679212853&s=kitchen&sr=1-6341;3.9;47.0;349.0;399.0;SKi
Pure Source India Glass Jar Container With Airtight Cap,Capacity 500gm (Set of 6);home & kitchen;Kitchen Storage & Containers;https://m.media-amazon.com/images/I/81vjn70uDlL._AC_UL320_.jpg;https://www.amazon.in/Pure-Source-India-Capacity-Round/dp/B01HDGWGQO/ref=sr_1_6342?qid=1679212853&s=kitchen&sr=1-6342;4.2;385.0;499.0;999.0;Pure
STAR CRAFT Wooden Spices Box Handcrafted With Antique Lock 12 Partition & with Spoon Masala Box Masala Dani Masala Dabba (...;home & kitchen;Kitchen Storage & Containers;https://m.media-amazon.com/images/I/61W9iQBA-EL._AC_UL320_.jpg;https://www.amazon.in/STAR-CRAFT-Handcrafted-Partition-Size-30X23X7/dp/B08VF568GQ/ref=sr_1_6343?qid=1679212853&s=kitchen&sr=1-6343;3.3;10.0;499.0;1199.0;STAR
LD LUCIDO DECORE Royal look Classic Silver Plated Designer Bowl Shape Dry Fruit Storage Box/Container with 5 Compartment a...;home & kitchen;Kitchen Storage & Containers;https://m.media-amazon.com/images/I/51D4SvgKb7L._AC_UL320_.jpg;https://www.amazon.in/LD-LUCIDO-DECORE-Container-Compartment/dp/B0BBNGX7Y8/ref=sr_1_6344?qid=1679212853&s=kitchen&sr=1-6344;2.6;2.0;1099.0;1299.0;LD
Femora High Stainless Steel Square Airtight Leakproof Unbreakable Storage Container (380 ml, 550 ml, 750 ml, Silver) - Set...;home & kitchen;Kitchen Storage & Containers;https://m.media-amazon.com/images/I/51goSWHjA3L._AC_UL320_.jpg;https://www.amazon.in/Femora-Container-Airtight-Leakproof-Unbreakable/dp/B08NF3Q915/ref=sr_1_6345?qid=1679212853&s=kitchen&sr=1-6345;4.1;176.0;1035.0;1315.0;Femora
Signoraware Cute Steel Container, 100ml, Set of 1, Blue;home & kitchen;Kitchen Storage & Containers;https://m.media-amazon.com/images/I/61RtMbv28GL._AC_UL320_.jpg;https://www.amazon.in/Signoraware-Cute-Steel-Container-100ml/dp/B0BL1JDBR4/ref=sr_1_6346?qid=1679212853&s=kitchen&sr=1-6346;4.1;5.0;;199.0;Signoraware
tupperware Kids Divided 1 pc Containers Lunch Box (1 L) (Green, Plastic);home & kitchen;Kitchen Storage & Containers;https://m.media-amazon.com/images/I/514f1e0MitL._AC_UL320_.jpg;https://www.amazon.in/tupperware-Divided-Containers-Lunch-Plastic/dp/B0BCH5G3DB/ref=sr_1_6347?qid=1679212853&s=kitchen&sr=1-6347;3.9;4.0;700.0;750.0;tupperware
Ajay's Shoppe Stainless Steel Matka Stand/Pot Stand 9 Inch;home & kitchen;Kitchen Storage & Containers;https://m.media-amazon.com/images/I/51Wm4+3OOPL._AC_UL320_.jpg;https://www.amazon.in/Ajays-Shoppe-Stainless-Matka-Stand/dp/B099WSZW53/ref=sr_1_6348?qid=1679212853&s=kitchen&sr=1-6348;;;399.0;799.0;Ajay's
V4L Plastic Round Storage Microwave Reusable Containers with lid 500ml - Pack of 20;home & kitchen;Kitchen Storage & Containers;https://m.media-amazon.com/images/I/51LWff9tgrL._AC_UL320_.jpg;https://www.amazon.in/Enterprises-Containers-Microwave-Reusable-delivery/dp/B08VHHXWM5/ref=sr_1_6349?qid=1679212853&s=kitchen&sr=1-6349;4.0;67.0;299.0;399.0;V4L
Kuber Industries Stainless Steel Kitchen Containers Set | Durable & Stackable | Storage Canisters for Tea, Coffee & Sugar...;home & kitchen;Kitchen Storage & Containers;https://m.media-amazon.com/images/I/51UV7iSmJAL._AC_UL320_.jpg;https://www.amazon.in/Kuber-Industries-Stainless-Containers-Stackable/dp/B0B3DNRY95/ref=sr_1_6350?qid=1679212853&s=kitchen&sr=1-6350;4.4;19.0;361.0;749.0;Kuber
ZEBROC Metal Kitchen Rolling Microwave Table on Wheels - Foldable Rolling Storage Table with Wheels -Metal Storage Rack - ...;home & kitchen;Kitchen Storage & Containers;https://m.media-amazon.com/images/I/71NkQ91GkAS._AC_UL320_.jpg;https://www.amazon.in/ZEBROC-Kitchen-Rolling-Microwave-Wheels/dp/B08RZ2G48S/ref=sr_1_6351?qid=1679212853&s=kitchen&sr=1-6351;4.2;75.0;4399.0;7999.0;ZEBROC
Nayasa Daily Jug,2000 ml (Pink);home & kitchen;Kitchen Storage & Containers;https://m.media-amazon.com/images/I/519A7mwi1EL._AC_UL320_.jpg;https://www.amazon.in/Nayasa-Daily-Jug-2000-Pink/dp/B01MCUGQOM/ref=sr_1_6352?qid=1679212853&s=kitchen&sr=1-6352;3.8;88.0;189.64;239.0;Nayasa
Plantex Premium Stainless Steel & Aluminium Towel Rod/Towel Hanger for Bathroom/Towel Stand/Bathroom Accessories (24 Inch-...;home & kitchen;Kitchen Storage & Containers;https://m.media-amazon.com/images/I/71GWNfUHgDL._AC_UL320_.jpg;https://www.amazon.in/Plantex-Stainless-Aluminium-Accessories-Inch-Chrome/dp/B09GKDPP9V/ref=sr_1_6353?qid=1679212853&s=kitchen&sr=1-6353;3.9;53.0;664.0;1799.0;Plantex
Dharmik Enterprise 4 Pcs Plastic Fridge Storage Box with Handle and Cover Kitchen Freezer Containers Food Basket Set for V...;home & kitchen;Kitchen Storage & Containers;https://m.media-amazon.com/images/I/61EtajypzmL._AC_UL320_.jpg;https://www.amazon.in/Dharmik_Enterprise-Plastic-Storage-Containers-Vegetables/dp/B085NJ2YHK/ref=sr_1_6354?qid=1679212853&s=kitchen&sr=1-6354;3.8;43.0;999.0;1676.0;Dharmik
Kuber Industries Plastic 3-Tier Triangle Storage Rack Shelf for Kitchen,Living Room,Bathroom, Office (Brown) -46KM0551;home & kitchen;Kitchen Storage & Containers;https://m.media-amazon.com/images/I/61WpwWd2KZL._AC_UL320_.jpg;https://www.amazon.in/Kuber-Industries-Triangle-Bathroom-46KM0551/dp/B09MLL19MH/ref=sr_1_6355?qid=1679212853&s=kitchen&sr=1-6355;3.4;34.0;464.0;499.0;Kuber
ADTOO BTS water bottle, kids water bottle, gym bottle, (750ml - multi color) 00019;home & kitchen;Kitchen Storage & Containers;https://m.media-amazon.com/images/I/51kgk2lPYuL._AC_UL320_.jpg;https://www.amazon.in/ADTOO-water-bottle-kids-750ml/dp/B0BHZP2S4L/ref=sr_1_6356?qid=1679212853&s=kitchen&sr=1-6356;5.0;1.0;345.0;599.0;ADTOO
Altegic red checks Lug Cap Lid for Glass Jar, Airtight Metal Cap Lid for Storage Glass Jar and bottle cap Rust-proof, Leak...;home & kitchen;Kitchen Storage & Containers;https://m.media-amazon.com/images/I/5118UB1pwaL._AC_UL320_.jpg;https://www.amazon.in/Altegic-checks-Airtight-Storage-Rust-proof/dp/B0BHZ6LWZR/ref=sr_1_6357?qid=1679212853&s=kitchen&sr=1-6357;4.5;2.0;169.0;295.0;Altegic
RAMOJI INTERNATIONAL 2000 ml / 2 kg Glass kitchen Storage Jars with Rubber gasket airtight Square kitchen storage box Cani...;home & kitchen;Kitchen Storage & Containers;https://m.media-amazon.com/images/I/312lucWAzhL._AC_UL320_.jpg;https://www.amazon.in/RAMOJI-INTERNATIONAL-kitchen-airtight-Canisters/dp/B08ZLRZB2D/ref=sr_1_6358?qid=1679212853&s=kitchen&sr=1-6358;4.2;10.0;999.0;1499.0;RAMOJI
PALOMINO Stainless Steel 4 Shelf Wall Mount Kitchen Utensils Rack | Dish Rack with Plate & Cutlery Stand | Modular Kitchen...;home & kitchen;Kitchen Storage & Containers;https://m.media-amazon.com/images/I/51ZWirvs2fL._AC_UL320_.jpg;https://www.amazon.in/PALOMINO-Stainless-Kitchen-Utensils-Organizer/dp/B07TH8SDW2/ref=sr_1_6359?qid=1679212853&s=kitchen&sr=1-6359;4.0;11.0;1210.0;3299.0;PALOMINO
"Tupperware Cool n Chic Plastic Bottle, 750 ml, Set of 2, Blue;Black";home & kitchen;Kitchen Storage & Containers;https://m.media-amazon.com/images/I/51bMN4NZ-ML._AC_UL320_.jpg;https://www.amazon.in/Tupperware-Cool-Plastic-Bottle-Black/dp/B08R8YQN3L/ref=sr_1_6360?qid=1679212853&s=kitchen&sr=1-6360;4.5;176.0;599.0;650.0;Tupperware
SignoraWare Starlite Borosilicate Glass Water Bottle with Screw Cap | Leak Proof Transparent (1 litre, Set of 1, Clear);home & kitchen;Kitchen Storage & Containers;https://m.media-amazon.com/images/I/71CHCewMDML._AC_UL320_.jpg;https://www.amazon.in/Signoraware-Starlite-Borosilicate-Bottle-Transparent/dp/B07TPQ8RQR/ref=sr_1_7057?qid=1679212862&s=kitchen&sr=1-7057;4.2;205.0;450.0;530.0;SignoraWare
Kuber Industries Lunch Bag|Reusable Jute Fabric Tote Bag|Durable & Attractive Print Tiffin Carry Hand bag with Handle For ...;home & kitchen;Kitchen Storage & Containers;https://m.media-amazon.com/images/I/81n-awKkkaL._AC_UL320_.jpg;https://www.amazon.in/Kuber-Industries-Reusable-Durable-Attractive/dp/B0BHTDWPJ8/ref=sr_1_7058?qid=1679212862&s=kitchen&sr=1-7058;3.0;2.0;;229.0;Kuber
EMPORIUM Air Tight Food Storage Containers Kitchen Containers for Storage Set Plastic Storage Box for Kitchen Airtight Con...;home & kitchen;Kitchen Storage & Containers;https://m.media-amazon.com/images/I/41cnDpiuyfL._AC_UL320_.jpg;https://www.amazon.in/EMPORIUM-Airtight-Plastic-Kitchen-Containers/dp/B07V57JWN1/ref=sr_1_7059?qid=1679212862&s=kitchen&sr=1-7059;4.2;2268.0;749.0;1200.0;EMPORIUM
Ashlo's Décor Ceramic Handcrafted Multi Utility Storage Jar with Lid 1000 ml | Ceramic Kitchen Canister | Cookie Jar | Pic...;home & kitchen;Kitchen Storage & Containers;https://m.media-amazon.com/images/I/51OT6gWO-4L._AC_UL320_.jpg;https://www.amazon.in/Ashlos-Ceramic-Handcrafted-Utility-Canister/dp/B0BHW46J54/ref=sr_1_7060?qid=1679212862&s=kitchen&sr=1-7060;5.0;1.0;520.0;599.0;Ashlo's
Kuber Industries Storage Utility Container|Plastic Unbreakable 4 Compartment Food Storage Jar|Leak Roof,BPA Free Food Kitc...;home & kitchen;Kitchen Storage & Containers;https://m.media-amazon.com/images/I/51m4wxlQJrL._AC_UL320_.jpg;https://www.amazon.in/Kuber-Industries-Unbreakable-Compartment-Transparent/dp/B0BG8FWVW4/ref=sr_1_7061?qid=1679212862&s=kitchen&sr=1-7061;4.1;15.0;269.0;699.0;Kuber
Tupperware Plastic Water Bottle, 1L, Set of 2, Yellow And Purple;home & kitchen;Kitchen Storage & Containers;https://m.media-amazon.com/images/I/31skZo9i8aL._AC_UL320_.jpg;https://www.amazon.in/Tupperware-Plastic-Bottle-Yellow-Purple/dp/B09NBQ8VXS/ref=sr_1_7062?qid=1679212862&s=kitchen&sr=1-7062;4.6;6.0;;640.0;Tupperware
