name;main_category;sub_category;image;link;ratings;no_of_ratings;discount_price;actual_price;brand
MILTON Kool Trendy 500 Plastic Insulated Water Bottle with Straw for Kids, 490 ml, Orange | School Bottle | Picnic Bottle...;home & kitchen;Kitchen Storage & Containers;https://m.media-amazon.com/images/I/61GnCtCqy7L._AC_UL320_.jpg;https://www.amazon.in/Milton-Trendy-Plastic-Insulated-Bottle/dp/B09Y5LZ3JH/ref=sr_1_49?qid=1679212742&s=kitchen&sr=1-49;4.2;743.0;;170.0;MILTON
KESI ORNAMENTS Sprout Maker with 4 Compartments for Multi Purpose Use - Plastic Grocery Container Sprouted Grains Seeds Da...;home & kitchen;Kitchen Storage & Containers;https://m.media-amazon.com/images/I/51mu+EwfNjL._AC_UL320_.jpg;https://www.amazon.in/Sprout-Maker-Compartments-Multi-Purpose/dp/B0B6PZJV4D/ref=sr_1_50?qid=1679212742&s=kitchen&sr=1-50;4.4;205.0;284.0;499.0;KESI
MATIC HOUSEWARE Air Tight Containers For Kitchen Storage Set, Bpa-Free Container For Kitchen Storage Set Pantry Organizati...;home & kitchen;Kitchen Storage & Containers;https://m.media-amazon.com/images/I/91-pXQn3EDL._AC_UL320_.jpg;https://www.amazon.in/MATIC-HOUSEWARE-Plastic-Container-Kitchen/dp/B09414W9Z5/ref=sr_1_51?qid=1679212742&s=kitchen&sr=1-51;4.4;210.0;497.0;1999.0;MATIC
Cello H2O Stainless Steel Water Bottle, 1 Litre, Blue;home & kitchen;Kitchen Storage & Containers;https://m.media-amazon.com/images/I/61nb1cWMOiL._AC_UL320_.jpg;https://www.amazon.in/Cello-Stainless-Steel-Water-Bottle/dp/B07F5SHD5H/ref=sr_1_52?qid=1679212742&s=kitchen&sr=1-52;4.1;9080.0;449.0;535.0;Cello
Milton Pacific 1000 Pet Water Bottles Set of 6, 1 Litre Each, Blue;home & kitchen;Kitchen Storage & Containers;https://m.media-amazon.com/images/I/71R266B8mqL._AC_UL320_.jpg;https://www.amazon.in/Milton-201502-BOTTLE-Pacific-Green/dp/B01BSY2ZTU/ref=sr_1_53?qid=1679212742&s=kitchen&sr=1-53;4.2;7337.0;176.0;270.0;Milton
Catron Stainless Steel Spice Grinder Glass, Steel Squeeze Mill,Pepper Grinder or Salt Shaker Manual Shaker, Spice Storage ...;home & kitchen;Kitchen Storage & Containers;https://m.media-amazon.com/images/I/511NXpXM5TL._AC_UL320_.jpg;https://www.amazon.in/Catron-Stainless-Grinder-Adjustable-Coarseness/dp/B0B7146T5L/ref=sr_1_54?qid=1679212742&s=kitchen&sr=1-54;3.9;441.0;222.0;999.0;Catron
Amazon Brand - Solimo Slim Stainless Steel Water Bottle, Set of 3, 1 L Each;home & kitchen;Kitchen Storage & Containers;https://m.media-amazon.com/images/I/81mrMggUQnS._AC_UL320_.jpg;https://www.amazon.in/Amazon-Brand-Solimo-Stainless-Bottle/dp/B0929P7NT1/ref=sr_1_55?qid=1679212742&s=kitchen&sr=1-55;4.0;2585.0;699.0;999.0;Amazon
Cello Puro Kids Stainless Steel Inner 600 Milliliters Water Bottle (Red);home & kitchen;Kitchen Storage & Containers;https://m.media-amazon.com/images/I/61ckbOjGh3L._AC_UL320_.jpg;https://www.amazon.in/Cello-Puro-Kids-Steel-Inner/dp/B0817RLYMQ/ref=sr_1_56?qid=1679212742&s=kitchen&sr=1-56;4.0;5051.0;;349.0;Cello
amaziyo Fridge plastic Storage Boxes, Fridge Organizer Case With Removable Drain Plate Stackable Fridge Storage Containers...;home & kitchen;Kitchen Storage & Containers;https://m.media-amazon.com/images/I/71xDTM-WtUL._AC_UL320_.jpg;https://www.amazon.in/Organizer-Removable-Containers-Vegetables-Pack/dp/B0BLP4984D/ref=sr_1_57?qid=1679212742&s=kitchen&sr=1-57;4.5;235.0;499.0;999.0;amaziyo
Beddify Set Of 12 Reusable Fridge Storage Bags For Vegetables and Fruits Dual Layer Mesh Net Multipurpose Multi-Size Kitch...;home & kitchen;Kitchen Storage & Containers;https://m.media-amazon.com/images/I/91g9SEaYIjL._AC_UL320_.jpg;https://www.amazon.in/Beddify-Reusable-Storage-Ziplock-Vegetables/dp/B07GZLWFTJ/ref=sr_1_58?qid=1679212742&s=kitchen&sr=1-58;4.2;8875.0;329.0;599.0;Beddify
Rokoo Bio-Cling Film Wrap Food Packaging Storing Wrap - 100 Meter Roll (100M);home & kitchen;Kitchen Storage & Containers;https://m.media-amazon.com/images/I/611SkoPM05L._AC_UL320_.jpg;https://www.amazon.in/Rokoo-Bio-Cling-Film-Packaging-Storing/dp/B09QX58HJP/ref=sr_1_59?qid=1679212742&s=kitchen&sr=1-59;3.8;734.0;289.0;349.0;Rokoo
INOVERA Lazy Susan 360° Rotating Kitchen Spice Cosmetic Holder Organizer Rack Tray (23L x 23B x 7.5H cm, Black);home & kitchen;Kitchen Storage & Containers;https://m.media-amazon.com/images/I/71Bn76RFx7L._AC_UL320_.jpg;https://www.amazon.in/INOVERA-Rotating-Kitchen-Cosmetic-Organizer/dp/B0B5T45B9D/ref=sr_1_60?qid=1679212742&s=kitchen&sr=1-60;4.4;1480.0;220.0;599.0;INOVERA
SignoraWare Slim High Microwave Safe Office Two Compartment Lunch Box Set | Borosilicate Glass | Safety Lock Airtight Tiff...;home & kitchen;Kitchen Storage & Containers;https://m.media-amazon.com/images/I/61zUKwnLrqL._AC_UL320_.jpg;https://www.amazon.in/Signoraware-Small-Glass-Lunch-600ml/dp/B079VT48XQ/ref=sr_1_61?qid=1679212742&s=kitchen&sr=1-61;4.3;2804.0;549.0;644.0;SignoraWare
Amazon Brand - Solimo Plastic Dish Drainer and Drying Rack for Kitchen Blue;home & kitchen;Kitchen Storage & Containers;https://m.media-amazon.com/images/I/714T-9deP-L._AC_UL320_.jpg;https://www.amazon.in/Amazon-Brand-Solimo-Drainer-Kitchen/dp/B08BVNK2XL/ref=sr_1_62?qid=1679212742&s=kitchen&sr=1-62;3.9;6716.0;399.0;800.0;Amazon
Cello H2O Premium Edition Plastic Bottle, 1 Litre, Set of 6, Clear;home & kitchen;Kitchen Storage & Containers;https://m.media-amazon.com/images/I/71qccd4faYL._AC_UL320_.jpg;https://www.amazon.in/Cello-Premium-Plastic-Bottle-Litre/dp/B073V44GR4/ref=sr_1_63?qid=1679212742&s=kitchen&sr=1-63;4.4;2564.0;849.0;1050.0;Cello
VR Multi-Purpose 360° Rotating Organizer Tray/Kitchen Organizer/Multi- Function Rotating Tray/Cosmetics Organizer (Teal Bl...;home & kitchen;Kitchen Storage & Containers;https://m.media-amazon.com/images/I/51hd9kbUKnL._AC_UL320_.jpg;https://www.amazon.in/VR-Multi-Purpose-Rotating-Organizer-Cosmetics/dp/B09ZK7P33F/ref=sr_1_64?qid=1679212742&s=kitchen&sr=1-64;4.2;2269.0;;99.0;VR
Speedex Stainless Steel Water Bottle 1 litre, Water Bottles For Fridge, School,Gym,Home,office,Boys, Girls, Kids, Leak Pro...;home & kitchen;Kitchen Storage & Containers;https://m.media-amazon.com/images/I/31ZKMDTLwmL._AC_UL320_.jpg;https://www.amazon.in/Speedex-Stainless-Fridge-Refrigerator-Thunder/dp/B08FYVDRNK/ref=sr_1_65?qid=1679212742&s=kitchen&sr=1-65;3.7;7295.0;365.0;549.0;Speedex
Cello Ozone Plastic Water Bottle Set, 1 Litre, Set of 6, Assorted;home & kitchen;Kitchen Storage & Containers;https://m.media-amazon.com/images/I/61646JcJJkL._AC_UL320_.jpg;https://www.amazon.in/Cello-Ozone-Plastic-Bottle-Assorted/dp/B07BF6T7ZD/ref=sr_1_66?qid=1679212742&s=kitchen&sr=1-66;4.3;11749.0;749.0;854.0;Cello
RIXTEC Pack Of 15 Ziplock Pouch Veg Bag, Ziplock Bag For Storage, Freezer RE-USABLE Zipper Bags, Ziplock Plastic Bags For ...;home & kitchen;Kitchen Storage & Containers;https://m.media-amazon.com/images/I/512Tgh-qyJL._AC_UL320_.jpg;https://www.amazon.in/RIXTEC-Ziplock-Storage-RE-USABLE-22-86cmX25-4cm/dp/B0BD5FCJ6T/ref=sr_1_67?qid=1679212742&s=kitchen&sr=1-67;4.3;138.0;279.0;399.0;RIXTEC
SOLARA Sipper Water Bottle 1 L with Motivational Time Marker, Leakproof Durable BPA Free Non-Toxic Water Bottle for Offic...;home & kitchen;Kitchen Storage & Containers;https://m.media-amazon.com/images/I/81awGP1q9vL._AC_UL320_.jpg;https://www.amazon.in/SOLARA-BPA-Free-Unbreakable-Non-Toxic-Detoxing/dp/B08Y1LD4T7/ref=sr_1_68?qid=1679212742&s=kitchen&sr=1-68;4.4;7740.0;849.0;1499.0;SOLARA
Kitchenwell 3 in 1 Large Durable Plastic Kitchen Sink Dish Rack Drainer Drying Rack Washing Basket with Tray for Kitchen, ...;home & kitchen;Kitchen Storage & Containers;https://m.media-amazon.com/images/I/61vNlQLQB2L._AC_UL320_.jpg;https://www.amazon.in/Kitchenwell-Durable-Plastic-Organizers-Utensils/dp/B0B7F17C88/ref=sr_1_69?qid=1679212742&s=kitchen&sr=1-69;4.0;43.0;;299.0;Kitchenwell
Milton Prudent 1100 Thermosteel 24 Hours Hot and Cold Water Bottle, 1023 ml, Blue;home & kitchen;Kitchen Storage & Containers;https://m.media-amazon.com/images/I/713z0OOpgLL._AC_UL320_.jpg;https://www.amazon.in/Milton-Prudent-1100-Thermosteel-Bottle/dp/B07TTCM3F4/ref=sr_1_70?qid=1679212742&s=kitchen&sr=1-70;4.4;1368.0;1087.0;1450.0;Milton
Pigeon by Stovekraft Inox Hydra Plus Stainless Steel Drinking Water Bottle 900 ml - Silver;home & kitchen;Kitchen Storage & Containers;https://m.media-amazon.com/images/I/51ZN0mL2y2L._AC_UL320_.jpg;https://www.amazon.in/Pigeon-Stovekraft-Stainless-Drinking-Bottle/dp/B0BHSHJZ33/ref=sr_1_71?qid=1679212742&s=kitchen&sr=1-71;3.6;74.0;199.0;495.0;Pigeon
Amazon Brand - Solimo Modular Plastic Storage Containers with Lid, Set of 8 (250ml each), Blue;home & kitchen;Kitchen Storage & Containers;https://m.media-amazon.com/images/I/71Yt4wWmIYL._AC_UL320_.jpg;https://www.amazon.in/Solimo-Plastic-Container-White-SOPLA137/dp/B07P7ZYKYW/ref=sr_1_72?qid=1679212742&s=kitchen&sr=1-72;4.4;13014.0;329.0;750.0;Amazon
Treo By Milton Store Fresh Round Glass Storage Container Set, 380 ml, Set of 2, Transparent;home & kitchen;Kitchen Storage & Containers;https://m.media-amazon.com/images/I/71lXfTFmPfL._AC_UL320_.jpg;https://www.amazon.in/Treo-Milton-Storage-Container-Transparent/dp/B077SZ5L4P/ref=sr_1_121?qid=1679212744&s=kitchen&sr=1-121;4.4;5366.0;388.0;510.0;Treo
Milton Prudent 500 Thermosteel 24 Hours Hot and Cold Water Bottle, 500 ml, Blue;home & kitchen;Kitchen Storage & Containers;https://m.media-amazon.com/images/I/61eftTUlpwL._AC_UL320_.jpg;https://www.amazon.in/Milton-Prudent-Thermosteel-Cold-Bottle/dp/B07TVD6545/ref=sr_1_122?qid=1679212744&s=kitchen&sr=1-122;4.4;5866.0;714.0;940.0;Milton
Cello Puro Plastic Sports 900 Water Bottle, Set of 2 (Assorted);home & kitchen;Kitchen Storage & Containers;https://m.media-amazon.com/images/I/61ZVAOOaGmL._AC_UL320_.jpg;https://www.amazon.in/Cello-Sports-Plastic-Bottle-Assorted/dp/B07CM5DDTH/ref=sr_1_123?qid=1679212744&s=kitchen&sr=1-123;4.0;4684.0;245.0;399.0;Cello
ZOSOE Sprout Maker | Sprout Maker Box | Hygienic Sprout Maker with 4 Container | Organic Home Making Fresh Sprouts Beans f...;home & kitchen;Kitchen Storage & Containers;https://m.media-amazon.com/images/I/51agdN7vi-L._AC_UL320_.jpg;https://www.amazon.in/ZOSOE-Plastic-Hygienic-Container-Organic/dp/B08543TV1J/ref=sr_1_124?qid=1679212744&s=kitchen&sr=1-124;4.0;7297.0;299.0;599.0;ZOSOE
SHAYONAM Fridge Storage Boxes, Fridge Organizer Case With Removable Drain Plate Stackable Fridge Storage Containers Keep F...;home & kitchen;Kitchen Storage & Containers;https://m.media-amazon.com/images/I/61du-gFZwnL._AC_UL320_.jpg;https://www.amazon.in/SHAYONAM-Organizer-Containers-Vegetables-Pack/dp/B0BHZR65WC/ref=sr_1_125?qid=1679212744&s=kitchen&sr=1-125;4.3;320.0;599.0;669.0;SHAYONAM
Cello Swift Vacuum Insulated Flask | Hot and Cold Water Bottle | Double Walled Stainless Steel Bottle for Travel, Home, Of...;home & kitchen;Kitchen Storage & Containers;https://m.media-amazon.com/images/I/61L3YjA-X8L._AC_UL320_.jpg;https://www.amazon.in/Cello-Swift-Steel-Flask-Silver/dp/B00N3L3XB6/ref=sr_1_126?qid=1679212744&s=kitchen&sr=1-126;4.3;14401.0;949.0;1449.0;Cello
12FOR COLLECTION 2pcs Stainless Steel Kitchen Dish Rack Expandable Storage Shelves for Kitchen Cabinets Multipurpose Organ...;home & kitchen;Kitchen Storage & Containers;https://m.media-amazon.com/images/I/71zcsvFZaHL._AC_UL320_.jpg;https://www.amazon.in/12FOR-COLLECTION-Stainless-Expandable-Multipurpose/dp/B09XDQZHW2/ref=sr_1_127?qid=1679212744&s=kitchen&sr=1-127;3.9;798.0;333.0;599.0;12FOR
Grade Stainless Steel Sports Water Bottle with LED Temperature Display,Double Wall Vacuum Insulated Water Bottle, Stay Hot...;home & kitchen;Kitchen Storage & Containers;https://m.media-amazon.com/images/I/61VO5sUvEoL._AC_UL320_.jpg;https://www.amazon.in/Stainless-Sports-Temperature-Display-Insulated/dp/B07ZVL147P/ref=sr_1_128?qid=1679212744&s=kitchen&sr=1-128;4.4;5251.0;349.0;799.0;Grade
VROKLA 6pcs Fridge Storage Boxes Fridge Organizer with Removable Drain Plate and Lid Stackable Fridge Storage Containers P...;home & kitchen;Kitchen Storage & Containers;https://m.media-amazon.com/images/I/61HBVRQl7KS._AC_UL320_.jpg;https://www.amazon.in/VROKLA-Organizer-Removable-Containers-Vegetables/dp/B09MTQ1PN3/ref=sr_1_129?qid=1679212744&s=kitchen&sr=1-129;4.1;1601.0;649.0;1499.0;VROKLA
Signoraware 4.5 Litres Modular Multi-Purpose Plastic Containers with Lid for Kitchen Storage | Food Grade BPA Free Leak Pr...;home & kitchen;Kitchen Storage & Containers;https://m.media-amazon.com/images/I/71yDJ-UNHYL._AC_UL320_.jpg;https://www.amazon.in/Signoraware-Modular-Purpose-Plastic-Container/dp/B00JJHD3IG/ref=sr_1_130?qid=1679212744&s=kitchen&sr=1-130;4.4;2281.0;319.0;425.0;Signoraware
Amazon Brand - Solimo Plastic Storage Containers With Metal Finish Lids- 15 pieces, Silver;home & kitchen;Kitchen Storage & Containers;https://m.media-amazon.com/images/I/91Hffht29zL._AC_UL320_.jpg;https://www.amazon.in/Solimo-Plastic-Container-15-Pieces-Silver/dp/B07HCLTFRN/ref=sr_1_131?qid=1679212744&s=kitchen&sr=1-131;4.1;15228.0;829.0;1700.0;Amazon
Cutting EDGE Neo Durable Kitchen Sink, Dish Rack Drainer, Drying Rack Design 4 Washing Basket with Tray for Kitchen (Polyp...;home & kitchen;Kitchen Storage & Containers;https://m.media-amazon.com/images/I/71tRzR72QCS._AC_UL320_.jpg;https://www.amazon.in/Cutting-EDGE-Durable-Organizers-Utensils/dp/B097HN633M/ref=sr_1_132?qid=1679212744&s=kitchen&sr=1-132;4.0;315.0;;399.0;Cutting
12FOR COLLECTION Stainless Steel 3-Tier Storage Rack for Corners, Multipurpose Stainless Steel Kitchen Plate Dish Corner S...;home & kitchen;Kitchen Storage & Containers;https://m.media-amazon.com/images/I/61eX3uIvTwL._AC_UL320_.jpg;https://www.amazon.in/12FOR-COLLECTION-Stainless-Storage-Multipurpose/dp/B09MYH9QC1/ref=sr_1_133?qid=1679212744&s=kitchen&sr=1-133;3.8;2018.0;356.0;699.0;12FOR
Amazon Brand - Solimo Borosilicate Glass Water Bottle, (Transparent, 1000 ml, 1 Piece;home & kitchen;Kitchen Storage & Containers;https://m.media-amazon.com/images/I/61+vVuWFZgL._AC_UL320_.jpg;https://www.amazon.in/Amazon-Brand-Solimo-Borosilicate-Bottle/dp/B087RZBP2R/ref=sr_1_134?qid=1679212744&s=kitchen&sr=1-134;4.2;1242.0;349.0;850.0;Amazon
Treo By Milton All Fresh Premier Tiffin Set of 8 (3 - Containers, 400 ml Each, 1 - Steel Bottle, 750 ml, 2 - Pickle/Chutne...;home & kitchen;Kitchen Storage & Containers;https://m.media-amazon.com/images/I/81ZEMVyXf0L._AC_UL320_.jpg;https://www.amazon.in/Treo-Milton-Fresh-Premier-Tiffin/dp/B0BJLBYDFR/ref=sr_1_135?qid=1679212744&s=kitchen&sr=1-135;4.3;57.0;1049.0;2499.0;Treo
Treo By Milton Cube Storage Glass Jar, 1 Piece, 1000 ml, Transparent | BPA Free | Storage Jar | Kitchen Organizer Modular...;home & kitchen;Kitchen Storage & Containers;https://m.media-amazon.com/images/I/71QU-EN9LxL._AC_UL320_.jpg;https://www.amazon.in/Treo-Glass-Jar-Litre-Nocolortrans/dp/B01H5BT480/ref=sr_1_136?qid=1679212744&s=kitchen&sr=1-136;4.4;17373.0;189.0;250.0;Treo
Amazon Brand - Solimo Revolving Plastic Spice Rack set (16 pieces);home & kitchen;Kitchen Storage & Containers;https://m.media-amazon.com/images/I/81u0Uo4nQdL._AC_UL320_.jpg;https://www.amazon.in/Amazon-Brand-Solimo-Revolving-pieces/dp/B07PBBRWFG/ref=sr_1_137?qid=1679212744&s=kitchen&sr=1-137;3.9;21701.0;469.0;1100.0;Amazon
Signoraware 6.5 Litres Modular Multi-Purpose Plastic Containers with Lid for Kitchen Storage | Food Grade BPA Free Leak Pr...;home & kitchen;Kitchen Storage & Containers;https://m.media-amazon.com/images/I/31U5cX89OpL._AC_UL320_.jpg;https://www.amazon.in/Signoraware-Modular-Square-Plastic-Container/dp/B00JJHEWJ0/ref=sr_1_138?qid=1679212744&s=kitchen&sr=1-138;4.4;5254.0;410.0;530.0;Signoraware
Cello Crystal PET Bottle Set, 1 Litre, Set of 6, Black;home & kitchen;Kitchen Storage & Containers;https://m.media-amazon.com/images/I/71+I6P2z5-L._AC_UL320_.jpg;https://www.amazon.in/Cello-Crystal-Bottle-Litre-Black/dp/B01BYBTU1S/ref=sr_1_139?qid=1679212744&s=kitchen&sr=1-139;3.9;5738.0;;275.0;Cello
FineDine Sprout Maker Box Sprout Maker| Hygienic Sprout Maker with 4 Container | Organic Home Making Fresh Sprouts Beans f...;home & kitchen;Kitchen Storage & Containers;https://m.media-amazon.com/images/I/51UsKzyPk5L._AC_UL320_.jpg;https://www.amazon.in/FineDine-Hygienic-Container-Organic-Sprouts/dp/B0BRJHXTLS/ref=sr_1_140?qid=1679212744&s=kitchen&sr=1-140;4.7;4540.0;299.0;699.0;FineDine
Sumeet Stainless Steel Belly Shape Masala (Spice) Box/Dabba/Organiser with See Through Lid with 7 Containers and Small Spo...;home & kitchen;Kitchen Storage & Containers;https://m.media-amazon.com/images/I/41v8CtpEDML._AC_UL320_.jpg;https://www.amazon.in/Sumeet-Stainless-Through-Containers-Capacity/dp/B07C5PHJQ5/ref=sr_1_141?qid=1679212744&s=kitchen&sr=1-141;4.2;5638.0;490.0;1000.0;Sumeet
wolpin Lunch Bags for Office Women, Men, Kids Insulated Travel Box / Tiffin / Storage Bag, College & School (Blue, Polyester);home & kitchen;Kitchen Storage & Containers;https://m.media-amazon.com/images/I/71I6zTKyt9L._AC_UL320_.jpg;https://www.amazon.in/Wolpin-Polyester-Insulated-Storage-College/dp/B0B6D6PFDN/ref=sr_1_142?qid=1679212744&s=kitchen&sr=1-142;3.8;287.0;229.0;799.0;wolpin
U & U UNIQUE UTILITIES Microfiber Dish Drying Mat for Kitchen (Grey, 50 x 38 cm, Pack of 2);home & kitchen;Kitchen Storage & Containers;https://m.media-amazon.com/images/I/81HS5xyfaUL._AC_UL320_.jpg;https://www.amazon.in/UNIQUE-UTILITIES-Microfiber-Kitchen-Grey/dp/B08WLVB68Z/ref=sr_1_143?qid=1679212744&s=kitchen&sr=1-143;4.3;907.0;499.0;998.0;U
SPRUHA HOMES Fridge Storage Boxes. Set of 4 Fridge storage containers. 1.5L stackable, food grade, transparent plastic box...;home & kitchen;Kitchen Storage & Containers;https://m.media-amazon.com/images/I/71PFK7GqfLL._AC_UL320_.jpg;https://www.amazon.in/SPRUHA-HOMES-containers-transparent-Refrigerator/dp/B0BKZNPD5H/ref=sr_1_144?qid=1679212744&s=kitchen&sr=1-144;4.2;30.0;284.0;999.0;SPRUHA
HAPPI Multipurpose Unbreakable Plastic Transparent Storage Containers For Kitchen Airtight Masala Box Dabba Spice, Cereal,...;home & kitchen;Kitchen Storage & Containers;https://m.media-amazon.com/images/I/71PHXcMfkkL._AC_UL320_.jpg;https://www.amazon.in/HAPPI-Multipurpose-Unbreakable-Transparent-Containers/dp/B0BFN1694H/ref=sr_1_169?qid=1679212745&s=kitchen&sr=1-169;4.2;188.0;298.0;490.0;HAPPI
GOLWYN Air Tight Containers For Kitchen Storage Set, Bpa Container For Kitchen Storage Set, Kitchen Organizer And Kitchen ...;home & kitchen;Kitchen Storage & Containers;https://m.media-amazon.com/images/I/71auAIxh1PL._AC_UL320_.jpg;https://www.amazon.in/GOLWYN-Containers-Container-Organizer-1100/dp/B0B2SBK18B/ref=sr_1_170?qid=1679212745&s=kitchen&sr=1-170;4.2;218.0;825.0;2499.0;GOLWYN
1500ml Fridge Storage Boxes Pack of 4 Fridge Organizer with Removable Drain Plate and Fridge Storage Containers Plastic Fr...;home & kitchen;Kitchen Storage & Containers;https://m.media-amazon.com/images/I/71vtGnGOCPL._AC_UL320_.jpg;https://www.amazon.in/Panchhi-Store-Containers-Container-Transparent/dp/B09BFMY3R4/ref=sr_1_171?qid=1679212745&s=kitchen&sr=1-171;4.3;77.0;399.0;799.0;1500ml
AB99 COLLECTION Stainless Steel 3-Tier Storage kitchen Corner Rack | Plate Dish Corner Shelf Rack Stand Holder | Bartan St...;home & kitchen;Kitchen Storage & Containers;https://m.media-amazon.com/images/I/71kkAzD2fUL._AC_UL320_.jpg;https://www.amazon.in/AB99-COLLECTION-Stainless-Storage-Organizer/dp/B09X5S112M/ref=sr_1_172?qid=1679212745&s=kitchen&sr=1-172;4.0;186.0;345.0;999.0;AB99
Gadget Deals Masala Box - Dabba for Keeping Spices | Spice Box for Kitchen | masala box for kitchen | Masala Container|spi...;home & kitchen;Kitchen Storage & Containers;https://m.media-amazon.com/images/I/41u6aoNlIIL._AC_UL320_.jpg;https://www.amazon.in/Gadget-Deals-Masala-Box-Container/dp/B0B2WZ7GJK/ref=sr_1_173?qid=1679212745&s=kitchen&sr=1-173;4.0;86.0;149.0;299.0;Gadget
Milton Eiffel 1000 Plastic Insulated Flask, 910 ml, Black | BPA Free | Easy To Carry | Food Grade;home & kitchen;Kitchen Storage & Containers;https://m.media-amazon.com/images/I/61PH-PkUtVS._AC_UL320_.jpg;https://www.amazon.in/Milton-Eiffel-1000-Black-EC-THF-FTV-0018_BLACK/dp/B01AHQ7LWG/ref=sr_1_174?qid=1679212745&s=kitchen&sr=1-174;3.8;3441.0;330.0;435.0;Milton
Zepdos® Stainless Steel 2-Tier Kitchen Rack and Organizer Spice Rack and Container Organizer, Utensils Dishes Spices Jar h...;home & kitchen;Kitchen Storage & Containers;https://m.media-amazon.com/images/I/71-Fb1WV0bL._AC_UL320_.jpg;https://www.amazon.in/Zepdos%C2%AE-Stainless-Organizer-Container-Utensils/dp/B0BGJ3C1JL/ref=sr_1_175?qid=1679212745&s=kitchen&sr=1-175;3.7;45.0;385.0;999.0;Zepdos®
Milton Glassy 1000 Thermosteel 24 Hours Hot and Cold Water Bottle with Drinking Cup Lid, 1 Litre, Grey | Leak Proof | Offi...;home & kitchen;Kitchen Storage & Containers;https://m.media-amazon.com/images/I/71d2YCzgXPL._AC_UL320_.jpg;https://www.amazon.in/Milton-Glassy-1000ml-Vaccum-Flasks/dp/B01IQYNO8G/ref=sr_1_176?qid=1679212745&s=kitchen&sr=1-176;4.4;6605.0;1000.0;1260.0;Milton
limbani brothers™ Kitchen 8 Pcs Sets Airtight Rasoi Box Spice Storage Jar Masala Box Spice Container Idle For, Easy Flow S...;home & kitchen;Kitchen Storage & Containers;https://m.media-amazon.com/images/I/6140K6f3z-L._AC_UL320_.jpg;https://www.amazon.in/LIMBANI-BROTHERSTM-Kitchen-Airtight-Container/dp/B0B7XWJKQH/ref=sr_1_177?qid=1679212745&s=kitchen&sr=1-177;4.3;133.0;389.0;899.0;limbani
Plantex Gold Stainless Steel Folding Towel Rack for Bathroom/Towel Stand(24 Inch-Chrome Finish);home & kitchen;Kitchen Storage & Containers;https://m.media-amazon.com/images/I/61x3HLSDFNL._AC_UL320_.jpg;https://www.amazon.in/Plantex-Pitru-Stainless-Folding-Silver/dp/B07GXG777H/ref=sr_1_178?qid=1679212745&s=kitchen&sr=1-178;4.3;9720.0;1299.0;3249.0;Plantex
Amazon Brand - Solimo Plastic Storage container Set with sliding mouth (Set of 3, 1100 ml);home & kitchen;Kitchen Storage & Containers;https://m.media-amazon.com/images/I/7100qx1DgKL._AC_UL320_.jpg;https://www.amazon.in/Amazon-Brand-Plastic-Storage-container/dp/B07P96K1KR/ref=sr_1_179?qid=1679212745&s=kitchen&sr=1-179;3.6;4506.0;279.0;425.0;Amazon
MILTON Aqua 500 Stainless Steel Water Bottle, 500 ml, Silver | Leak Proof | Office Bottle | Gym Bottle | Home | Kitchen | ...;home & kitchen;Kitchen Storage & Containers;https://m.media-amazon.com/images/I/61d2S24-TFL._AC_UL320_.jpg;https://www.amazon.in/Milton-Stainless-Steel-Bottle-Silver/dp/B0829D4KYR/ref=sr_1_180?qid=1679212745&s=kitchen&sr=1-180;3.9;638.0;266.0;355.0;MILTON
Milton Atlantis 900 Thermosteel Water Bottle, 750 ml, Orange;home & kitchen;Kitchen Storage & Containers;https://m.media-amazon.com/images/I/41OMZbNAEwL._AC_UL320_.jpg;https://www.amazon.in/Milton-Atlantis-900-Thermosteel-Water-Bottle/dp/B07DCWMRX8/ref=sr_1_181?qid=1679212745&s=kitchen&sr=1-181;4.3;2369.0;810.0;980.0;Milton
FLIPZON 4 Layer Multipurpose Plastic Storage Organizer Slim Rack Shelf with Wheels | Slim Slide Out Kitchen Trolley Rack H...;home & kitchen;Kitchen Storage & Containers;https://m.media-amazon.com/images/I/61hHYuhCOEL._AC_UL320_.jpg;https://www.amazon.in/Flipzon-Tier-Slim-Multipurpose-Storage/dp/B07JNMCGT3/ref=sr_1_182?qid=1679212745&s=kitchen&sr=1-182;4.0;2369.0;699.0;2999.0;FLIPZON
Milton Atlantis 900 Thermosteel Hot and Cold Water Bottle, 750 ml Pink;home & kitchen;Kitchen Storage & Containers;https://m.media-amazon.com/images/I/71WOVmDakSL._AC_UL320_.jpg;https://www.amazon.in/Milton-Atlantis-Thermosteel-Water-Bottle/dp/B07Q2YSCYN/ref=sr_1_183?qid=1679212745&s=kitchen&sr=1-183;4.1;797.0;810.0;1080.0;Milton
Cello Infuse Plastic Water Bottle, 800 ml, Black,Set of 1;home & kitchen;Kitchen Storage & Containers;https://m.media-amazon.com/images/I/618CYX7Wk4L._AC_UL320_.jpg;https://www.amazon.in/Cello-Infuse-Plastic-Water-Bottle/dp/B08216FKZM/ref=sr_1_184?qid=1679212745&s=kitchen&sr=1-184;4.2;2028.0;149.0;249.0;Cello
Thermos Double Stainless Steel Wall Smart Flask Vacuum Insulated Water Bottle with LED Temperature Display | Perfect for H...;home & kitchen;Kitchen Storage & Containers;https://m.media-amazon.com/images/I/31mvHYqWy1L._AC_UL320_.jpg;https://www.amazon.in/Thermos-Insulated-Temperature-Campaign-Travelling/dp/B08QRPLQ77/ref=sr_1_185_mod_primary_new?qid=1679212745&s=kitchen&sbo=RZvfv%2F%2FHxDF%2BO5021pAnSA%3D%3D&sr=1-185;3.0;1044.0;235.0;999.0;Thermos
TONY STARK Kitchen Shelf ADVANCED NON RUST STAINLESS STEEL ALLOY Wall Mount Knife Holder ,Towel Hanger , Spatula Ladle Han...;home & kitchen;Kitchen Storage & Containers;https://m.media-amazon.com/images/I/61WFfPj21ZL._AC_UL320_.jpg;https://www.amazon.in/TONY-STARK-ADVANCED-STAINLESS-Multi-Purpose/dp/B0B6P6D85R/ref=sr_1_186?qid=1679212745&s=kitchen&sr=1-186;3.9;336.0;489.0;1099.0;TONY
Cello H2O Plastic Unbreakable Bottle, 1 L, Set of 6, Colour may vary;home & kitchen;Kitchen Storage & Containers;https://m.media-amazon.com/images/I/61ga-4SvpuL._AC_UL320_.jpg;https://www.amazon.in/Cello-H2O-Unbreakable-Bottle-Litre/dp/B01AEMWVYQ/ref=sr_1_187?qid=1679212745&s=kitchen&sr=1-187;4.4;9449.0;849.0;995.0;Cello
SOPL-OLIVEWARE Infinite Lunch Box | 3 Stainless Steel Containers | Microwave Safe | Insulated Fabric Bag | Leak Proof | Fu...;home & kitchen;Kitchen Storage & Containers;https://m.media-amazon.com/images/I/81eKpzR6ZWL._AC_UL320_.jpg;https://www.amazon.in/SOPL-OLIVEWARE-Infinite-Stainless-Microwave-Insulated/dp/B09PR5TVTW/ref=sr_1_188?qid=1679212745&s=kitchen&sr=1-188;4.2;2726.0;637.0;1130.0;SOPL-OLIVEWARE
Jaypee Plus Plastic with Inner Stainless Steel Lunch Box Missteel Hello Kitty Pink 650 ml;home & kitchen;Kitchen Storage & Containers;https://m.media-amazon.com/images/I/61LvX04vF+L._AC_UL320_.jpg;https://www.amazon.in/Jaypee-Plus-Missteel-Hello-Kitty/dp/B07DNT7H73/ref=sr_1_189?qid=1679212745&s=kitchen&sr=1-189;4.2;3224.0;630.0;864.0;Jaypee
Cello H2O Plastic Water Bottle Premium Edition, 1 Litre, Clear;home & kitchen;Kitchen Storage & Containers;https://m.media-amazon.com/images/I/51j1l5sQ-mL._AC_UL320_.jpg;https://www.amazon.in/Cello-Plastic-Water-Bottle-Premium/dp/B082TBL7S7/ref=sr_1_190?qid=1679212745&s=kitchen&sr=1-190;4.3;4624.0;;178.0;Cello
