name;main_category;sub_category;image;link;ratings;no_of_ratings;discount_price;actual_price;brand
Borosil Stainless Steel Hydra Sprint - Vacuum Insulated Flask Water Bottle, 400ML;home & kitchen;Kitchen Storage & Containers;https://m.media-amazon.com/images/W/IMAGERENDERING_521856-T2/images/I/51DbgBvYifL._AC_UL320_.jpg;https://www.amazon.in/Borosil-Stainless-Steel-Sprint-Bottle/dp/B07DFHNW7K/ref=sr_1_1642?qid=1679212772&s=kitchen&sr=1-1642;3.9;386.0;640.28;835.0;Borosil
Yellow Weaves Insulated Travel Fabric & Metal Lunch/Tiffin/Storage Bag, Regular Size (Grey);home & kitchen;Kitchen Storage & Containers;https://m.media-amazon.com/images/W/IMAGERENDERING_521856-T2/images/I/81MvvHoiD3L._AC_UL320_.jpg;https://www.amazon.in/Yellow-WeavesTM-Insulated-Storage-College/dp/B07RWCNRVF/ref=sr_1_1643?qid=1679212772&s=kitchen&sr=1-1643;4.2;3423.0;259.0;448.0;Yellow
Tupperware Plastic Spill proof Tropical Bowls (Multicolour, 210ml, 4 Pieces);home & kitchen;Kitchen Storage & Containers;https://m.media-amazon.com/images/W/IMAGERENDERING_521856-T2/images/I/51D0Yy5G0IL._AC_UL320_.jpg;https://www.amazon.in/Tupperware-Spillproof-Tropical-Bowls-210ml/dp/B08QVY26JQ/ref=sr_1_1644?qid=1679212772&s=kitchen&sr=1-1644;4.1;61.0;699.0;800.0;Tupperware
etwor Kitchen Organiser Rack Plastic Kitchen Rack (Black) Utensil Kitchen Rack (Plastic, Black) (Black);home & kitchen;Kitchen Storage & Containers;https://m.media-amazon.com/images/W/IMAGERENDERING_521856-T2/images/I/61QeBqrCIcL._AC_UL320_.jpg;https://www.amazon.in/etwor-Kitchen-Organiser-Plastic-Utensil/dp/B0BQF4Z5YB/ref=sr_1_1645?qid=1679212772&s=kitchen&sr=1-1645;4.0;22.0;599.0;4999.0;etwor
Zollyss Drawer Organizer Set Dresser Desk Drawer Dividers,Bathroom Vanity Cosmetic Makeup Trays, Multipurpose Plastic Stor...;home & kitchen;Kitchen Storage & Containers;https://m.media-amazon.com/images/W/IMAGERENDERING_521856-T2/images/I/71KEqN4Aw2L._AC_UL320_.jpg;https://www.amazon.in/Zollyss-Organizers-Bathroom-Dividers-Organizer/dp/B09QHQGLM2/ref=sr_1_1646?qid=1679212772&s=kitchen&sr=1-1646;4.5;324.0;799.0;3999.0;Zollyss
Tupperware Midi Magic Flow Container, 650ml (122),color may vary;home & kitchen;Kitchen Storage & Containers;https://m.media-amazon.com/images/W/IMAGERENDERING_521856-T2/images/I/610VPHTLXgL._AC_UL320_.jpg;https://www.amazon.in/Tupperware-Magic-Container-650ml-122/dp/B00G40E5YM/ref=sr_1_1647?qid=1679212772&s=kitchen&sr=1-1647;4.4;922.0;365.0;600.0;Tupperware
FunBlast Burger Shape Lunch Box for Kids - Combo Set - Tiffin Box, Lunch Box with 2 Pencil Sharpener, Burger & French Frie...;home & kitchen;Kitchen Storage & Containers;https://m.media-amazon.com/images/W/IMAGERENDERING_521856-T2/images/I/61cpQ4G3xjL._AC_UL320_.jpg;https://www.amazon.in/FunBlast-Burger-Shape-Lunch-Kids/dp/B09VP4B2YG/ref=sr_1_1648?qid=1679212772&s=kitchen&sr=1-1648;3.8;76.0;379.0;499.0;FunBlast
Signoraware Oval Modular Multi-Purpose Plastic Containers Set of 8 with Lid for Kitchen | Food Grade BPA Free Leak Proof (...;home & kitchen;Kitchen Storage & Containers;https://m.media-amazon.com/images/W/IMAGERENDERING_521856-T2/images/I/41WPqe9wiPL._AC_UL320_.jpg;https://www.amazon.in/Signoraware-Organise-Your-Kitchen-8-Pieces/dp/B00O7NQOAG/ref=sr_1_1649_mod_primary_new?qid=1679212772&s=kitchen&sbo=RZvfv%2F%2FHxDF%2BO5021pAnSA%3D%3D&sr=1-1649;4.6;1603.0;1499.0;1790.0;Signoraware
Auxiq Food Storage Boxes set of 3 Pasta & Snacks Fridge Storage Boxes, Kitchen Storage Containers, Plastic Bowl for Food, ...;home & kitchen;Kitchen Storage & Containers;https://m.media-amazon.com/images/W/IMAGERENDERING_521856-T2/images/I/419o04aJnFL._AC_UL320_.jpg;https://www.amazon.in/Auxiq-Plastic-Storage-Containers-Kitchen/dp/B09Q1ZWGNY/ref=sr_1_1650?qid=1679212772&s=kitchen&sr=1-1650;4.2;211.0;299.0;599.0;Auxiq
Furious 360° Spice Rack Set of 18 Piece 3 Layer Spice Set -Plastic (White and Blue-18);home & kitchen;Kitchen Storage & Containers;https://m.media-amazon.com/images/W/IMAGERENDERING_521856-T2/images/I/41ZfTFvYh2L._AC_UL320_.jpg;https://www.amazon.in/Furious-Spice-Piece-Plastic-Blue-18/dp/B08GYGDK8D/ref=sr_1_1651?qid=1679212772&s=kitchen&sr=1-1651;4.2;1314.0;849.0;1599.0;Furious
Pure Source India Metal Lug Cap Lid for Glass jar, 12 Pieces, 42 mm, Black;home & kitchen;Kitchen Storage & Containers;https://m.media-amazon.com/images/W/IMAGERENDERING_521856-T2/images/I/71wkjOfZ0gS._AC_UL320_.jpg;https://www.amazon.in/Pure-Source-India-Metal-Pieces/dp/B095H1FWNQ/ref=sr_1_1652?qid=1679212772&s=kitchen&sr=1-1652;4.0;30.0;225.0;399.0;Pure
Dev Enterprise Rack Premium Plastic 3 Steps Kitchen Stand Rack Basket for Office Use, Fruits Onion, Potato, Vegetables and...;home & kitchen;Kitchen Storage & Containers;https://m.media-amazon.com/images/W/IMAGERENDERING_521856-T2/images/I/714r7lgIgmL._AC_UL320_.jpg;https://www.amazon.in/Enterprise-Premium-Plastic-Vegetables-Vegetable/dp/B09B68LJ53/ref=sr_1_1653?qid=1679212772&s=kitchen&sr=1-1653;3.9;49.0;480.0;899.0;Dev
Salt and Pepper Grinder Set of 2 Stainless Steel Manual Spice Salt & Pepper Grinder Set with Adjustable 5 Grade Coarseness...;home & kitchen;Kitchen Storage & Containers;https://m.media-amazon.com/images/W/IMAGERENDERING_521856-T2/images/I/61R7WBg0JBL._AC_UL320_.jpg;https://www.amazon.in/Stainless-Adjustable-Coarseness-Grinders-Silicone/dp/B07QGS17W4/ref=sr_1_1654?qid=1679212772&s=kitchen&sr=1-1654;3.6;1341.0;389.0;999.0;Salt
Jumix® Half Gallon Large 2.2L Water Bottle with Premium Leak Proof Lid, BPA Free Material with Markings to Track Water Int...;home & kitchen;Kitchen Storage & Containers;https://m.media-amazon.com/images/W/IMAGERENDERING_521856-T2/images/I/61VS7dYE84L._AC_UL320_.jpg;https://www.amazon.in/Jumix%C2%AE-Gallon-Large-Water-Bottle/dp/B0B7FDSN34/ref=sr_1_1655?qid=1679212772&s=kitchen&sr=1-1655;3.3;48.0;589.0;1999.0;Jumix®
Lock & Lock Easy Lock BPA Free Plastic Food Storage Container With Ivory Lid for Fridge, Set of 4 (890 ml x 2 + 1320 ml x ...;home & kitchen;Kitchen Storage & Containers;https://m.media-amazon.com/images/W/IMAGERENDERING_521856-T2/images/I/71-KXqbon-S._AC_UL320_.jpg;https://www.amazon.in/Lock-Container-Transparent-P00010IV-P00011IV/dp/B091LXBWWL/ref=sr_1_1656?qid=1679212772&s=kitchen&sr=1-1656;4.4;39.0;738.0;820.0;Lock
VAYA TYFFYN Jumbo Black Polished Stainless Steel Lunch Box Without Bagmat, 1300 ml, 4 Containers, Black;home & kitchen;Kitchen Storage & Containers;https://m.media-amazon.com/images/I/6183scXYpzL._AC_UL320_.jpg;https://www.amazon.in/Tyffyn-Polished-Stainless-Without-Containers/dp/B0868RW15R/ref=sr_1_2977?qid=1679212788&s=kitchen&sr=1-2977;4.0;1165.0;3190.0;3890.0;VAYA
ABOUT SPACE Lunch Box for Office Men - Wheat Straw Lunch Box with 3 Compartments with Spoon, Airtight & Leakproof Food Gra...;home & kitchen;Kitchen Storage & Containers;https://m.media-amazon.com/images/I/81X2aUG6SyL._AC_UL320_.jpg;https://www.amazon.in/ABOUT-SPACE-Lunch-Box-Office/dp/B0BHW4YVXM/ref=sr_1_2978?qid=1679212788&s=kitchen&sr=1-2978;4.7;4.0;399.0;899.0;ABOUT
Ikea BEHOVD Polypropylene Plastic Vacuum Flask (1 L, Light Green and Beige);home & kitchen;Kitchen Storage & Containers;https://m.media-amazon.com/images/I/41JYlGK8VQL._AC_UL320_.jpg;https://www.amazon.in/Ikea-BEHOVD-Vacuum-Flask-Light/dp/B07PDMRS2M/ref=sr_1_2979?qid=1679212788&s=kitchen&sr=1-2979;4.1;359.0;588.0;999.0;Ikea
PENTOLE™ Sprout Maker | Sprout Maker Box | Hygienic Sprout Maker with 4 Container | Organic Home Making Fresh Sprouts Bean...;home & kitchen;Kitchen Storage & Containers;https://m.media-amazon.com/images/I/51S4eJ8kOeL._AC_UL320_.jpg;https://www.amazon.in/PENTOLETM-Hygienic-Container-Organic-Sprouts/dp/B09KQLS7GQ/ref=sr_1_2980?qid=1679212788&s=kitchen&sr=1-2980;3.7;79.0;231.0;449.0;PENTOLE™
Amazon Brand - Solimo Stainless Steel Puri Dabba- 1 piece,Silver;home & kitchen;Kitchen Storage & Containers;https://m.media-amazon.com/images/I/71e5G4OZt0L._AC_UL320_.jpg;https://www.amazon.in/Amazon-Brand-Solimo-Stainless-18-5cm/dp/B07P6S73KY/ref=sr_1_2981?qid=1679212788&s=kitchen&sr=1-2981;4.1;267.0;299.0;399.0;Amazon
Steellock Stainless Steel Airtight Flat Storage Container 1 Pc Set, 1000 ml Each;home & kitchen;Kitchen Storage & Containers;https://m.media-amazon.com/images/I/71IE5S-MD2L._AC_UL320_.jpg;https://www.amazon.in/Steel-Lock-Stainless-Airtight-Container/dp/B07T2S2JPG/ref=sr_1_2982?qid=1679212788&s=kitchen&sr=1-2982;4.4;89.0;425.0;465.0;Steellock
PALOMINO 5 Layer Shelf Wall Mount Kitchen Utensils Dish Rack | Stainless Steel Utensil Rack/Stand | Dish Stand/Holder | Ki...;home & kitchen;Kitchen Storage & Containers;https://m.media-amazon.com/images/I/51ZuZCICneL._AC_UL320_.jpg;https://www.amazon.in/PALOMINO-Kitchen-Utensils-Stainless-Organizer/dp/B09J2V22BS/ref=sr_1_2983?qid=1679212788&s=kitchen&sr=1-2983;4.2;68.0;2835.0;5999.0;PALOMINO
Smily Kiddos | Dual Slot Lunch Bag Unicorn Theme – Purple | Kids & School Lunch Bag | Lunch Bag for Kids | Lunch Bag for S...;home & kitchen;Kitchen Storage & Containers;https://m.media-amazon.com/images/I/81MWglMP5ZL._AC_UL320_.jpg;https://www.amazon.in/Smily-Kiddos-Teenagers-Colourful-Printed/dp/B07DS939DX/ref=sr_1_2984?qid=1679212788&s=kitchen&sr=1-2984;4.4;174.0;945.0;1350.0;Smily
Home Centre BARBADOS-MILFORD-26 Plastic Canister - 350ml, 6 Pieces, Transparent;home & kitchen;Kitchen Storage & Containers;https://m.media-amazon.com/images/I/61rR+L+pqIL._AC_UL320_.jpg;https://www.amazon.in/Home-Centre-Barbados-Transparent-Canisters/dp/B07TFF2WHZ/ref=sr_1_2985?qid=1679212788&s=kitchen&sr=1-2985;4.4;223.0;;499.0;Home
ARECA Polyurethane Lunch Bag for Carry Lunch Boxes (3L, Black);home & kitchen;Kitchen Storage & Containers;https://m.media-amazon.com/images/I/71Kn-PASSeL._AC_UL320_.jpg;https://www.amazon.in/ARECA-Lunch-Office-Picnic-Tiffin/dp/B08PD1JH59/ref=sr_1_2986?qid=1679212788&s=kitchen&sr=1-2986;4.2;72.0;349.0;1299.0;ARECA
JUGTE Water Bottle for Kids Stainless Steel Bottle Double Walled Vacuum Insulated Baby Sipper Bottle Thermos Flask for Boy...;home & kitchen;Kitchen Storage & Containers;https://m.media-amazon.com/images/I/41y9xHCpOsL._AC_UL320_.jpg;https://www.amazon.in/JUGTE-Bottle-Stainless-Insulated-Thermos/dp/B0BW96XHG3/ref=sr_1_2987?qid=1679212788&s=kitchen&sr=1-2987;5.0;6.0;474.0;999.0;JUGTE
Bekner Premium Reusable Fridge Storage Bag for Vegetables and Fruits Mesh Net Fabric with Zip Lock Nylon Storage Pouch (Pa...;home & kitchen;Kitchen Storage & Containers;https://m.media-amazon.com/images/I/41SjjI2BiyL._AC_UL320_.jpg;https://www.amazon.in/Bekner-Premium-Reusable-Vegetables-multicolor/dp/B0B3T4RFWJ/ref=sr_1_2988?qid=1679212788&s=kitchen&sr=1-2988;4.0;32.0;210.0;499.0;Bekner
ASIAN Jute Wine Bottle Gift Bag/Bottle Carry Bag/Water Bottle Cover-Velcro Closure and Handle for Men & Women (Blue);home & kitchen;Kitchen Storage & Containers;https://m.media-amazon.com/images/I/516oLR2LT6L._AC_UL320_.jpg;https://www.amazon.in/ASIAN-Bottle-Cover-Velcro-Closure-Handle/dp/B09YLT39BW/ref=sr_1_2989?qid=1679212788&s=kitchen&sr=1-2989;3.9;54.0;179.0;998.0;ASIAN
H&B Jute Water Bottle Bag - This Jute Bottle Bag can be Given as a Gift Bag or can be Used as Wine Bottle Gift Bag/Bottle ...;home & kitchen;Kitchen Storage & Containers;https://m.media-amazon.com/images/I/71Wzl6qOOVL._AC_UL320_.jpg;https://www.amazon.in/Jute-Water-Bottle-Bag-Plastic/dp/B0854FXH3Y/ref=sr_1_2990?qid=1679212788&s=kitchen&sr=1-2990;4.4;729.0;224.0;299.0;H&B
Umadiya® Branded Big Size Lunch Box 1800 ML 4 Compartment Leak-Proof BPA Free Lunch Box with Spoon Tiffin Box for School L...;home & kitchen;Kitchen Storage & Containers;https://m.media-amazon.com/images/I/61HDXfpqwVL._AC_UL320_.jpg;https://www.amazon.in/Umadiya%C2%AE-Branded-Compartment-Leak-Proof-Tiffin/dp/B0BL3ZFRR2/ref=sr_1_2991?qid=1679212788&s=kitchen&sr=1-2991;4.5;3.0;399.0;1500.0;Umadiya®
K GOLDEN BRASS Handcrafted Brass Spice Box Set For Kitchen With Spoon (7 Containers, 40 ML) - Brass Masala Box For Kitchen...;home & kitchen;Kitchen Storage & Containers;https://m.media-amazon.com/images/I/81DZ2odnIXL._AC_UL320_.jpg;https://www.amazon.in/KGolden-Brass-Handcrafted-Kitchen-Containers/dp/B098QN63PH/ref=sr_1_2992?qid=1679212788&s=kitchen&sr=1-2992;4.1;87.0;1499.0;4950.0;K
Essential Product in The Form of Hand Towel Holder,Naplin Holder for Kitchen ,Dinning & Washing Sink;home & kitchen;Kitchen Storage & Containers;https://m.media-amazon.com/images/I/81qzO5ir6US._AC_UL320_.jpg;https://www.amazon.in/Essential-Product-Kitchen-Dinning-Washing/dp/B0936QDYS4/ref=sr_1_2993?qid=1679212788&s=kitchen&sr=1-2993;3.5;9.0;366.0;950.0;Essential
Plastic air Tight Container 25ml x100pcs Pack.Transparent Ideal for Chutney Sauce (Manoj nx Enterprises Genuine Seller);home & kitchen;Kitchen Storage & Containers;https://m.media-amazon.com/images/I/51T9+Fs+L8S._AC_UL320_.jpg;https://www.amazon.in/Plastic-Container-x100pcs-Pack-Transparent-Enterprises/dp/B095Y3TC34/ref=sr_1_2994?qid=1679212788&s=kitchen&sr=1-2994;3.8;24.0;244.0;1999.0;Plastic
PREDELLA Kitchen Racks/ 2 Step Racks/Shelves/Holder/Stand/Spice Rack/Kitchen Organizer Metal Bottle/Bartan Rack -Black;home & kitchen;Kitchen Storage & Containers;https://m.media-amazon.com/images/I/512yA9yXVxL._AC_UL320_.jpg;https://www.amazon.in/Predella-Cast-Iron-Bottle-Black/dp/B09RXTKKHM/ref=sr_1_2995?qid=1679212788&s=kitchen&sr=1-2995;4.5;6.0;579.0;1999.0;PREDELLA
ExclusiveLane 'Leaf' Hand-Painted Multi-Purpose Ceramic Pickle Jars for Dining Table with Lids & Holder Pickle Jars for St...;home & kitchen;Kitchen Storage & Containers;https://m.media-amazon.com/images/I/61LTF5XA8sS._AC_UL320_.jpg;https://www.amazon.in/ExclusiveLane-Hand-Painted-Multi-Purpose-Ceramic-Storage/dp/B097KD89S1/ref=sr_1_2996?qid=1679212788&s=kitchen&sr=1-2996;4.2;51.0;1775.0;2249.0;ExclusiveLane
Srxes 304 Stainless Steel Lunch Box, Lunch Box for School, Lunch Boxes, Lunch Box for Office, Tiffin Boxes, Ideal for 12+ ...;home & kitchen;Kitchen Storage & Containers;https://m.media-amazon.com/images/I/61U7aJiOeYL._AC_UL320_.jpg;https://www.amazon.in/Srxes-Stainless-Office-Teenagers-Compartment/dp/B09YV96N5D/ref=sr_1_2997?qid=1679212788&s=kitchen&sr=1-2997;3.9;342.0;854.0;1499.0;Srxes
PRAYUTA Stainless Steel Lunch Box 3 Container and 1 Casserole Set with Plastic Bottle 2 Spoon Tiffin Box with Bag for Offi...;home & kitchen;Kitchen Storage & Containers;https://m.media-amazon.com/images/I/51k6C7ZM9nL._AC_UL320_.jpg;https://www.amazon.in/Stainless-Lunch-Box-Container-Casserole/dp/B0BHD6CN22/ref=sr_1_2998?qid=1679212788&s=kitchen&sr=1-2998;;;475.0;1499.0;PRAYUTA
Privesh 1 Pc 3 Layer Kitchen Rotating Trolley Portable Storage Rack Square Design Fruits & Vegetable Onion Cutlery, Spice,...;home & kitchen;Kitchen Storage & Containers;https://m.media-amazon.com/images/I/41aKRxPEqeL._AC_UL320_.jpg;https://www.amazon.in/Privesh-Rack-Vegetable-Container-Kitchen-Black/dp/B09Y299P2H/ref=sr_1_2999?qid=1679212788&s=kitchen&sr=1-2999;4.0;61.0;2391.0;7999.0;Privesh
Delzon 1.5 Liter Water Bottle with Straw, Sports Drinks Bottle Flip & Clip Lockable Leak-Proof Dishwasher Safe Water Bottl...;home & kitchen;Kitchen Storage & Containers;https://m.media-amazon.com/images/I/518O9huChDL._AC_UL320_.jpg;https://www.amazon.in/Delzon-Bottle-Lockable-Leak-Proof-Dishwasher/dp/B09RHCCJZQ/ref=sr_1_3000?qid=1679212788&s=kitchen&sr=1-3000;4.0;16.0;475.0;799.0;Delzon
Tupperware Plastic Freezer Mates Gen II 1.1L 1pc (Pink, White);home & kitchen;Kitchen Storage & Containers;https://m.media-amazon.com/images/I/51jV7C2gKmL._AC_UL320_.jpg;https://www.amazon.in/Tupperware-Gen-Freezermate-1-1l-1pc/dp/B0846M98TJ/ref=sr_1_3073?qid=1679212790&s=kitchen&sr=1-3073;4.2;412.0;374.0;500.0;Tupperware
Pamirate Bread box Plastic jars & Container for kitchen Multi Storage container with Lid, Pack of 3 Set , Black Lid, 2000ml;home & kitchen;Kitchen Storage & Containers;https://m.media-amazon.com/images/I/41BeUnlVroS._AC_UL320_.jpg;https://www.amazon.in/Pamirate-Plastic-Container-kitchen-container/dp/B09961QJGF/ref=sr_1_3074?qid=1679212790&s=kitchen&sr=1-3074;4.0;657.0;548.0;999.0;Pamirate
MAXIMA Stainless Steel Tulip Canister With Lid | Multi Purposes Use for Storage Edibles | Kitchen Organiser | Jar Storage...;home & kitchen;Kitchen Storage & Containers;https://m.media-amazon.com/images/I/51TS2Ez7aZL._AC_UL320_.jpg;https://www.amazon.in/Maxima-Stainless-Kitchen-Storage-Canister/dp/B089FM34ZF/ref=sr_1_3075?qid=1679212790&s=kitchen&sr=1-3075;4.4;69.0;495.0;660.0;MAXIMA
PODDAR RETAIL™ 2 Litre Jumbo Size Plastic Transparent Water Bottle for Home,Gym,Office ,2000ml Each (set of 2),Multicolou...;home & kitchen;Kitchen Storage & Containers;https://m.media-amazon.com/images/I/61QqOO2Hq3L._AC_UL320_.jpg;https://www.amazon.in/litre-proof-plastic-drinking-Bottles/dp/B09BTSVC9B/ref=sr_1_3076?qid=1679212790&s=kitchen&sr=1-3076;3.8;93.0;337.0;399.0;PODDAR
Amazon Brand - Solimo Checkered Jar Set of 15 (Royal Blue);home & kitchen;Kitchen Storage & Containers;https://m.media-amazon.com/images/I/91Nh2MNVe+L._AC_UL320_.jpg;https://www.amazon.in/Solimo-Plastic-Container-White-SOPLA117/dp/B07P94W1B5/ref=sr_1_3077?qid=1679212790&s=kitchen&sr=1-3077;4.2;387.0;489.0;750.0;Amazon
Signoraware Executive Big Stainless Steel Container, 500 ml/20mm, Red;home & kitchen;Kitchen Storage & Containers;https://m.media-amazon.com/images/I/51t1nIqNkML._AC_UL320_.jpg;https://www.amazon.in/Signoraware-Executive-Stainless-Steel-Container/dp/B079VPVP3G/ref=sr_1_3078?qid=1679212790&s=kitchen&sr=1-3078;4.3;3918.0;;225.0;Signoraware
Incredible Hub Iron Bottle Rack | 2 Tier Kitchen Spice Rack| Modular Kitchen Storage Rack | Kitchen Organizer Multipurpose...;home & kitchen;Kitchen Storage & Containers;https://m.media-amazon.com/images/I/51+MbS11K+L._AC_UL320_.jpg;https://www.amazon.in/Incredible-Hub-Cast-Bottle-Black/dp/B091NDQRNP/ref=sr_1_3079?qid=1679212790&s=kitchen&sr=1-3079;3.9;213.0;699.0;1499.0;Incredible
Tupperware 2L water bottle, pink colour, 1piece;home & kitchen;Kitchen Storage & Containers;https://m.media-amazon.com/images/I/51qO+z1JUML._AC_UL320_.jpg;https://www.amazon.in/Tupperware-Fridge-Water-Bottle-Green/dp/B01JD5ZFS4/ref=sr_1_3080_mod_primary_new?qid=1679212790&s=kitchen&sbo=RZvfv%2F%2FHxDF%2BO5021pAnSA%3D%3D&sr=1-3080;4.4;426.0;;510.0;Tupperware
Benecio Magic Sticker Self-Adhesive Folding Plastic Towel Holder Ring Hanger for Bathroom/Towel Stand/Wash Basin/Napkin-To...;home & kitchen;Kitchen Storage & Containers;https://m.media-amazon.com/images/I/51T8n4htfGL._AC_UL320_.jpg;https://www.amazon.in/Benecio-Self-Adhesive-Towel-Holder-Bathroom/dp/B08Z3G9Q8Y/ref=sr_1_3081?qid=1679212790&s=kitchen&sr=1-3081;4.4;153.0;;399.0;Benecio
Cello Puro Junior Insulated Water Bottle for Kids, 600 ML, Red;home & kitchen;Kitchen Storage & Containers;https://m.media-amazon.com/images/I/71RVDGZC5YL._AC_UL320_.jpg;https://www.amazon.in/Cello-Junior-Insulated-Water-Bottle/dp/B07RQ9P188/ref=sr_1_3082?qid=1679212790&s=kitchen&sr=1-3082;4.0;51.0;260.0;299.0;Cello
"VINAYAKAMART Zip Lock Plastic Bags Self Sealing Storage Pouch 2"" X 3"" inch, 200 Pieces, Transparent";home & kitchen;Kitchen Storage & Containers;https://m.media-amazon.com/images/I/21Z0q9VJQ4L._AC_UL320_.jpg;https://www.amazon.in/vinakaya-mart-Plastic-Sealing-Storage/dp/B078NG5639/ref=sr_1_3083?qid=1679212790&s=kitchen&sr=1-3083;3.9;351.0;199.0;300.0;VINAYAKAMART
Polyset Click & Lock Large Storage Container(5Ltr, 9Ltr, 12Ltr), Air tight, Kitchen Organiser, BPA Free, Modular, Set of ...;home & kitchen;Kitchen Storage & Containers;https://m.media-amazon.com/images/I/71-vg9vAhlL._AC_UL320_.jpg;https://www.amazon.in/Polyset-Click-Lock-Container-Organiser/dp/B0B6WM4Z63/ref=sr_1_3084?qid=1679212790&s=kitchen&sr=1-3084;3.3;5.0;539.0;949.0;Polyset
Butterfly Multipurpose Jar MGA_ - 1L, Black;home & kitchen;Kitchen Storage & Containers;https://m.media-amazon.com/images/I/51xdX9RNAnL._AC_UL320_.jpg;https://www.amazon.in/Butterfly-MGA_-Litre-Multipurpose-Jar/dp/B08CSRP1G4/ref=sr_1_3085?qid=1679212790&s=kitchen&sr=1-3085;3.9;226.0;725.0;849.0;Butterfly
Home Centre OCEAN 6-Piece Pop Jar with Wooden Lid Set- 1000 ml;home & kitchen;Kitchen Storage & Containers;https://m.media-amazon.com/images/I/51Dj6jvWKZL._AC_UL320_.jpg;https://www.amazon.in/Ocean-Pop-Wooden-Set-1000/dp/B07TL2BZQ4/ref=sr_1_3086?qid=1679212790&s=kitchen&sr=1-3086;4.1;118.0;1764.0;2599.0;Home
MILTON Vitro Plastic Pet Storage Jar and Container, Set of 12 (4 pcs x 270 ml Each, 4 pcs x 665 ml Each, 4 pcs x 1.24 ltrs...;home & kitchen;Kitchen Storage & Containers;https://m.media-amazon.com/images/I/81kpzEOcXuS._AC_UL320_.jpg;https://www.amazon.in/Plastic-Storage-Container-Organiser-Stackable/dp/B098XY1FXP/ref=sr_1_3087?qid=1679212790&s=kitchen&sr=1-3087;4.3;76.0;399.0;899.0;MILTON
STAR WORK Set Of 3 Airtight Glass Canister Set [1500 ml,] Food Storage Jar Storage Container with Seal Clamp for Dry Food ...;home & kitchen;Kitchen Storage & Containers;https://m.media-amazon.com/images/I/81pqTtEDuHL._AC_UL320_.jpg;https://www.amazon.in/STAR-WORK-Airtight-Canister-Container/dp/B0839FVJ52/ref=sr_1_3088?qid=1679212790&s=kitchen&sr=1-3088;4.3;324.0;893.0;1599.0;STAR
Ganapati Fridge Vegetables and Fruit Net Storage Bags Zipper Multipurpose Reusable Muticolour Mesh Bag (10 x 16 inches) Pa...;home & kitchen;Kitchen Storage & Containers;https://m.media-amazon.com/images/I/81UTx-TUg4L._AC_UL320_.jpg;https://www.amazon.in/Ganapati-Vegetables-Refrigerator-Multipurpose-Muticolour/dp/B07NC3RY25/ref=sr_1_3089?qid=1679212790&s=kitchen&sr=1-3089;3.9;718.0;189.0;400.0;Ganapati
The Better Home Stainless Steel Insulated Sipper Water Bottle 710ml | Thermos Hot and Cold Water Flask | Sipper Bottle for...;home & kitchen;Kitchen Storage & Containers;https://m.media-amazon.com/images/I/61HjHHBQT7L._AC_UL320_.jpg;https://www.amazon.in/Better-Home-Stainless-Insulated-710ml/dp/B0BNL7D4HT/ref=sr_1_3090?qid=1679212790&s=kitchen&sr=1-3090;3.9;24.0;999.0;3999.0;The
Arka Home Products Canvas Eco-Friendly, Washable, Reusable Water Bottle Bags ( Off-White ) - Set of 2;home & kitchen;Kitchen Storage & Containers;https://m.media-amazon.com/images/I/61AiOb-1sSL._AC_UL320_.jpg;https://www.amazon.in/Arka-Home-Products-Eco-Friendly-Washable/dp/B07Y6CMTQQ/ref=sr_1_3091?qid=1679212790&s=kitchen&sr=1-3091;4.0;64.0;205.0;400.0;Arka
Easymart Stainless Steel 3 Layer Onion Potato Stand for Kitchen Fruit Vegetable Stand Storage Trolley Steel Kitchen Rack;home & kitchen;Kitchen Storage & Containers;https://m.media-amazon.com/images/I/71eTJ2NSFaL._AC_UL320_.jpg;https://www.amazon.in/Easymart-Stainless-Kitchen-Vegetable-Storage/dp/B082NYQPFL/ref=sr_1_3092?qid=1679212790&s=kitchen&sr=1-3092;4.0;160.0;1100.0;1999.0;Easymart
Suzec Multipurpose Dining Set 3 Piece Pickle Container, Salt and Peeper Container, mukhvas Tray Serving Plastic Spice Set ...;home & kitchen;Kitchen Storage & Containers;https://m.media-amazon.com/images/I/51waPdfxcdL._AC_UL320_.jpg;https://www.amazon.in/Suzec-Multipurpose-Container-mukhvas-Serving/dp/B0B2X5CRH3/ref=sr_1_3093?qid=1679212790&s=kitchen&sr=1-3093;5.0;1.0;179.0;999.0;Suzec
Kuber Industries Floral Design Plastic 3 Pieces Food Saver Container Set 1000, 2000 & 3000 ML (Pink);home & kitchen;Kitchen Storage & Containers;https://m.media-amazon.com/images/I/71QtawawExL._AC_UL320_.jpg;https://www.amazon.in/Kuber-Industries-Floral-Plastic-Container/dp/B07TZXYVVH/ref=sr_1_3094?qid=1679212790&s=kitchen&sr=1-3094;4.2;194.0;285.0;299.0;Kuber
shaan Glister Single Ring Matka/Pot Stands with Stainless Steel Legs - 5 Pieces;home & kitchen;Kitchen Storage & Containers;https://m.media-amazon.com/images/I/41NHI8b5YiL._AC_UL320_.jpg;https://www.amazon.in/Shaan-Plastic-Glister-Stainless-Single/dp/B07JM7XP3M/ref=sr_1_3095_mod_primary_new?qid=1679212790&s=kitchen&sbo=RZvfv%2F%2FHxDF%2BO5021pAnSA%3D%3D&sr=1-3095;3.9;2194.0;175.0;299.0;shaan
ATROCK® Stainless Steel 7 Spice Container Masala Box for Kitchen air Tight and Dishwasher Safe;home & kitchen;Kitchen Storage & Containers;https://m.media-amazon.com/images/I/31xsvbIE0fL._AC_UL320_.jpg;https://www.amazon.in/Stainless-Container-Masala-Kitchen-Dishwasher/dp/B08XXGZ9JW/ref=sr_1_3096?qid=1679212790&s=kitchen&sr=1-3096;3.8;106.0;399.0;999.0;ATROCK®
FAVNIX Temperature Smart Vacuum Insulated Thermos Water Bottle with LED Temperature Display 304 Stainless Steel Perfect fo...;home & kitchen;Kitchen Storage & Containers;https://m.media-amazon.com/images/I/71QSPhbTSCL._AC_UL320_.jpg;https://www.amazon.in/FAVNIX-Temperature-Insulated-Bottle-Stainless/dp/B0BTHKVHMD/ref=sr_1_3433?qid=1679212796&s=kitchen&sr=1-3433;3.3;7.0;;;FAVNIX
BENTEX LUXURY GLASSWARES Set of 4 Glass Bottles With Airtight Cap, Clear, Swing Top Flip Top Bottles For Fridge , 1000 ml;home & kitchen;Kitchen Storage & Containers;https://m.media-amazon.com/images/I/61qSOOyhxIS._AC_UL320_.jpg;https://www.amazon.in/BENTEX-LUXURY-GLASSWARES-Glass-Airtight/dp/B097KN827T/ref=sr_1_3434?qid=1679212796&s=kitchen&sr=1-3434;4.1;47.0;999.0;1999.0;BENTEX
DADDY - G® Multi -Purpose Mesh Storage bags Eco-Friendly, Non-Toxic, Reusable Fridge Storage Bag for Vegetables and Fruits...;home & kitchen;Kitchen Storage & Containers;https://m.media-amazon.com/images/I/81Xcj8lzfSL._AC_UL320_.jpg;https://www.amazon.in/DADDY-Multi-Purpose-Vegetables-Washable-Multicolour/dp/B073SD5GCL/ref=sr_1_3435?qid=1679212796&s=kitchen&sr=1-3435;3.8;181.0;275.0;599.0;DADDY
KitchenHub Wall Mounted Spoon Stand Holder for Kitchen, Multipurpose Hanger (Pack of 3);home & kitchen;Kitchen Storage & Containers;https://m.media-amazon.com/images/I/413IMCJb-CL._AC_UL320_.jpg;https://www.amazon.in/KitchenHub-Mounted-Holder-Kitchen-Multipurpose/dp/B08ZDRWYFZ/ref=sr_1_3436?qid=1679212796&s=kitchen&sr=1-3436;3.8;52.0;292.99;999.0;KitchenHub
Diablos Airtight Kitchen Storage Containers set of 6-1000ml, Plastic Fridge Storage container with Lock & Seal Lid, Blue;home & kitchen;Kitchen Storage & Containers;https://m.media-amazon.com/images/I/71c0jpExnvL._AC_UL320_.jpg;https://www.amazon.in/Diablos-Airtight-Containers-6-1000ml-Container/dp/B09H4B4RDD/ref=sr_1_3437?qid=1679212796&s=kitchen&sr=1-3437;3.8;245.0;749.0;1299.0;Diablos
