name;main_category;sub_category;image;link;ratings;no_of_ratings;discount_price;actual_price;brand
iSTAR Stainless Steel 304 Grade Foldable Towel Hanger for Bathroom/Towel Rod/Bar/Bathroom Accessories(24inch-Chrome) - Pac...;home & kitchen;Furniture;https://m.media-amazon.com/images/W/IMAGERENDERING_521856-T2/images/I/615uxWLcWjL._AC_UL320_.jpg;https://www.amazon.in/iSTAR-Stainless-Foldable-Accessories-24inch-Chrome/dp/B0B54QF9K2/ref=sr_1_337?qid=1679212904&s=kitchen&sr=1-337;4.5;55.0;544.0;1499.0;iSTAR
Lukzer Engineered Wood Computer Desk with One Tier Shelves Laptop Study Table for Office Home Workstation Writing Modern D...;home & kitchen;Furniture;https://m.media-amazon.com/images/W/IMAGERENDERING_521856-T2/images/I/61959chemPL._AC_UL320_.jpg;https://www.amazon.in/Lukzer-Engineered-Computer-Shelves-Workstation/dp/B0BPYBT4TB/ref=sr_1_338?qid=1679212904&s=kitchen&sr=1-338;3.7;58.0;2690.0;4990.0;Lukzer
Tiipro Prayer Mat (Black, Polyester, Standard, 1 Piece);home & kitchen;Furniture;https://m.media-amazon.com/images/W/IMAGERENDERING_521856-T2/images/I/61SEO-TT07L._AC_UL320_.jpg;https://www.amazon.in/Tiipro-Polyester-Portable-Muslim-Standard/dp/B07KK8VJKR/ref=sr_1_339?qid=1679212904&s=kitchen&sr=1-339;4.2;414.0;181.0;349.0;Tiipro
GRIVAN Multipurpose Stainless Steel Double Layer Shelf with Towel Rod I Multipurpose Wall Mount Bath Shelf Organizer l Bat...;home & kitchen;Furniture;https://m.media-amazon.com/images/W/IMAGERENDERING_521856-T2/images/I/61-0Yvi-8DS._AC_UL320_.jpg;https://www.amazon.in/GRIVAN-Stainless-Multipurpose-Organizer-Accessories-Chrome/dp/B096ZK3GZY/ref=sr_1_340?qid=1679212904&s=kitchen&sr=1-340;4.0;47.0;999.0;3499.0;GRIVAN
SPINEHEAL MATTRESS Spineheal Box Type Soft Cotton Foldable Bed Mattress, Firm Gadda For Floor & Bed, Double Size Mattress...;home & kitchen;Furniture;https://m.media-amazon.com/images/W/IMAGERENDERING_521856-T2/images/I/71AsgBnGLtL._AC_UL320_.jpg;https://www.amazon.in/SPINEHEAL-MATTRESS-Cotton-Mattress-Firm/dp/B0B5N4SL74/ref=sr_1_341?qid=1679212904&s=kitchen&sr=1-341;3.3;396.0;1613.0;1699.0;SPINEHEAL
EQUAL 3 Inch Universally Compatible Office Chair Caster Wheels (Set of 5) - Rollerblade Style;home & kitchen;Furniture;https://m.media-amazon.com/images/W/IMAGERENDERING_521856-T2/images/I/71YYja2920L._AC_UL320_.jpg;https://www.amazon.in/EQUAL-Office-Chair-Caster-Wheels/dp/B084RN5ZK8/ref=sr_1_342?qid=1679212904&s=kitchen&sr=1-342;4.6;829.0;1130.0;1899.0;EQUAL
WallDaddy - Self Adhesive Wall Mirror Stickers Big Size (30x20) Cm Frameless Wall Stickers | Mirror for Bathroom | Bedroom...;home & kitchen;Furniture;https://m.media-amazon.com/images/W/IMAGERENDERING_521856-T2/images/I/81-u-jTgn2L._AC_UL320_.jpg;https://www.amazon.in/WallDaddy-Adhesive-Frameless-B-BasinMirror-Rectangular/dp/B0BT7XXP83/ref=sr_1_343?qid=1679212904&s=kitchen&sr=1-343;1.6;6.0;229.0;849.0;WallDaddy
ELV Direct Tabletop Vertical Laptop Stand Holder, Desktop Aluminum Lapdesk Laptop Stand with Adjustable Dock Size, Fits Al...;home & kitchen;Furniture;https://m.media-amazon.com/images/W/IMAGERENDERING_521856-T2/images/I/61g3dNuGRkL._AC_UL320_.jpg;https://www.amazon.in/ELV-Direct-Vertical-Adjustable-VERTCL-Lap-STD-SML/dp/B09LCY4M26/ref=sr_1_344?qid=1679212904&s=kitchen&sr=1-344;4.3;674.0;799.0;1999.0;ELV
Amazon Brand - Solimo - Multipurpose Rack for Shoes and Clothes, 8 Racks, Black;home & kitchen;Furniture;https://m.media-amazon.com/images/W/IMAGERENDERING_521856-T2/images/I/715wwm0l3SL._AC_UL320_.jpg;https://www.amazon.in/Amazon-Brand-Solimo-Multipurpose-Clothes/dp/B0B9811KST/ref=sr_1_345?qid=1679212904&s=kitchen&sr=1-345;3.5;27.0;1064.86;6299.0;Amazon
Spineheal 3 Inch Dual Side Reversible Sigle Bed Size Mattress, 3 Fold Firm Orthopedic: Travelling or Picnic Mattress (Blu...;home & kitchen;Furniture;https://m.media-amazon.com/images/W/IMAGERENDERING_521856-T2/images/I/81l98RNwVDL._AC_UL320_.jpg;https://www.amazon.in/Spineheal-Reversible-Mattress-Orthopedic-Travelling/dp/B0BSC6B2PV/ref=sr_1_346?qid=1679212904&s=kitchen&sr=1-346;3.7;19.0;1519.0;2599.0;Spineheal
Fulminare Self-Adhesive Aluminium Bathroom Corner Shelf Rack Bathroom Corner Organizer Stand Bathroom Organisers Storage R...;home & kitchen;Furniture;https://m.media-amazon.com/images/W/IMAGERENDERING_521856-T2/images/I/81JRpSeIYpL._AC_UL320_.jpg;https://www.amazon.in/Fulminare-Self-Adhesive-Aluminium-Organizer-Organisers/dp/B0BFB96XHK/ref=sr_1_347?qid=1679212904&s=kitchen&sr=1-347;4.4;305.0;1299.0;1999.0;Fulminare
Wolpin Plastic Hanger Towel Hanger/Holder for Bathroom Self Adhesive Towel Stand/Rack Bathroom Accessories Towel Bar (25.7...;home & kitchen;Furniture;https://m.media-amazon.com/images/W/IMAGERENDERING_521856-T2/images/I/71MYInTvD4L._AC_UL320_.jpg;https://www.amazon.in/Wolpin-Plastic-Bathroom-Adhesive-Accessories/dp/B09S1FNM1T/ref=sr_1_348?qid=1679212904&s=kitchen&sr=1-348;3.8;186.0;279.0;999.0;Wolpin
Rylan Wall Shelf for Living Room, Metallic Gold White Wall Mounted Shelves, Home Decor Items for Living Room/Bedroom, Set ...;home & kitchen;Furniture;https://m.media-amazon.com/images/W/IMAGERENDERING_521856-T2/images/I/61YMC6+FhqL._AC_UL320_.jpg;https://www.amazon.in/Rylan-Metallic-Mounted-Shelves-Bedroom/dp/B0BT9TSDD9/ref=sr_1_349?qid=1679212904&s=kitchen&sr=1-349;4.3;78.0;499.0;999.0;Rylan
Cane Crafts Bamboo Bait Wooden Shoe Rack Slipper and Shoes Stand Multi-Purpose Rack Decorative Planter Stand Cane Storage ...;home & kitchen;Furniture;https://m.media-amazon.com/images/W/IMAGERENDERING_521856-T2/images/I/71yymzx4FdL._AC_UL320_.jpg;https://www.amazon.in/Enterprises-Bamboo-Slipper-Planter-Bookshelf/dp/B09HBZ5NGB/ref=sr_1_350?qid=1679212904&s=kitchen&sr=1-350;3.3;163.0;1019.0;1999.0;Cane
Plantex Bathroom Accessories-Stainless Steel 304 Grade Folding Towel Rack/Towel Hanger/Bathroom Organizer(24 Inch-Chrome);home & kitchen;Furniture;https://m.media-amazon.com/images/W/IMAGERENDERING_521856-T2/images/I/61D114hxxTL._AC_UL320_.jpg;https://www.amazon.in/Plantex-Premium-Stainless-Bathroom-Accessories/dp/B082QZ3RSJ/ref=sr_1_351?qid=1679212904&s=kitchen&sr=1-351;4.0;570.0;1399.0;3799.0;Plantex
TABLE MAGIC Urban Raiser Laptop Table Mat Finish 8 Adjustable Heights, Tall Boy Model Can be Used on Sitting and Standing ...;home & kitchen;Furniture;https://m.media-amazon.com/images/W/IMAGERENDERING_521856-T2/images/I/71z1kfBCkUL._AC_UL320_.jpg;https://www.amazon.in/TABLE-MAGIC-Adjustable-Standing-Position/dp/B0BN19QSPG/ref=sr_1_352?qid=1679212904&s=kitchen&sr=1-352;4.3;28.0;2989.0;4490.0;TABLE
BDMP 3 Shelves Shoe Stand Collapsible Storage Shoe Stand Storage Rack of Footwear, Books, Toys, Clothes Plastic Shoe Stand...;home & kitchen;Furniture;https://m.media-amazon.com/images/W/IMAGERENDERING_521856-T2/images/I/61sDrHke87L._AC_UL320_.jpg;https://www.amazon.in/BDMP-Shelves-Collapsible-Storage-Footwear/dp/B0BVBN2ZBD/ref=sr_1_353?qid=1679212904&s=kitchen&sr=1-353;1.7;8.0;299.0;599.0;BDMP
Genuine Decor 18 Inch Sheesham Wood Floating Shelves for Wall Set of 3, Rustic Wall Mounted Ledge Shelf for Bathroom, Bedr...;home & kitchen;Furniture;https://m.media-amazon.com/images/W/IMAGERENDERING_521856-T2/images/I/61ftPN+jalL._AC_UL320_.jpg;https://www.amazon.in/Genuine-Decor-Floating-Shelves-Bathroom/dp/B08MDZX9NR/ref=sr_1_354?qid=1679212904&s=kitchen&sr=1-354;4.2;792.0;1399.0;4999.0;Genuine
Kuber Industries Traditional Carpet/Pooja Mat|Square Shape & Soft Velvet Material|Maditation Prayer Mat|Size 60 x 60 CM,Pa...;home & kitchen;Furniture;https://m.media-amazon.com/images/W/IMAGERENDERING_521856-T2/images/I/912z6+e4yRL._AC_UL320_.jpg;https://www.amazon.in/Kuber-Industries-Velvet-Pooja-Mat/dp/B01N5F9LU6/ref=sr_1_355?qid=1679212904&s=kitchen&sr=1-355;4.1;759.0;147.0;169.0;Kuber
StarAndDaisy K80 Adjustable Height, Plastic Finish Multi-Functional Kids Study Table with Book Holder, Drawer, Extra Large...;home & kitchen;Furniture;https://m.media-amazon.com/images/W/IMAGERENDERING_521856-T2/images/I/51nozAnah7L._AC_UL320_.jpg;https://www.amazon.in/StarAndDaisy-Adjustable-Multi-Functional-Desktop-Light%C3%82/dp/B08FBBP5XG/ref=sr_1_356?qid=1679212904&s=kitchen&sr=1-356;4.1;1101.0;5699.0;9999.0;StarAndDaisy
Bharat Sales Vinyl Adjustable Height Control Chair (Brown);home & kitchen;Furniture;https://m.media-amazon.com/images/W/IMAGERENDERING_521856-T2/images/I/41b0zi94czL._AC_UL320_.jpg;https://www.amazon.in/Bharat-Sales-Adjustable-Height-Control/dp/B08VJ68429/ref=sr_1_357?qid=1679212904&s=kitchen&sr=1-357;3.3;109.0;499.0;1199.0;Bharat
MOLIRA Foldable Foam Mattress Single Bed| Folding Single Bed Matterss for Floor, Travelling, Light Weight (Multicolor 1, 3...;home & kitchen;Furniture;https://m.media-amazon.com/images/W/IMAGERENDERING_521856-T2/images/I/61U-f688fhL._AC_UL320_.jpg;https://www.amazon.in/MOLIRA-Foldable-Mattress-Travelling-Multicolor/dp/B0BPBSKSPN/ref=sr_1_358?qid=1679212904&s=kitchen&sr=1-358;2.9;37.0;745.0;2899.0;MOLIRA
Multipurpose Utility 4 Layer Heavy Duty Open Plastic Book/Shoe/Cloth Foldable Rack for Any Use - Black;home & kitchen;Furniture;https://m.media-amazon.com/images/W/IMAGERENDERING_521856-T2/images/I/41pCpUoeXqL._AC_UL320_.jpg;https://www.amazon.in/Multipurpose-Utility-Layer-Plastic-Foldable/dp/B0BK1PPGNC/ref=sr_1_359?qid=1679212904&s=kitchen&sr=1-359;3.5;2.0;449.0;1999.0;Multipurpose
Urooz Macramé Wooden Wall Hanging Shelf |921| Modern Chic Woven Macrame Tapestries, Wall Art Home Decor for Apartment, Dor...;home & kitchen;Furniture;https://m.media-amazon.com/images/W/IMAGERENDERING_521856-T2/images/I/61OLY2K9pVL._AC_UL320_.jpg;https://www.amazon.in/Urooz-Tapestries-Apartment-Decorations-30x15X50/dp/B0BKXMKJW3/ref=sr_1_360?qid=1679212904&s=kitchen&sr=1-360;4.1;16.0;299.0;499.0;Urooz
MACCA Brand - XXXL Clasic Bean Bag Filled with Beans Ready to Use (Faux Leather) (Navy Blue);home & kitchen;Furniture;https://m.media-amazon.com/images/I/51soywcAI9L._AC_UL320_.jpg;https://www.amazon.in/MACCA-Brand-Clasic-Filled-Leather/dp/B0BTBBRJ6T/ref=sr_1_433?qid=1679212906&s=kitchen&sr=1-433;4.1;5.0;1595.0;2499.0;MACCA
Supreme Bazaar Stainless Steel Napkin Ring/ Towel Hanger/ Napkin Holder, Wall Mounted for Kitchen, Wash Area, Bathroom Acc...;home & kitchen;Furniture;https://m.media-amazon.com/images/I/31yY3bh5EnL._AC_UL320_.jpg;https://www.amazon.in/Supreme-Bazaar-Stainless-Towel-Accessories/dp/B09C4SFZZG/ref=sr_1_434?qid=1679212906&s=kitchen&sr=1-434;3.7;211.0;174.0;399.0;Supreme
Kuber Industries Country Modern Door Mat/Floor Mat|Solid Print & Cotton Material|Water Absorbent & Easy to Wash|Size Large...;home & kitchen;Furniture;https://m.media-amazon.com/images/I/81FOX5pkqQL._AC_UL320_.jpg;https://www.amazon.in/Kuber-Industries-Flower-Design-Cotton/dp/B07GM7B7LP/ref=sr_1_435?qid=1679212906&s=kitchen&sr=1-435;4.0;969.0;189.0;398.0;Kuber
Generic LTT-0001 Multipurpose Wood Laptop Table with Dock Stand & Non-Slip Legs Foldable and Portable Lapdesk for Study & ...;home & kitchen;Furniture;https://m.media-amazon.com/images/I/61tbu79Rj2L._AC_UL320_.jpg;https://www.amazon.in/Hossejoy-Foldable-Breakfast-Serving-Reading/dp/B0866GKZMF/ref=sr_1_436_mod_primary_new?qid=1679212906&s=kitchen&sbo=RZvfv%2F%2FHxDF%2BO5021pAnSA%3D%3D&sr=1-436;3.7;2224.0;399.0;1299.0;Generic
Cello Classic Perfect Posture Plastic Stool, Small, Ivory;home & kitchen;Furniture;https://m.media-amazon.com/images/I/71l91RQ2HBL._AC_UL320_.jpg;https://www.amazon.in/Cello-Classic-Perfect-Posture-Plastic/dp/B01KXQ8E7Q/ref=sr_1_437?qid=1679212906&s=kitchen&sr=1-437;4.4;408.0;549.0;613.0;Cello
Zollyss Punch-Free Powder Coated Multipurpose Metal Powder Coated Wall Holder Kitchen Bathroom Shelf with Strong Magic Sti...;home & kitchen;Furniture;https://m.media-amazon.com/images/I/51mjg0JxZvL._AC_UL320_.jpg;https://www.amazon.in/Zollyss-Punch-Free-Multipurpose-Bathroom-Organizer/dp/B08L3D4F3Q/ref=sr_1_438?qid=1679212906&s=kitchen&sr=1-438;3.6;108.0;279.0;899.0;Zollyss
EEMWAY Fabric Cover only (Compatible for 4-Layer Portable Shoe Rack size-L24xB12xH28inch) sky blue Color;home & kitchen;Furniture;https://m.media-amazon.com/images/I/61IYvBy65YL._AC_UL320_.jpg;https://www.amazon.in/EEMWAY-Fabric-Portable-4-laier-SkyBlue/dp/B084DQZCQ4/ref=sr_1_439?qid=1679212906&s=kitchen&sr=1-439;3.8;1347.0;204.0;500.0;EEMWAY
OXMIC Nesting Round End Table Set Of 2,Beautiful Wooden Antique Side Table,Wooden Bedside Table For Your Living Room,Bedsi...;home & kitchen;Furniture;https://m.media-amazon.com/images/I/518fWz4lUdL._AC_UL320_.jpg;https://www.amazon.in/OXMIC-Nesting-Beautiful-Antique-Bedside/dp/B0BRK3W5T2/ref=sr_1_440?qid=1679212906&s=kitchen&sr=1-440;4.4;10.0;1499.0;2000.0;OXMIC
Zemic Portable Shoe Rack Organizer with Door, 20 Pairs Shoe Storage Cabinet Easy Assembly, Plastic Adjustable Shoe Storage...;home & kitchen;Furniture;https://m.media-amazon.com/images/I/61tYxdoTe1L._AC_UL320_.jpg;https://www.amazon.in/Zemic-Adjustable-Detachable-Expandable-Black10Shelf5Door/dp/B0BPP3K9YC/ref=sr_1_441?qid=1679212906&s=kitchen&sr=1-441;4.5;1746.0;2672.0;7475.0;Zemic
Wakefit Bean Bag, Bean Bag with Beans Filled, Bean Bag XXXL, Original Leatherette Bean Bag with Beans,(Black with Red Piping);home & kitchen;Furniture;https://m.media-amazon.com/images/I/41QS7nhxrXL._AC_UL320_.jpg;https://www.amazon.in/Wakefit-Filled-Original-Leatherette-Piping/dp/B0B8HM9XSL/ref=sr_1_442?qid=1679212906&s=kitchen&sr=1-442;4.4;412.0;1833.0;2699.0;Wakefit
Swingzy Cotton Netted Rope Hanging Swing Chair for Adults/Swing for Balcony/Outdoor Swing Chair/Hammock Swing for Home, Pa...;home & kitchen;Furniture;https://m.media-amazon.com/images/I/71G9qw7kKWL._AC_UL320_.jpg;https://www.amazon.in/Swingzy-Hanging-Capacity-Accessories-Included/dp/B099WZV4K4/ref=sr_1_443?qid=1679212906&s=kitchen&sr=1-443;3.8;506.0;999.0;3490.0;Swingzy
Onlymat PVC Backing, Natural Rubber Coir Oval Long-Lasting, Heavy Duty, Anti-Slip Large and Thick Doormat with Designer Bo...;home & kitchen;Furniture;https://m.media-amazon.com/images/I/917i-ytzpSL._AC_UL320_.jpg;https://www.amazon.in/Rubber-Anti-Slip-Doormat-Black-Brown/dp/B075QDGR6S/ref=sr_1_444?qid=1679212906&s=kitchen&sr=1-444;4.5;903.0;;1099.0;Onlymat
ABOUT SPACE Wooden Side Table - Night Stand & End Table Organiser - DIY Space Saver Storage Organizer - Bedside Furniture ...;home & kitchen;Furniture;https://m.media-amazon.com/images/I/51Y5sStyM1L._AC_UL320_.jpg;https://www.amazon.in/Portable-Wooden-Furniture-Storage-Balcony/dp/B09NDNQJB5/ref=sr_1_445?qid=1679212906&s=kitchen&sr=1-445;4.5;350.0;1229.0;2299.0;ABOUT
Amazon Brand – Umi Multi-Purpose Shoe Rack - (5 Tier, Black);home & kitchen;Furniture;https://m.media-amazon.com/images/I/81J2zby1+8L._AC_UL320_.jpg;https://www.amazon.in/Amazon-Brand-Multi-Purpose-Shoe-Black/dp/B0B5RTNK7M/ref=sr_1_446?qid=1679212906&s=kitchen&sr=1-446;4.1;94.0;1139.0;1999.0;Amazon
DDE Leo Upgraded Folding Stool Lightweight Yet More Sturdy with Load Capacity 400lbs Portable Collapsible Stool Retractabl...;home & kitchen;Furniture;https://m.media-amazon.com/images/I/51kGE816yhL._AC_UL320_.jpg;https://www.amazon.in/DDE-Upgraded-Lightweight-Collapsible-Retractable/dp/B09JJCMPGH/ref=sr_1_447_mod_primary_new?qid=1679212906&s=kitchen&sbo=RZvfv%2F%2FHxDF%2BO5021pAnSA%3D%3D&sr=1-447;2.9;52.0;593.0;1699.0;DDE
Dyazo Zigzag Height Adjustable Ventilated Aluminium Tabletop Laptop Stand with 6 Angles Multi-Angle Compatible for MacBook...;home & kitchen;Furniture;https://m.media-amazon.com/images/I/41A5OI3-NqL._AC_UL320_.jpg;https://www.amazon.in/Dyazo-Adjustable-Ventilated-Multi-Angle-Compatible/dp/B08VK11P24/ref=sr_1_448?qid=1679212906&s=kitchen&sr=1-448;4.3;1641.0;599.0;1999.0;Dyazo
SDG Frameless Oval Wall Mount Mirror (18X24Inch, Silver)(Unframed );home & kitchen;Furniture;https://m.media-amazon.com/images/I/71znbNjZvvL._AC_UL320_.jpg;https://www.amazon.in/SDG-Frameless-Mirror-Bathrooms-Decor/dp/B07CK3R2C6/ref=sr_1_449?qid=1679212906&s=kitchen&sr=1-449;4.3;1539.0;1399.0;2000.0;SDG
Star Work Zero Gravity Relax Chair For Lounge,Easy Chair for Lawn | Portable and Foldable Recliner Chair for Resting | Adj...;home & kitchen;Furniture;https://m.media-amazon.com/images/I/81lQ40jzq-L._AC_UL320_.jpg;https://www.amazon.in/Portable-Foldable-Recliner-Adjustable-Stainless/dp/B0BH2CNRT8/ref=sr_1_450?qid=1679212906&s=kitchen&sr=1-450;3.9;177.0;2999.0;4999.0;Star
PARASNATH Mild Steel Plastic 3-4 Layer Utility Shoe Rack Shoe Rack/Shelve Shoe Stand - Made in India (Red);home & kitchen;Furniture;https://m.media-amazon.com/images/I/91FHmLk9-dL._AC_UL320_.jpg;https://www.amazon.in/PARASNATH-Steel-Plastic-Utility-Shelve/dp/B09GV9KG9V/ref=sr_1_451?qid=1679212906&s=kitchen&sr=1-451;3.6;313.0;370.0;1500.0;PARASNATH
Device Bas with BROWN ART SHOPPEE Nightstand, End Side Table with Drawer and Solid Wood Legs, Bedside Table for Bedrooms, ...;home & kitchen;Furniture;https://m.media-amazon.com/images/I/71TR4ruV02L._AC_UL320_.jpg;https://www.amazon.in/Device-Bas-BROWN-SHOPPEE-White/dp/B09WTN5666/ref=sr_1_452?qid=1679212906&s=kitchen&sr=1-452;4.1;242.0;1899.0;2999.0;Device
Wooden Twist Rafuf Wooden Intersecting Wall Shelves ( Set of 8 ) (Standard, Red & Black);home & kitchen;Furniture;https://m.media-amazon.com/images/I/61r3ZIqLCWL._AC_UL320_.jpg;https://www.amazon.in/Wooden-Twist-Intersecting-Shelves-Standard/dp/B08QDN2WTZ/ref=sr_1_453?qid=1679212906&s=kitchen&sr=1-453;3.9;1593.0;1490.0;3699.0;Wooden
Green Soul Trigger Multipurpose Electric Height Adjustable Engineered Wood Table Desk, Ergonomic Spacious Sit-Stand Desk, ...;home & kitchen;Furniture;https://m.media-amazon.com/images/I/51NCNCaLsjL._AC_UL320_.jpg;https://www.amazon.in/Green-Soul-Multipurpose-Adjustable-Ergonomic/dp/B09MLY3CJZ/ref=sr_1_454?qid=1679212906&s=kitchen&sr=1-454;4.5;285.0;23490.0;49073.0;Green
Wakefit Mattress | 7 Years Warranty | Dual Comfort with Hard & Soft Foam, Mattress Double Bed, Foam Mattress, 6-Inch Bed M...;home & kitchen;Furniture;https://m.media-amazon.com/images/I/51TGAedG2dL._AC_UL320_.jpg;https://www.amazon.in/Wakefit-Dual-Comfort-Mattress-6inch/dp/B00RACAUJM/ref=sr_1_455?qid=1679212906&s=kitchen&sr=1-455;4.5;31979.0;9022.0;10491.0;Wakefit
Voltonix Bathroom Mat,Door mat Door Mat Quick Drying Water Soak Bathroom Mats Anti Slip Big Size Water Absorbing Floor Was...;home & kitchen;Furniture;https://m.media-amazon.com/images/I/41PzL4Ds0xL._AC_UL320_.jpg;https://www.amazon.in/Voltonix-Bathroom-Mat-Absorbing-Washable/dp/B0BSQ19823/ref=sr_1_456?qid=1679212906&s=kitchen&sr=1-456;4.7;98.0;299.0;2099.0;Voltonix
Flexi Madhav Self-Adhesive Stainless Steel Bathroom Corner Rack Storage Shelves (Chrome Finish), Black, Set of 1;home & kitchen;Furniture;https://m.media-amazon.com/images/I/61yFp5uq5cS._AC_UL320_.jpg;https://www.amazon.in/Flexi-Madhav-Self-Adhesive-Stainless-Bathroom/dp/B09VXLVGTT/ref=sr_1_481?qid=1679212908&s=kitchen&sr=1-481;3.4;292.0;299.0;999.0;Flexi
KARP Office Chair Wheel Heavy Duty Castor Thread Type Revolving Chair Wheel - 2 Inch Office Chair Wheels Replacement Set o...;home & kitchen;Furniture;https://m.media-amazon.com/images/I/61OovdsVISL._AC_UL320_.jpg;https://www.amazon.in/KARP-Office-Castor-Thread-Revolving/dp/B09RSYPKX8/ref=sr_1_482?qid=1679212908&s=kitchen&sr=1-482;3.6;119.0;249.0;499.0;KARP
Amazon Brand - Solimo Rhine Study/Laptop Table and Chair Set (Black);home & kitchen;Furniture;https://m.media-amazon.com/images/I/71kyi9i1CAS._AC_UL320_.jpg;https://www.amazon.in/Amazon-Brand-Solimo-DR-FTS-5073-table-chair/dp/B089DK4WYC/ref=sr_1_483?qid=1679212908&s=kitchen&sr=1-483;4.0;121.0;2499.0;5000.0;Amazon
BDMP Shoe Rack with Cover for Home 5 Shelves Multipurpose Rack Organizer for Shoe/Clothes/Books Stand Storage -(Rustproof ...;home & kitchen;Furniture;https://m.media-amazon.com/images/I/41GeMoDiFHL._AC_UL320_.jpg;https://www.amazon.in/BDMP-Shelves-Multipurpose-Organizer-Rustproof/dp/B0BS6Q4KDC/ref=sr_1_484?qid=1679212908&s=kitchen&sr=1-484;3.5;8.0;590.0;799.0;BDMP
Snazzy 5 Tier Foldable Metal Open Bookshelf, Bookcase, Bookrack ( Grey);home & kitchen;Furniture;https://m.media-amazon.com/images/I/519s3uO0fKL._AC_UL320_.jpg;https://www.amazon.in/Snazzy-Foldable-Bookshelf-Bookcase-Bookrack/dp/B099ZLX7QG/ref=sr_1_485?qid=1679212908&s=kitchen&sr=1-485;3.8;102.0;1385.0;1999.0;Snazzy
U & I Designs Bean Bag Fur New Tie Dye Rainbow Design Furry Bean Bag Chair. Premium And Luxurious Fur Bean Bag Without Bea...;home & kitchen;Furniture;https://m.media-amazon.com/images/I/918dgStgj9L._AC_UL320_.jpg;https://www.amazon.in/Designs-Rainbow-Premium-Luxurious-Multicolour/dp/B0BTBRMYLF/ref=sr_1_486?qid=1679212908&s=kitchen&sr=1-486;3.9;2.0;899.0;3000.0;U
Coiron ® Slim - Foldable Floor Mattress for Sleeping - 72X48X1- inch (Blue, Polycotton, Medium) - Double Size;home & kitchen;Furniture;https://m.media-amazon.com/images/I/61q+IWqdwzL._AC_UL320_.jpg;https://www.amazon.in/Coiron-Slim-Foldable-Mattress-Sleeping/dp/B08TM66RR2/ref=sr_1_487?qid=1679212908&s=kitchen&sr=1-487;4.1;374.0;1741.0;2560.0;Coiron
Plantex Antique Towel Ring/Napkin Holder - Aluminum Hanger/Bathroom Accessories (Color - Brass);home & kitchen;Furniture;https://m.media-amazon.com/images/I/410cLuofB-L._AC_UL320_.jpg;https://www.amazon.in/Plantex-Antique-Aluminium-Bathroom-Accessories/dp/B07W8GVBBF/ref=sr_1_488?qid=1679212908&s=kitchen&sr=1-488;4.2;659.0;699.0;2049.0;Plantex
COZY RABBIT 4XL Faux Leather Bean Bag Cover Without Beans & Footrest with Cushion Cover Unfilled Color- (Brown);home & kitchen;Furniture;https://m.media-amazon.com/images/I/61pHcJvLZmL._AC_UL320_.jpg;https://www.amazon.in/COZY-RABBIT-Bean-Footrest-Cushion/dp/B0BRVLNQLP/ref=sr_1_489?qid=1679212908&s=kitchen&sr=1-489;3.2;16.0;999.0;1999.0;COZY
Nirency Bathroom Shelf for Wall, Bathroom Rack, Bathroom Stand for Wall, Bathroom Corner Shelf, Bathroom Organizer Without...;home & kitchen;Furniture;https://m.media-amazon.com/images/I/41uY8fDgh3L._AC_UL320_.jpg;https://www.amazon.in/Nirency-Multipurpose-Bathroom-Drilling-Self-Adhesive/dp/B09CMHC6TC/ref=sr_1_490?qid=1679212908&s=kitchen&sr=1-490;3.7;183.0;399.0;1000.0;Nirency
DeoDap Bathroom Mirror Unbreakable Square Shape Plastic Sheet Mirror Effect Wall Sticker Mirror (Multi Color);home & kitchen;Furniture;https://m.media-amazon.com/images/I/615HvKRqBzL._AC_UL320_.jpg;https://www.amazon.in/DeoDap-Bathroom-Unbreakable-Plastic-Sticker/dp/B09M6M5KPV/ref=sr_1_491?qid=1679212908&s=kitchen&sr=1-491;2.2;3.0;196.5;299.0;DeoDap
Lukzer 2PC Car Back Pain Relief Lower Back Support for Chair Orthopedic Sciatica Pain Relief Lumbar Back Rest/Men Women Ve...;home & kitchen;Furniture;https://m.media-amazon.com/images/I/8176B7ainaL._AC_UL320_.jpg;https://www.amazon.in/Lukzer-Ventilation-Lumbar-Support-Cushion/dp/B07TCPVFP1/ref=sr_1_492?qid=1679212908&s=kitchen&sr=1-492;3.6;741.0;375.0;699.0;Lukzer
Lifekrafts Anti Fatigue Floor Mat Thick Perfect Kitchen Mat, Standing Desk Mat. Comfort at Home, Office, Garage 82x52 cms...;home & kitchen;Furniture;https://m.media-amazon.com/images/I/61ClghNjirL._AC_UL320_.jpg;https://www.amazon.in/LifeKrafts-Fatigue-Floor-Mat-Standing/dp/B09GRSF35Z/ref=sr_1_493?qid=1679212908&s=kitchen&sr=1-493;4.3;93.0;2790.0;4599.0;Lifekrafts
HOKIPO Rubber Back Dirt Trapper Entrance Door Mats Big Size, 48x78 cm, Brown;home & kitchen;Furniture;https://m.media-amazon.com/images/I/91GdqnZFeCL._AC_UL320_.jpg;https://www.amazon.in/HOKIPO%C2%AE-Antislip-Rubber-Trapper-Entrance/dp/B082KW5992/ref=sr_1_494?qid=1679212908&s=kitchen&sr=1-494;4.3;308.0;699.0;899.0;HOKIPO
Study Table Chair for Growing Kids क ख ग,ABCD,1234 Cartoon Printed Rounded Edges Foldable Study Table and Chair Set for Ki...;home & kitchen;Furniture;https://m.media-amazon.com/images/I/71I+1qRvDML._AC_UL320_.jpg;https://www.amazon.in/Growing-Cartoon-Printed-Rounded-Foldable/dp/B0BMDW8X6P/ref=sr_1_495?qid=1679212908&s=kitchen&sr=1-495;3.6;8.0;699.0;1450.0;Study
Featherlite ''Astro'' Mesh Home & Office Ergonomic Chair with, Adjustable Lumbar Support, Adjustable Armrest & DIY (High B...;home & kitchen;Furniture;https://m.media-amazon.com/images/I/71bIM51hRiL._AC_UL320_.jpg;https://www.amazon.in/Featherlite-Ergonomic-Adjustable-Support-Armrest/dp/B09DNZPTJ8/ref=sr_1_496?qid=1679212908&s=kitchen&sr=1-496;4.2;874.0;8999.0;11110.0;Featherlite
Snazzy Bamboo Wood Foldable Portable Adjustable Height Multipurpose Laptop Table Lap Desk/Study Table/Writing Utility Tabl...;home & kitchen;Furniture;https://m.media-amazon.com/images/I/71dBNWATtZL._AC_UL320_.jpg;https://www.amazon.in/Snazzy-Foldable-Multipurpose-Adjustable-Storage/dp/B081LD9TC1/ref=sr_1_497?qid=1679212908&s=kitchen&sr=1-497;4.3;187.0;1645.0;1999.0;Snazzy
JY Soft Cotton Foldable Bed Mattress, Firm Gadda for Floor & Bed, Double Size Mattress (72 X35 Inches) Heavy Check;home & kitchen;Furniture;https://m.media-amazon.com/images/I/41Pa4xrP9gL._AC_UL320_.jpg;https://www.amazon.in/JY-Cotton-Foldable-Mattress-Double/dp/B0BWNFNFKK/ref=sr_1_498?qid=1679212908&s=kitchen&sr=1-498;;;399.0;999.0;JY
KILSON Comfort Bean Bag Refill Filler for Filled Bean Bag 2KG - Get net Weight 1700 Gram;home & kitchen;Furniture;https://m.media-amazon.com/images/I/615QeMbIpdL._AC_UL320_.jpg;https://www.amazon.in/KILSON-Comfort-Refill-Filler-Petroleum/dp/B099RW3C6F/ref=sr_1_499?qid=1679212908&s=kitchen&sr=1-499;3.9;127.0;749.0;1599.0;KILSON
Wakefit Mattress | 10 Years Warranty | Latex Mattress, Mattress Single Bed, Natural Latex Mattress with Memory Foam, 8-Inc...;home & kitchen;Furniture;https://m.media-amazon.com/images/I/61NDmDbgJwL._AC_UL320_.jpg;https://www.amazon.in/Wakefit-8-inch-Latex-Mattress-72x36x8_Latex/dp/B08XB5VF3N/ref=sr_1_500?qid=1679212908&s=kitchen&sr=1-500;4.5;2597.0;6418.0;13658.0;Wakefit
TNT THE NEXT TREND Corner Shelf Unbreakable White Corner Set for Bathroom and Kitchen Shelves (Pack of 3, Plastic);home & kitchen;Furniture;https://m.media-amazon.com/images/I/515u6-BbvJL._AC_UL320_.jpg;https://www.amazon.in/TNT-Unbreakable-Bathroom-Kitchen-Shelves/dp/B097N4L7MV/ref=sr_1_501?qid=1679212908&s=kitchen&sr=1-501;4.2;1885.0;229.0;649.0;TNT
