name;main_category;sub_category;image;link;ratings;no_of_ratings;discount_price;actual_price;brand
HOWNICE Door MAT from Super Store Stylish Thick Anti Slip Anti Skid Cotton Door mat Main Door (Mat Flower Doormat Red);home & kitchen;Furniture;https://m.media-amazon.com/images/W/IMAGERENDERING_521856-T2/images/I/61s4-YP4Z7L._AC_UL320_.jpg;https://www.amazon.in/HOWNICE-Door-Mat-Flower-Red/dp/B0B86K7KGP/ref=sr_1_4629?qid=1679212981&s=kitchen&sr=1-4629;2.6;5.0;310.0;1299.0;HOWNICE
Bharath Furniture Assam Teak Solid Wooden Diwan/Deewan Cot 72 * 30 Glossy Finish;home & kitchen;Furniture;https://m.media-amazon.com/images/W/IMAGERENDERING_521856-T2/images/I/21CtOxgFrEL._AC_UL320_.jpg;https://www.amazon.in/Bharath-Furniture-Wooden-Deewan-Glossy/dp/B09WW4HCH3/ref=sr_1_4630?qid=1679212981&s=kitchen&sr=1-4630;;;;;Bharath
bi3 Stainless Steel Tube and PP Plastic 4 Tier Multiple Finish Adjustable Bathroom Corner Stand Organizer (White);home & kitchen;Furniture;https://m.media-amazon.com/images/W/IMAGERENDERING_521856-T2/images/I/911AdXxUchL._AC_UL320_.jpg;https://www.amazon.in/bi3-Adjustable-Organiser-Stainless-Telescopic/dp/B077D4BFWL/ref=sr_1_4631?qid=1679212981&s=kitchen&sr=1-4631;3.9;81.0;1640.0;2499.0;bi3
Online Decor Shoppee Modern Round Coffee Table for Living Room Nesting Table Multipurpose USE Industrial Stacking Vintage ...;home & kitchen;Furniture;https://m.media-amazon.com/images/W/IMAGERENDERING_521856-T2/images/I/914nSaurQfL._AC_UL320_.jpg;https://www.amazon.in/Online-Decor-Shoppee-Multipurpose-Industrial/dp/B0BT171QL1/ref=sr_1_4632?qid=1679212981&s=kitchen&sr=1-4632;;;3599.0;5999.0;Online
Amazon Brand - Solimo XXL Faux Leather Bean Bag Cover without Beans (Green with Yellow Piping);home & kitchen;Furniture;https://m.media-amazon.com/images/I/71nhKbR8kBL._AC_UL320_.jpg;https://www.amazon.in/Amazon-Brand-Solimo-Yellow-Piping/dp/B078J5DV8X/ref=sr_1_4633?qid=1679212983&s=kitchen&sr=1-4633;4.0;1125.0;699.0;1299.0;Amazon
Deevine Craft 3 Fold EPE Foam Mattress Single Bed Medium Hard Folding Pure EPE Foam 3 Fold Mattress (2 Inches, Multicolour);home & kitchen;Furniture;https://m.media-amazon.com/images/I/718RdgezFUL._AC_UL320_.jpg;https://www.amazon.in/Deevine-Craft-Fold-EPE-Mattress/dp/B0BCGGQXX1/ref=sr_1_4634?qid=1679212983&s=kitchen&sr=1-4634;4.0;2.0;749.0;2998.0;Deevine
ASTRECA Kitchen and Bathroom Shelf, Adhesive Non-Drilling Wall-Mounted Storage Rack, Self Adhesive Stand for Soap, Liquid ...;home & kitchen;Furniture;https://m.media-amazon.com/images/I/61sZm8+LENL._AC_UL320_.jpg;https://www.amazon.in/ASTRECA-Bathroom-Shelf-Non-Drilling-Wall-Mounted/dp/B0BWF9GWLZ/ref=sr_1_4635?qid=1679212983&s=kitchen&sr=1-4635;5.0;6.0;289.0;999.0;ASTRECA
ORAM Smart Standard Multi-Purpose Laptop Table with Dock Stand/Study Table/Bed Table/Foldable and Portable Laptop Table- (...;home & kitchen;Furniture;https://m.media-amazon.com/images/I/51qDzF0XRdL._AC_UL320_.jpg;https://www.amazon.in/ORAM-Standard-Multi-Purpose-Foldable-Portable/dp/B0BQF44LG5/ref=sr_1_4636?qid=1679212983&s=kitchen&sr=1-4636;;;219.0;999.0;ORAM
THEHEARTWILL Engineered Wood Glossy Wall Rack Shelves for Living and Bedroom Decoration, Set of 1 (White);home & kitchen;Furniture;https://m.media-amazon.com/images/I/51q0g-ArFtS._AC_UL320_.jpg;https://www.amazon.in/THEHEARTWILL-Engineered-Shelves-Bedroom-Decoration/dp/B0B7DP1XTT/ref=sr_1_4637?qid=1679212983&s=kitchen&sr=1-4637;3.2;61.0;449.0;699.0;THEHEARTWILL
Teraiya’s ® 30 Shape Mirror Kit with Free Storage Box (1500 pcs) Premium Cutting;home & kitchen;Furniture;https://m.media-amazon.com/images/I/61NEHH1zXSL._AC_UL320_.jpg;https://www.amazon.in/Teraiyas-Mirror-Storage-Premium-Cutting/dp/B0BQR3BM9H/ref=sr_1_4638?qid=1679212983&s=kitchen&sr=1-4638;;;659.0;800.0;Teraiya’s
Amazon Brand - Solimo Aztec Engineered Wood Wall Mounted TV/Entertainment Unit (Wenge);home & kitchen;Furniture;https://m.media-amazon.com/images/I/710MWSusoSL._AC_UL320_.jpg;https://www.amazon.in/Aztec-TV-Unit-no-12-Unit-n/dp/B08HV7YB32/ref=sr_1_4639?qid=1679212983&s=kitchen&sr=1-4639;2.9;13.0;1249.0;1800.0;Amazon
Remsy-2 Piece Luxury HR Foam Dining Chair Office Chair Floor Square Cushion Pad/car seat Cushions Soft & Comfortable Sitti...;home & kitchen;Furniture;https://m.media-amazon.com/images/I/619xG6eGybL._AC_UL320_.jpg;https://www.amazon.in/Remsy-2-Cushions-Comfortable-12x12x1-65-inch-Grey/dp/B0B67665MF/ref=sr_1_4640?qid=1679212983&s=kitchen&sr=1-4640;4.0;32.0;589.0;1050.0;Remsy-2
Innovative Design Well Furnished Sofa Rocking Chair Armchair Single Seater Sofa Set Accent Chair 3X Comfortable Luxury for...;home & kitchen;Furniture;https://m.media-amazon.com/images/I/61n9Rlpx1tL._AC_UL320_.jpg;https://www.amazon.in/Innovative-Furnished-Rocking-Armchair-Comfortable/dp/B0BV72171B/ref=sr_1_4641?qid=1679212983&s=kitchen&sr=1-4641;;;;;Innovative
Callas Adjustable Portable Multi-Purpose Office Laptop Table Desk Organiser with Cooling Fan | Study Table/Bed Table/Folda...;home & kitchen;Furniture;https://m.media-amazon.com/images/I/51xoFZBtb9L._AC_UL320_.jpg;https://www.amazon.in/Callas-Adjustable-Multi-Purpose-Organiser-CA6-Fan-Black-Office/dp/B0BBW2N28M/ref=sr_1_4642?qid=1679212983&s=kitchen&sr=1-4642;4.6;9.0;1397.0;2099.0;Callas
Logickart Floating Bookshelf for Kids Invisible Shelf - Metal Book Shelf for Wall Decor Book Lovers - Bookshelf Floating B...;home & kitchen;Furniture;https://m.media-amazon.com/images/I/7105pDeIAhL._AC_UL320_.jpg;https://www.amazon.in/Logickart-Floating-Bookshelf-Invisible-Shelf/dp/B0BRVXFMSQ/ref=sr_1_4643?qid=1679212983&s=kitchen&sr=1-4643;4.0;4.0;499.0;999.0;Logickart
Sattva Chair Style Bean Bag XXXL Bean Bag Filled (with Beans) - Red*;home & kitchen;Furniture;https://m.media-amazon.com/images/I/81ndLSypFQL._AC_UL320_.jpg;https://www.amazon.in/Sattva-Chair-Style-Filled-Beans/dp/B08336Q29S/ref=sr_1_4644?qid=1679212983&s=kitchen&sr=1-4644;4.0;485.0;1952.0;2196.0;Sattva
KITHANIA VIP Director Principal Manager Office Visitor Study Chair with arm Rest with Steel Frame and Cushion seat Back, C...;home & kitchen;Furniture;https://m.media-amazon.com/images/I/71fnmtKGpqL._AC_UL320_.jpg;https://www.amazon.in/KITHANIA-Director-Principal-Manager-Visitor/dp/B09RZJ4HYF/ref=sr_1_4645?qid=1679212983&s=kitchen&sr=1-4645;5.0;1.0;5999.0;11999.0;KITHANIA
HARIHUB Portable Outdoor Mini Waterproof Cloth Folding Chair/Stool for Camping Fishing Party BBQ Travel Hiking Beach Garde...;home & kitchen;Furniture;https://m.media-amazon.com/images/I/61uo-+KAqFL._AC_UL320_.jpg;https://www.amazon.in/HARIHUB-Portable-Outdoor-Waterproof-Folding/dp/B08R2VRF1M/ref=sr_1_4646?qid=1679212983&s=kitchen&sr=1-4646;3.8;78.0;499.0;699.0;HARIHUB
MARC Center Plastic Table for Home, Office & Outdoor Good Grade , Brown;home & kitchen;Furniture;https://m.media-amazon.com/images/I/31ybA9hcjxL._AC_UL320_.jpg;https://www.amazon.in/MARC-Center-Plastic-Office-Outdoor/dp/B08PZ9T5N9/ref=sr_1_4647?qid=1679212983&s=kitchen&sr=1-4647;3.4;75.0;1749.0;2400.0;MARC
Cane Arts Hanging Chair Wooden Bamboo 100% Cane (Bait) for Comfort Indoor & Outdoor Swing Chair for Kids, Adults 100 Kg;home & kitchen;Furniture;https://m.media-amazon.com/images/I/81bSc1q4NeL._AC_UL320_.jpg;https://www.amazon.in/Cane-Arts-Hanging-Comfort-Outdoor/dp/B09PLBBXH7/ref=sr_1_4648?qid=1679212983&s=kitchen&sr=1-4648;3.6;36.0;3999.0;9999.0;Cane
Oumffy Shoe Rack Storage Organizer - 10-Shelves DIY Shoe Rack Organizer/Multi-Purpose Plastic 10 Shelves Portable and Fold...;home & kitchen;Furniture;https://m.media-amazon.com/images/I/718Oi-NSYcL._AC_UL320_.jpg;https://www.amazon.in/Oumffy-Shoe-Rack-Storage-Organizer/dp/B09CL4VGPD/ref=sr_1_4649?qid=1679212983&s=kitchen&sr=1-4649;3.6;215.0;2699.0;8586.0;Oumffy
Raj Furniture Plastic Dagra/ Dala, Red;home & kitchen;Furniture;https://m.media-amazon.com/images/I/41PIud0xiyL._AC_UL320_.jpg;https://www.amazon.in/Raj-Furniture-Plastic-Dagra-Dala/dp/B08J7XXHGN/ref=sr_1_4650?qid=1679212983&s=kitchen&sr=1-4650;4.1;30.0;394.0;799.0;Raj
Urban Art Store Solid Wood & Iron Garden,Balcony Swing, Hammock, Jhula, Cradle (Black)(2 Seater);home & kitchen;Furniture;https://m.media-amazon.com/images/I/61BEQojH53L._AC_UL320_.jpg;https://www.amazon.in/Urban-Art-Store-Balcony-Hammock/dp/B08L1W463H/ref=sr_1_4651?qid=1679212983&s=kitchen&sr=1-4651;4.6;185.0;18499.0;25000.0;Urban
Royalist Bathroom Corner Shelf Super Clear, Corner Shelves Unbreakable (Set 3, 8 × 8);home & kitchen;Furniture;https://m.media-amazon.com/images/I/71ck5-1UMOL._AC_UL320_.jpg;https://www.amazon.in/Royalist-Bathroom-Shelf-Shelves-Unbreakable/dp/B0BTD4Q8GV/ref=sr_1_4652?qid=1679212983&s=kitchen&sr=1-4652;;;899.0;1499.0;Royalist
AARAM CHARPAI UDYOG Niwar Folding Metal Single Bed For Sleeping With Bed Head Pillow Support 6 Leg Support Space Saving Co...;home & kitchen;Furniture;https://m.media-amazon.com/images/I/61wHq75FRqL._AC_UL320_.jpg;https://www.amazon.in/AARAM-CHARPAI-UDYOG-Niwar-Multipurpose/dp/B09P18T947/ref=sr_1_4653?qid=1679212983&s=kitchen&sr=1-4653;3.2;69.0;1799.0;2199.0;AARAM
AVS Baby Sofa with Cute Design|Supporting Seat|Soft Plush Kids Toy| Baby Cushion Sofa Chair - Red;home & kitchen;Furniture;https://m.media-amazon.com/images/I/61HhE6hk8IL._AC_UL320_.jpg;https://www.amazon.in/AVS/dp/B08MQS5CVH/ref=sr_1_4654?qid=1679212983&s=kitchen&sr=1-4654;3.5;70.0;;;AVS
Bean Bag Refill/Filler Half kg Bag (500g);home & kitchen;Furniture;https://m.media-amazon.com/images/I/51OzEbNpA6L._AC_UL320_.jpg;https://www.amazon.in/Bean-Bag-Refill-Filler-Half/dp/B09G7BC6M2/ref=sr_1_4655?qid=1679212983&s=kitchen&sr=1-4655;3.9;12.0;413.0;699.0;Bean
90 Degree 20 Pcs 2 Inch Dia Small Round Glass Pieces Decoration Mirror for Craft Home Mirror Wall Decoration Decorative ( ...;home & kitchen;Furniture;https://m.media-amazon.com/images/I/51M9EXAavRL._AC_UL320_.jpg;https://www.amazon.in/90-Degree-Round-Decoration-Decorative/dp/B0B9Y4FZ96/ref=sr_1_4656?qid=1679212983&s=kitchen&sr=1-4656;5.0;1.0;400.0;600.0;90
A vintage Affair Decorative Wall Mirror Antique Hanging Design Small Size Oval For Bedroom Bathroom Living Room Office Copper;home & kitchen;Furniture;https://m.media-amazon.com/images/W/IMAGERENDERING_521856-T2/images/I/71FUOjrkmGL._AC_UL320_.jpg;https://www.amazon.in/Vintage-Affair-Antique-Abstract-Hanging/dp/B07J355T3R/ref=sr_1_4777?qid=1679212985&s=kitchen&sr=1-4777;3.4;5.0;949.0;999.0;A
SUNNYCRAFT Multipurpose Computer Table Study Table (90x60x75cm) Modern Sturdy Desk Laptop Table for Home & Office(Materia...;home & kitchen;Furniture;https://m.media-amazon.com/images/W/IMAGERENDERING_521856-T2/images/I/71+MpzJAReL._AC_UL320_.jpg;https://www.amazon.in/SUNNYCRAFT-Multipurpose-Computer-90x60x75cm-Modern/dp/B09NXPP5LH/ref=sr_1_4778?qid=1679212985&s=kitchen&sr=1-4778;3.5;58.0;2650.0;4999.0;SUNNYCRAFT
Agirav Multipurpose Laptop Table with Dock Stand & Non-Slip Legs Foldable and Portable Lapdesk for Study & Bed (Random Col...;home & kitchen;Furniture;https://m.media-amazon.com/images/W/IMAGERENDERING_521856-T2/images/I/51QQ87vbHcL._AC_UL320_.jpg;https://www.amazon.in/Generic-LTT-0013-Multipurpose-Non-Slip-Foldable/dp/B08ZDHNP3N/ref=sr_1_4779?qid=1679212985&s=kitchen&sr=1-4779;3.7;1640.0;589.0;799.0;Agirav
NIHARA Smart Multipurpose Foldable Laptop Table with Cup Holder, Study Table, Bed Table, Breakfast Table, Foldable and Por...;home & kitchen;Furniture;https://m.media-amazon.com/images/W/IMAGERENDERING_521856-T2/images/I/51OqQfNzLwL._AC_UL320_.jpg;https://www.amazon.in/NIHARA-Multipurpose-Foldable-Breakfast-Portable/dp/B0B9C4STSC/ref=sr_1_4780?qid=1679212985&s=kitchen&sr=1-4780;3.6;126.0;219.0;999.0;NIHARA
Cello Orchid Center Trolley Plastic Table (Matte Brown);home & kitchen;Furniture;https://m.media-amazon.com/images/W/IMAGERENDERING_521856-T2/images/I/91wI1ptPZyL._AC_UL320_.jpg;https://www.amazon.in/Cello-Orchid-Center-Table-Brown/dp/B01LPR2RDY/ref=sr_1_4781?qid=1679212985&s=kitchen&sr=1-4781;4.2;4213.0;;1395.0;Cello
RONFILD Stainless Steel Self Adhesive 4 Arm Bathroom Swing Hanger Towel Rack/Holder for Bathroom/Towel Stand/Rotating Towe...;home & kitchen;Furniture;https://m.media-amazon.com/images/W/IMAGERENDERING_521856-T2/images/I/61sIFxPbmTS._AC_UL320_.jpg;https://www.amazon.in/RONFILD-Stainless-Adhesive-Bathroom-Accessories/dp/B098TWWW2X/ref=sr_1_4782?qid=1679212985&s=kitchen&sr=1-4782;4.6;2.0;239.0;699.0;RONFILD
Honey Touch® Metal Folding Bed Single Size with Double Layer Mattress for Sleeping Guest Bed Easily Storable (Soft, 36in x...;home & kitchen;Furniture;https://m.media-amazon.com/images/W/IMAGERENDERING_521856-T2/images/I/819FrHboVLL._AC_UL320_.jpg;https://www.amazon.in/Honey-Touch-Metal-Folding-Mattress/dp/B09ZDYB4PP/ref=sr_1_4783?qid=1679212985&s=kitchen&sr=1-4783;4.1;50.0;7219.0;10000.0;Honey
HANDY Stainless Steel Round Bathroom Shelf Bathroom Accessories Shelves Multi-Purpose Shelf for Kitchen Shelf Bedroom Home...;home & kitchen;Furniture;https://m.media-amazon.com/images/W/IMAGERENDERING_521856-T2/images/I/51bWYWGawmL._AC_UL320_.jpg;https://www.amazon.in/Stainless-Bathroom-Shelves-Mounted-Storage/dp/B08H5HDB5G/ref=sr_1_4784?qid=1679212985&s=kitchen&sr=1-4784;4.1;105.0;599.0;1599.0;HANDY
Wipro Furniture Fabric Ergonomic Office Chairs (Black);home & kitchen;Furniture;https://m.media-amazon.com/images/W/IMAGERENDERING_521856-T2/images/I/61D-+JwwuQL._AC_UL320_.jpg;https://www.amazon.in/Wipro-Furniture-Smart-Cushioned-Adjustable/dp/B07XVVNC7Q/ref=sr_1_4785?qid=1679212985&s=kitchen&sr=1-4785;4.2;431.0;9100.0;14400.0;Wipro
Priti Engineered Wood Console Table | End Table Side Table Console Table for Living Room Hall Bedroom Office | Multipurpos...;home & kitchen;Furniture;https://m.media-amazon.com/images/W/IMAGERENDERING_521856-T2/images/I/41Lyqy+8gXL._AC_UL320_.jpg;https://www.amazon.in/Priti-Engineered-Console-Bedroom-Multipurpose/dp/B0B5HB3LHD/ref=sr_1_4786?qid=1679212985&s=kitchen&sr=1-4786;2.1;5.0;;7999.0;Priti
Amazon Brand - Solimo XL Faux Leather Bean Bag Cover Without Beans (Red and Black);home & kitchen;Furniture;https://m.media-amazon.com/images/W/IMAGERENDERING_521856-T2/images/I/71c4kiOuIyL._AC_UL320_.jpg;https://www.amazon.in/Amazon-Brand-Solimo-Cover-Without/dp/B08BGLRTPB/ref=sr_1_4787?qid=1679212985&s=kitchen&sr=1-4787;3.8;313.0;499.0;999.0;Amazon
Klaxon Javi 2 Tier Wood & Metal Wall Shelf for Home Decor, Kitchen, Living Room Wall Rack | Multipurpose Wall Mounted Shel...;home & kitchen;Furniture;https://m.media-amazon.com/images/W/IMAGERENDERING_521856-T2/images/I/71lRLAbudDL._AC_UL320_.jpg;https://www.amazon.in/Klaxon-Javi-Kitchen-Multipurpose-Mounted/dp/B09QSP9F37/ref=sr_1_4788?qid=1679212985&s=kitchen&sr=1-4788;3.8;21.0;1799.0;2998.0;Klaxon
"Elegant Arts and Frames Frameless Square Decorative LED Mirror 36"" x 24"" Branded 14 kv Water Resistant LED with Hooks - Mi...";home & kitchen;Furniture;https://m.media-amazon.com/images/W/IMAGERENDERING_521856-T2/images/I/71Vg9BTkqUL._AC_UL320_.jpg;https://www.amazon.in/Elegant-Frames-Frameless-Rectangular-Decorative/dp/B08ZDDJ68H/ref=sr_1_4789?qid=1679212985&s=kitchen&sr=1-4789;;;11779.0;21339.0;Elegant
DINNINGWALE Heavy Duty Black Leatherite Seat Chrome Polish Ring Steel Garden Chairs Set 4 Steel Ring;home & kitchen;Furniture;https://m.media-amazon.com/images/W/IMAGERENDERING_521856-T2/images/I/41SzeoaGE5L._AC_UL320_.jpg;https://www.amazon.in/DINNINGWALE-Leatherite-Chrome-Polish-Garden/dp/B0BTJ2VVWY/ref=sr_1_4790?qid=1679212985&s=kitchen&sr=1-4790;;;4999.0;9999.0;DINNINGWALE
Klaxon Avery 3 Tier Wood & Metal Wall Shelf for Home Decor, Kitchen, Living Room Wall Rack | Multipurpose Wall Mounted She...;home & kitchen;Furniture;https://m.media-amazon.com/images/W/IMAGERENDERING_521856-T2/images/I/71sJNHSPQzL._AC_UL320_.jpg;https://www.amazon.in/Klaxon-Avery-Tier-Kitchen-Multipurpose/dp/B09SFXXGNG/ref=sr_1_4791?qid=1679212985&s=kitchen&sr=1-4791;3.5;9.0;1949.0;3459.0;Klaxon
Nilkamal CNTBL1C Contemporary Center Coffee Table/Tea Table/Teapoy for Home/Living Room/Office & Outdoor (Plastic);home & kitchen;Furniture;https://m.media-amazon.com/images/W/IMAGERENDERING_521856-T2/images/I/513rmBIKW-L._AC_UL320_.jpg;https://www.amazon.in/Nilkamal-Center-Table-Cane-Glass/dp/B09RF4V3WF/ref=sr_1_4792?qid=1679212985&s=kitchen&sr=1-4792;5.0;2.0;2785.0;3000.0;Nilkamal
Home furniture Wooden 3 Seater Sofa Set for Living Room and Office (Cream Colour Cushion,Teak Finish);home & kitchen;Furniture;https://m.media-amazon.com/images/W/IMAGERENDERING_521856-T2/images/I/51tI1HYW7bS._AC_UL320_.jpg;https://www.amazon.in/Home-furniture-Wooden-Living-Office/dp/B0952675DG/ref=sr_1_4793?qid=1679212985&s=kitchen&sr=1-4793;4.4;30.0;13999.0;25999.0;Home
Kuber Industries Microfiber Square Chair Pad/Cushion for Office|Home or Car Sitting with Ties|Size 45 x 45 x 1 CM|Pack of ...;home & kitchen;Furniture;https://m.media-amazon.com/images/W/IMAGERENDERING_521856-T2/images/I/812m3WhUIKS._AC_UL320_.jpg;https://www.amazon.in/Kuber-Industries-Microfiber-Cushion-Ties-Pack/dp/B092DP86GD/ref=sr_1_4794?qid=1679212985&s=kitchen&sr=1-4794;3.8;297.0;570.0;1399.0;Kuber
Nilkamal Jungle Kids Plastic Chair (Yellow and Red);home & kitchen;Furniture;https://m.media-amazon.com/images/W/IMAGERENDERING_521856-T2/images/I/41FwJEOQK8L._AC_UL320_.jpg;https://www.amazon.in/Nilkamal-Jungle-Kids-Chair-Yellow/dp/B014899324/ref=sr_1_4795?qid=1679212985&s=kitchen&sr=1-4795;2.4;12.0;491.11;700.0;Nilkamal
Brownie 2 inch Double Bed Foldable Multipurpose 4 Folding Mattress for Travelling , Pinic , Home Use Extra Guest Bed , Lig...;home & kitchen;Furniture;https://m.media-amazon.com/images/W/IMAGERENDERING_521856-T2/images/I/61xKVaa9icL._AC_UL320_.jpg;https://www.amazon.in/BROWNIE-Single-Folding-Mattress-72x48x2/dp/B096VGPYZ2/ref=sr_1_4796?qid=1679212985&s=kitchen&sr=1-4796;3.0;28.0;1499.0;1999.0;Brownie
Cello Novelty Big Plastic Shoe Rack with Lock(Sandalwood Brown);home & kitchen;Furniture;https://m.media-amazon.com/images/W/IMAGERENDERING_521856-T2/images/I/81SOHbs5uuL._AC_UL320_.jpg;https://www.amazon.in/Cello-Novelty-Shoe-Rack-Colour-Wood/dp/B01MU6WLTN/ref=sr_1_4797?qid=1679212985&s=kitchen&sr=1-4797;4.2;171.0;5186.0;7640.0;Cello Novelty Big
Ginoya brothers Wooden Coat Rack and Shoe Rack, Entryway Coat Rack Hallway Bench Storage Organizer with Hooks for Living R...;home & kitchen;Furniture;https://m.media-amazon.com/images/W/IMAGERENDERING_521856-T2/images/I/31a7LBG2yNL._AC_UL320_.jpg;https://www.amazon.in/brothers-Entryway-Hallway-Storage-Organizer/dp/B0BPCN3D2X/ref=sr_1_4798?qid=1679212985&s=kitchen&sr=1-4798;2.5;2.0;1709.0;2999.0;Ginoya
Royal interiors Queen Size Metal Bed With Hydraulic Storage in Ivory (Matte Finish);home & kitchen;Furniture;https://m.media-amazon.com/images/W/IMAGERENDERING_521856-T2/images/I/31HaOYyWNTL._AC_UL320_.jpg;https://www.amazon.in/Royal-Interiors-Finish-Hydraulic-Storage/dp/B077NZKF28/ref=sr_1_4799?qid=1679212985&s=kitchen&sr=1-4799;3.6;19.0;21389.0;41029.0;Royal
Sung Wood Art Set top Box Stand/WiFi Stand/WiFi Router Holder Wooden Wall Shelves for Home Living Room Furniture (Black);home & kitchen;Furniture;https://m.media-amazon.com/images/W/IMAGERENDERING_521856-T2/images/I/51-EiY0apnL._AC_UL320_.jpg;https://www.amazon.in/Router-Holder-Wooden-Shelves-Furniture/dp/B0BPPTJPKW/ref=sr_1_4800?qid=1679212985&s=kitchen&sr=1-4800;1.0;2.0;;;Sung
Planet Platinum Stainless Steel Folding Towel Rack;home & kitchen;Furniture;https://m.media-amazon.com/images/I/61EYawTu9AL._AC_UL320_.jpg;https://www.amazon.in/Planet-Platinum-Grade-Stainless-Folding/dp/B01HZ8XJUC/ref=sr_1_5569?qid=1679212995&s=kitchen&sr=1-5569;4.2;859.0;1199.0;3249.0;Planet
Snazzy Bamboo Wood Foldable Portable Adjustable Height Laptop Table/Study Table/Writing Laptop Standing Desk, Foldable Lap...;home & kitchen;Furniture;https://m.media-amazon.com/images/I/51mIFAADKvL._AC_UL320_.jpg;https://www.amazon.in/Snazzy-Bamboo-Foldable-Laptop-Cooling/dp/B083FM13VC/ref=sr_1_5570?qid=1679212995&s=kitchen&sr=1-5570;3.9;94.0;1665.0;2199.0;Snazzy
CASE PLUS Wooden Wall Shelves Corner Hanging Shelf for Living Room Stylish, Home Decor Floating Display Rack Storage Organ...;home & kitchen;Furniture;https://m.media-amazon.com/images/I/51ySh1vpDtL._AC_UL320_.jpg;https://www.amazon.in/CASE-PLUS-Shelves-Floating-Organizer/dp/B0BSNPFZPN/ref=sr_1_5571?qid=1679212995&s=kitchen&sr=1-5571;4.5;51.0;749.0;4999.0;CASE
Bnezz - Self Adhesive Wall Mirror Stickers Big Size (30x20) Cm Frameless Mirror for Wall Stickers | Mirror for Bathroom | ...;home & kitchen;Furniture;https://m.media-amazon.com/images/I/51zyzk9XSVL._AC_UL320_.jpg;https://www.amazon.in/Bnezz-Adhesive-Stickers-Frameless-T-BasinMirror/dp/B0BW71V6BR/ref=sr_1_5572?qid=1679212995&s=kitchen&sr=1-5572;;;199.0;849.0;Bnezz
Modern Design Drop Shape Glass Led Wall Mirror with Touch Sensor + White Light 18x24;home & kitchen;Furniture;https://m.media-amazon.com/images/I/31SrG+2N7bL._AC_UL320_.jpg;https://www.amazon.in/Modern-Design-Shape-Mirror-Sensor/dp/B0B73Y8PHY/ref=sr_1_5573?qid=1679212995&s=kitchen&sr=1-5573;3.9;18.0;2600.0;5000.0;Modern
PUM PUM Eco Soft Single Size Light Weight Foldable Cotton Mattress (72x36 Inch);home & kitchen;Furniture;https://m.media-amazon.com/images/I/61AL9P2WMVL._AC_UL320_.jpg;https://www.amazon.in/PumPum-Single-Foldable-Cotton-Mattress/dp/B09HMVP88G/ref=sr_1_5574?qid=1679212995&s=kitchen&sr=1-5574;3.4;828.0;649.0;999.0;PUM
Plantex Stainless Steel Wall Mount 2 Tier Bathroom Shelf/Double Towel Rack for Bathroom/Towel Stand/Bathroom Accessories (...;home & kitchen;Furniture;https://m.media-amazon.com/images/I/51EhF9JpRqL._AC_UL320_.jpg;https://www.amazon.in/Plantex-Stainless-Bathroom-Accessories-Chrome-Silver/dp/B084JR86VP/ref=sr_1_5575?qid=1679212995&s=kitchen&sr=1-5575;3.9;207.0;1899.0;4899.0;Plantex
DecorDen Hexagonal Wall Shelf Engineered Wooden Floating Shelves for Living Room/Display Wall Shelf/Wall Rack/Bookshelf/Wa...;home & kitchen;Furniture;https://m.media-amazon.com/images/I/519QBFwECxL._AC_UL320_.jpg;https://www.amazon.in/DecorDen-Hexagonal-Engineered-Floating-Bookshelf/dp/B09CDD2RQK/ref=sr_1_5576?qid=1679212995&s=kitchen&sr=1-5576;3.6;27.0;790.0;2199.0;DecorDen
Bi3 Multipurpose Laptop Study Table Strong Top 6 Heights 3 Angles Portable Adjustable Foldable (Metal);home & kitchen;Furniture;https://m.media-amazon.com/images/I/61g7Gi+tauL._AC_UL320_.jpg;https://www.amazon.in/Adjustable-Strong-Multipurpose-Portable-Laptop/dp/B084T34JYX/ref=sr_1_5577?qid=1679212995&s=kitchen&sr=1-5577;4.3;889.0;1520.0;2799.0;Bi3
LUXURY DECORATIVE EYE Wooden Assembled Dressing Table With Shelves, Full Length Mirror And Storage Box (Walnut);home & kitchen;Furniture;https://m.media-amazon.com/images/I/61asFkQWB-L._AC_UL320_.jpg;https://www.amazon.in/Decorative-Engineered-Dressing-Shelves-Storage/dp/B09SL8PW8W/ref=sr_1_5578?qid=1679212995&s=kitchen&sr=1-5578;4.6;4.0;6000.0;12999.0;LUXURY
MTANK Engineered Wood Side Table for Bedroom Triangle Nesting Table Bamboo End Table for Living Room Modern Coffee Table O...;home & kitchen;Furniture;https://m.media-amazon.com/images/I/81-e72h-2PL._AC_UL320_.jpg;https://www.amazon.in/Nesting-Coffee-Tables-Modern-Office/dp/B08RY2C22H/ref=sr_1_5579?qid=1679212995&s=kitchen&sr=1-5579;3.7;195.0;2821.0;7999.0;MTANK
Dr. Smith Orthopedic Mattress Washable Fabric Three Seater Sofa Cum Bed with Four Printed Cushion (Dark Black);home & kitchen;Furniture;https://m.media-amazon.com/images/I/61zaH6kfNVL._AC_UL320_.jpg;https://www.amazon.in/Dr-Smith-Orthopedic-Mattress-Washable/dp/B09Z1SFJYC/ref=sr_1_5580?qid=1679212995&s=kitchen&sr=1-5580;4.3;12.0;8999.0;18999.0;Dr.
NPPL National King Chair with Fully Orthopaedic Comfortable Back (Weight Bearing Capacity 200 kgs)(3 Years Warranty on Man...;home & kitchen;Furniture;https://m.media-amazon.com/images/I/71DXAhcHKcL._AC_UL320_.jpg;https://www.amazon.in/NPPL-National-Orthopaedic-Comfortable-Manufacturing/dp/B09TTJ41B1/ref=sr_1_5581?qid=1679212995&s=kitchen&sr=1-5581;4.3;22.0;3699.0;4999.0;NPPL
GREEN WOODEN Wooden Chair Sheesham Wood Dining Chairs Set of 4 | Dining Chair Only | Outdoor and Garden Chair | Home Offic...;home & kitchen;Furniture;https://m.media-amazon.com/images/I/71FJGg2NESL._AC_UL320_.jpg;https://www.amazon.in/GREEN-WOODEN-Sheesham-Outdoor-Furniture/dp/B0BSLNM62S/ref=sr_1_5582?qid=1679212995&s=kitchen&sr=1-5582;;;10999.0;20000.0;GREEN
Furnelift Wooden Wall Mounted Wine Rack and Bar Cabinet with Glass Storage - Upside Down Bottom Lift Glass Hanging Organiz...;home & kitchen;Furniture;https://m.media-amazon.com/images/I/7104mjBwQ0L._AC_UL320_.jpg;https://www.amazon.in/Furnelift-Wooden-Mounted-Cabinet-Storage/dp/B0BQWVCCR6/ref=sr_1_5583?qid=1679212995&s=kitchen&sr=1-5583;5.0;1.0;3309.0;6999.0;Furnelift
Silver Crafts Jaddy Wooden Wall Hanging Design Mini Bar Cabinet For Home Solid Wood Make Wine Storage Cabinet With Glass H...;home & kitchen;Furniture;https://m.media-amazon.com/images/I/61Kgl1P5ktL._AC_UL320_.jpg;https://www.amazon.in/Hanging-Cabinet-Storage-Natural-SilverCrafts/dp/B09PZB91SS/ref=sr_1_5584?qid=1679212995&s=kitchen&sr=1-5584;4.2;29.0;1699.0;3900.0;Silver
Multipurpose Bathroom Accessories Kitchen Bathroom Shelf Wall Holder Storage Rack Bathro0om Organizer Rack Storage Box Str...;home & kitchen;Furniture;https://m.media-amazon.com/images/I/719ZSM+hAzS._AC_UL320_.jpg;https://www.amazon.in/Multipurpose-Kitchen-Bathroom-Organizer-Adhesive/dp/B095C71PG5/ref=sr_1_5585?qid=1679212995&s=kitchen&sr=1-5585;3.6;326.0;338.0;1599.0;Multipurpose
Patiofy Royal Maharaja Jhula/Swing for Adult/Swing for Balcony/Swing for Home/Hanging Swing Chair/Zula for Home Adults Bal...;home & kitchen;Furniture;https://m.media-amazon.com/images/I/71UknLbkeVL._AC_UL320_.jpg;https://www.amazon.in/Patiofy-Maharaja-Balcony-Capacity-Included-White/dp/B0B7ZQJN62/ref=sr_1_5586?qid=1679212995&s=kitchen&sr=1-5586;3.6;7.0;2999.0;9999.0;Patiofy
